listing_id,suburb,postcode,weekly_rent,bond,available_date,date_listed,days_listed,bedrooms,bathrooms,carspaces,property_type,address,lat,lon,scraped_date,domain_page_id,property_id,photo_count,video_count,floorplans_count,virtual_tour,primary_type,secondary_type,agency,agency_id,agent_names,structured_features,url
13555876,BELMONT,3216,460.0,,"Friday, 22 August 2025",2025-08-22,18,2,2,1.0,Townhouse,2/258 High Street,-38.18143,144.33565,2025-09-09 16:21:19,13555876,OX-9079-HG,15,0,0,False,Townhouse/Villa,Townhouse,VICCIVIC Real Estate,31399,"Jackson Chau, Amy Chau","Ducted Cooling, Ducted Heating, Kitchen, Built in wardrobes, Floorboards, Air conditioning, Dishwasher, Shed, Fully fenced, Laundry, Gas Hot Water",https://www.domain.com.au/2-258-high-street-belmont-vic-3216-13555876
14598353,BELMONT,3216,460.0,1840.0,"Monday, 06 October 2025",2025-09-05,4,3,1,3.0,House,39 Nagle Drive,-38.186077,144.3264,2025-09-09 16:21:19,14598353,JF-3636-PR,12,0,1,False,House,House,HallSullivan Estate Agents,7043,Kathryn Weddell,"Air conditioning, Built in wardrobes, Secure Parking, Heating, Dishwasher",https://www.domain.com.au/39-nagle-drive-belmont-vic-3216-14598353
17099541,BELMONT,3216,320.0,1390.0,"Monday, 22 September 2025",2025-08-29,11,1,1,1.0,House,9/159 Roslyn Road,-38.174572,144.33344,2025-09-09 16:21:19,17099541,NQ-0057-IM,6,1,0,False,House,House,Ray White Highton,18426,Chris Walsh,,https://www.domain.com.au/9-159-roslyn-road-belmont-vic-3216-17099541
17718052,BELMONT,3216,420.0,1825.0,"Saturday, 04 October 2025",2025-08-15,25,2,1,1.0,Apartment / Unit / Flat,2/32 Elsvern Avenue,-38.17313,144.32619,2025-09-09 16:21:19,17718052,,12,0,1,False,Apartment,Apartment / Unit / Flat,Buxton Newtown,14503,"Mia Griffiths, Sophie Kennedy-Rush","Internal Laundry, Split System Air Con, Split System Heating, Built in wardrobes, Garden / Courtyard, Floorboards",https://www.domain.com.au/2-32-elsvern-avenue-belmont-vic-3216-17718052
17722055,BELMONT,3216,400.0,1738.0,"Friday, 29 August 2025",2025-08-19,21,2,1,1.0,House,1/29 Watson Av,-38.178795,144.33472,2025-09-09 16:21:19,17722055,,12,0,0,False,House,House,Barry Plant Belmont,27306,Belmont Inspections,"Built in wardrobes, Split-System Air Con, Split-System Heating",https://www.domain.com.au/1-29-watson-av-belmont-vic-3216-17722055
17722465,BELMONT,3216,165.0,330.0,"Monday, 18 August 2025",2025-08-19,21,7,3,4.0,House,"Room 2, 16 Grayling Street",-38.183266,144.35138,2025-09-09 16:21:19,17722465,,3,0,0,False,House,House,Hayeswinckle Highton,18314,"Emily Johnstone, Keely Duggan","Built in wardrobes, Internal Laundry, Broadband internet access, Heating, Study",https://www.domain.com.au/room-2-16-grayling-street-belmont-vic-3216-17722465
17729879,BELMONT,3216,410.0,1782.0,"Monday, 29 September 2025",2025-08-25,15,2,1,1.0,Apartment / Unit / Flat,5/5 Leonard Street,-38.17089,144.33139,2025-09-09 16:21:19,17729879,,6,0,0,False,Apartment,Apartment / Unit / Flat,Stockdale & Leggo South Barwon,25535,"Sonia Jenkins, Ashlea Smith","Internal Laundry, Heating, Air conditioning, Built in wardrobes",https://www.domain.com.au/5-5-leonard-street-belmont-vic-3216-17729879
17737861,BELMONT,3216,575.0,2498.0,"Monday, 06 October 2025",2025-08-29,11,3,2,2.0,Apartment / Unit / Flat,3/13 Herd Rd,-38.172848,144.34854,2025-09-09 16:21:19,17737861,,6,0,1,False,Apartment,Apartment / Unit / Flat,Stockdale & Leggo South Barwon,25535,"Annie Kinross, Ashlea Smith","Intercom, Ensuite, Alarm System, Secure Parking, Balcony / Deck, Garden / Courtyard, Dishwasher, Gas Heating, Out door entertaining area, Internal Laundry",https://www.domain.com.au/3-13-herd-rd-belmont-vic-3216-17737861
17738873,BELMONT,3216,440.0,1911.0,"Friday, 03 October 2025",2025-08-29,11,2,1,1.0,Apartment / Unit / Flat,6/57 Mount Pleasant Road,-38.17092,144.34079,2025-09-09 16:21:19,17738873,,8,0,0,True,Apartment,Apartment / Unit / Flat,McGrath Geelong | Newtown,5797,Hannah Raguse,"Built in wardrobes, Secure Parking, Bath, Heating, Air conditioning",https://www.domain.com.au/6-57-mount-pleasant-road-belmont-vic-3216-17738873
17739700,BELMONT,3216,400.0,1738.0,"Monday, 29 September 2025",2025-09-01,8,2,1,1.0,Apartment / Unit / Flat,5/62 James Street,-38.18318,144.33717,2025-09-09 16:21:19,17739700,,8,0,0,False,Apartment,Apartment / Unit / Flat,Stockdale & Leggo South Barwon,25535,Julianne Anderson,"Built in wardrobes, Internal Laundry, Heating",https://www.domain.com.au/5-62-james-street-belmont-vic-3216-17739700
17742452,BELMONT,3216,580.0,2320.0,"Friday, 03 October 2025",2025-09-02,7,3,2,2.0,House,19 Nott Street,-38.1855,144.3348,2025-09-09 16:21:19,17742452,,11,0,0,False,House,House,Maxwell Collins Real Estate,12185,William Doyle,"Gas, Secure Parking, Dishwasher, Air conditioning, Heating, Close to transport, Close to shops, Close to schools",https://www.domain.com.au/19-nott-street-belmont-vic-3216-17742452
17743543,BELMONT,3216,460.0,1993.0,"Thursday, 09 October 2025",2025-09-02,7,2,1,1.0,House,38 Francis Street,-38.175224,144.34874,2025-09-09 16:21:19,17743543,,10,0,0,True,House,House,Gartland,11825,Gartland Leasing,"Built in wardrobes, Secure Parking, Heating, Fully fenced",https://www.domain.com.au/38-francis-street-belmont-vic-3216-17743543
17744126,BELMONT,3216,620.0,2694.0,"Thursday, 02 October 2025",2025-09-02,6,3,2,2.0,House,42 Mt Pleasant Road,-38.170567,144.34427,2025-09-09 16:21:19,17744126,,8,0,2,False,House,House,McGrath Geelong | Newtown,5797,Rajesh Chaubay,"Secure Parking, Heating, Dishwasher, Air conditioning, Built in wardrobes",https://www.domain.com.au/42-mt-pleasant-road-belmont-vic-3216-17744126
17744997,BELMONT,3216,620.0,2480.0,"Wednesday, 03 September 2025",2025-09-03,6,3,2,2.0,Townhouse,3/5 Hazel Street,-38.17884,144.33334,2025-09-09 16:21:19,17744997,,9,0,0,False,Townhouse/Villa,Townhouse,Maxwell Collins Real Estate,12185,Jodie Ferguson,"Gas, Secure Parking, Balcony / Deck, Air conditioning, Heating, Built in wardrobes, Close to transport, Close to shops, Close to schools, Ensuite",https://www.domain.com.au/3-5-hazel-street-belmont-vic-3216-17744997
17747234,BELMONT,3216,480.0,2086.0,"Wednesday, 08 October 2025",2025-09-04,5,3,2,2.0,House,14 Fisher Avenue,-38.182213,144.3487,2025-09-09 16:21:19,17747234,,9,0,1,False,House,House,Stockdale & Leggo South Barwon,25535,"Annie Kinross, Ashlea Smith","Pets Allowed, Bath, Heating, Air conditioning, Garden / Courtyard, Dishwasher, Internal Laundry",https://www.domain.com.au/14-fisher-avenue-belmont-vic-3216-17747234
17749270,BELMONT,3216,430.0,1868.0,"Friday, 12 September 2025",2025-09-05,4,2,1,1.0,Apartment / Unit / Flat,4/145 Roslyn Road,-38.17505,144.33513,2025-09-09 16:21:19,17749270,,13,0,0,False,Apartment,Apartment / Unit / Flat,Buxton Highton Pty Ltd,16985,"Nneka Ononye, Sophie Kennedy-Rush","Air conditioning, Built in wardrobes, Internal Laundry, Heating",https://www.domain.com.au/4-145-roslyn-road-belmont-vic-3216-17749270
17749402,BELMONT,3216,445.0,1933.0,"Friday, 03 October 2025",2025-09-05,4,2,1,1.0,Apartment / Unit / Flat,1/16 The Avenue,-38.17134,144.3341,2025-09-09 16:21:19,17749402,,9,0,1,False,Apartment,Apartment / Unit / Flat,Barry Plant Geelong Sales,5005,Geelong Leasing,Secure Parking,https://www.domain.com.au/1-16-the-avenue-belmont-vic-3216-17749402
17751025,BELMONT,3216,450.0,1955.0,"Friday, 12 September 2025",2025-09-08,1,2,1,1.0,Apartment / Unit / Flat,1/7-8 Camdell Ct,-38.19051,144.33698,2025-09-09 16:21:19,17751025,,10,0,0,False,Apartment,Apartment / Unit / Flat,Barry Plant Belmont,27306,Belmont Inspections,"Secure Parking, Courtyard, Fully fenced, Built in wardrobes, Dishwasher, Gas Heating, Split-System Air Con",https://www.domain.com.au/1-7-8-camdell-ct-belmont-vic-3216-17751025
17753204,BELMONT,3216,340.0,1477.0,"Monday, 22 September 2025",2025-09-09,0,1,1,1.0,Apartment / Unit / Flat,3/33 Settlement Road,-38.18199,144.34853,2025-09-09 16:21:19,17753204,,11,0,0,False,Apartment,Apartment / Unit / Flat,Barry Plant Geelong Sales,5005,Geelong Leasing,"Secure Parking, Heating",https://www.domain.com.au/3-33-settlement-road-belmont-vic-3216-17753204
17754005,BELMONT,3216,440.0,1911.0,"Friday, 07 November 2025",2025-09-09,0,2,1,,Apartment / Unit / Flat,1/42 Sanglen Terrace,-38.17629,144.32324,2025-09-09 16:21:19,17754005,,8,0,0,False,Apartment,Apartment / Unit / Flat,Buxton Highton Pty Ltd,16985,"Nneka Ononye, Bec Di Blasio","Air conditioning, Built in wardrobes, Internal Laundry, Heating",https://www.domain.com.au/1-42-sanglen-terrace-belmont-vic-3216-17754005
16368748,BELMONT,3216,,760.0,"Monday, 13 March 2023",2023-05-10,852,3,1,3.0,House,41 Iona Avenue,-38.177193,144.3253,2025-09-09 16:21:25,16368748,ZP-1848-JU,12,0,0,False,House,House,OXBRIDGE GLOBAL REAL ESTATE,31498,Ashwani Sharma,"Secure Parking, Shed, Broadband Internet Available, Dishwasher, Floorboards",https://www.domain.com.au/41-iona-avenue-belmont-vic-3216-16368748
17591648,BELMONT,3216,490.0,212917.0,"Friday, 25 July 2025",2025-05-26,105,2,1,1.0,Apartment / Unit / Flat,4/367 High Street,-38.187958,144.32973,2025-09-09 16:21:25,17591648,QW-4418-CM,10,0,0,False,Apartment,Apartment / Unit / Flat,Gibson Property Services,30426,Rebecca Gibson,"Secure Parking, Balcony / Deck, Air conditioning, Floorboards, Ground floor, Built in wardrobes, Pets Allowed, Heating, Dishwasher",https://www.domain.com.au/4-367-high-street-belmont-vic-3216-17591648
17594306,BELMONT,3216,470.0,,"Thursday, 26 June 2025",2025-05-28,104,3,1,1.0,House,2 Charles Street,-38.184937,144.34233,2025-09-09 16:21:25,17594306,AO-9624-VK,8,0,1,False,House,House,Barry Plant Geelong Sales,5005,Geelong Leasing,"Built in wardrobes, Heating, Dishwasher, Balcony / Deck",https://www.domain.com.au/2-charles-street-belmont-vic-3216-17594306
17677260,BELMONT,3216,600.0,,"Wednesday, 30 July 2025",2025-07-21,50,4,2,2.0,Apartment / Unit / Flat,1/46 Torquay Road,-38.18358,144.34488,2025-09-09 16:21:25,17677260,,10,0,0,False,Apartment,Apartment / Unit / Flat,Harcourts North Geelong,26155,"Bronte Rapp, Harcourts Leasing","Gas, Bath",https://www.domain.com.au/1-46-torquay-road-belmont-vic-3216-17677260
17677277,BELMONT,3216,515.0,2237.0,"Monday, 21 July 2025",2025-07-21,50,3,2,2.0,House,1A Spring Street,-38.18026,144.34607,2025-09-09 16:21:25,17677277,,9,0,1,False,House,House,Barry Plant Geelong Sales,5005,Geelong Leasing,"Built in wardrobes, Gas, Secure Parking, Bath, Heating",https://www.domain.com.au/1a-spring-street-belmont-vic-3216-17677277
17711168,BELMONT,3216,580.0,2520.0,"Monday, 15 September 2025",2025-08-12,28,3,2,2.0,Townhouse,4/69 Mt Pleasant Road,-38.17074,144.33902,2025-09-09 16:21:25,17711168,,6,0,0,False,Townhouse/Villa,Townhouse,Stockdale & Leggo South Barwon,25535,"Ashlea Smith, Annie Kinross","Gas, Secure Parking, Bath, Dishwasher",https://www.domain.com.au/4-69-mt-pleasant-road-belmont-vic-3216-17711168
17715991,BELMONT,3216,420.0,1825.0,"Friday, 26 September 2025",2025-08-14,26,2,1,1.0,Apartment / Unit / Flat,3/172 Roslyn Road,-38.17318,144.32692,2025-09-09 16:21:25,17715991,,11,0,0,False,Apartment,Apartment / Unit / Flat,Stockdale & Leggo South Barwon,25535,"Annie Kinross, Ashlea Smith","Built in wardrobes, Internal Laundry, Secure Parking, Heating",https://www.domain.com.au/3-172-roslyn-road-belmont-vic-3216-17715991
