listing_id,suburb,postcode,weekly_rent,bond,available_date,date_listed,days_listed,bedrooms,bathrooms,carspaces,property_type,address,lat,lon,scraped_date,domain_page_id,property_id,photo_count,video_count,floorplans_count,virtual_tour,primary_type,secondary_type,agency,agency_id,agent_names,structured_features,url
15179957,BORONIA,3155,625.0,2708.0,"Monday, 22 September 2025",2025-08-11,28.0,2,2,1.0,Apartment / Unit / Flat,4/58 Woodvale Road,-37.86716,145.27527,2025-09-09 16:31:01,15179957.0,IT-7793-IQ,6.0,0.0,0.0,False,Apartment,Apartment / Unit / Flat,Ray White Ferntree Gully,7876.0,Ray White Rental Centre,"Gas, Internal Laundry, Secure Parking, Dishwasher, Shed",https://www.domain.com.au/4-58-woodvale-road-boronia-vic-3155-15179957
15447570,BORONIA,3155,540.0,2340.0,"Friday, 12 September 2025",2025-08-12,27.0,2,1,1.0,Apartment / Unit / Flat,11/2 Woodvale Road,-37.86238,145.27663,2025-09-09 16:31:01,15447570.0,CA-9709-RH,6.0,1.0,0.0,False,Apartment,Apartment / Unit / Flat,Ray White Ferntree Gully,7876.0,Ray White Rental Centre,"Air conditioning, Built in wardrobes, Secure Parking, Heating, Balcony / Deck",https://www.domain.com.au/11-2-woodvale-road-boronia-vic-3155-15447570
15773258,BORONIA,3155,780.0,3389.0,"Monday, 04 April 2022",2025-09-08,1.0,4,2,2.0,House,91 Power Road,-37.85315,145.27992,2025-09-09 16:31:01,15773258.0,LE-2434-AW,6.0,0.0,1.0,False,House,House,Ray White Ferntree Gully,7876.0,Ray White Rental Centre,"Air conditioning, Gas, Heating",https://www.domain.com.au/91-power-road-boronia-vic-3155-15773258
15955760,BORONIA,3155,270.0,540.0,"Friday, 19 January 2024",2022-06-27,1170.0,1,1,,House,Room 4/152 Dorset Road,-37.86934,145.28569,2025-09-09 16:31:01,15955760.0,,8.0,0.0,0.0,False,House,House,Woodards Blackburn,3599.0,"Cora Lu, Angelica Martinez","Gas, Heating",https://www.domain.com.au/room-4-152-dorset-road-boronia-vic-3155-15955760
16034383,BORONIA,3155,630.0,2738.0,"Saturday, 13 September 2025",2025-08-11,29.0,4,2,2.0,House,1/1 Russell Crescent,-37.862984,145.25433,2025-09-09 16:31:01,16034383.0,VE-3808-HU,6.0,0.0,0.0,False,House,House,Ray White Ferntree Gully,7876.0,Ray White Rental Centre,"Gas, Internal Laundry, Secure Parking, Bath, Heating, Dishwasher",https://www.domain.com.au/1-1-russell-crescent-boronia-vic-3155-16034383
16073097,BORONIA,3155,580.0,2520.0,"Friday, 26 September 2025",2025-08-19,21.0,2,2,2.0,Townhouse,1/1 Iris Crescent,-37.859467,145.28183,2025-09-09 16:31:01,16073097.0,KR-9775-XL,11.0,0.0,1.0,False,Townhouse/Villa,Townhouse,Ray White Wantirna,16586.0,Angelika Bogdanov,"Internal Laundry, Floorboards, Bath, Heating, Secure Parking, Balcony / Deck, Garden / Courtyard",https://www.domain.com.au/1-1-iris-crescent-boronia-vic-3155-16073097
16809825,BORONIA,3155,500.0,2173.0,"Thursday, 25 September 2025",2025-07-23,48.0,2,1,1.0,Apartment / Unit / Flat,2/47 Woodmason Road,-37.852062,145.27907,2025-09-09 16:31:01,16809825.0,KW-4556-SL,7.0,0.0,0.0,False,Apartment,Apartment / Unit / Flat,Professionals Wantirna Knox,18311.0,Professionals Wantirna Knox,"Internal Laundry, Heating",https://www.domain.com.au/2-47-woodmason-road-boronia-vic-3155-16809825
16942101,BORONIA,3155,590.0,2564.0,"Thursday, 21 August 2025",2025-08-21,19.0,2,2,1.0,Apartment / Unit / Flat,3/181 Dorset Road,-37.865845,145.28488,2025-09-09 16:31:01,16942101.0,AA-7116-NI,9.0,0.0,0.0,False,Apartment,Apartment / Unit / Flat,Ray White Ferntree Gully,7876.0,Ray White Rental Centre,"Secure Parking, Study, Balcony / Deck",https://www.domain.com.au/3-181-dorset-road-boronia-vic-3155-16942101
17251622,BORONIA,3155,180.0,600.0,"Sunday, 27 April 2025",2025-09-07,2.0,1,1,,House,,-37.862675,145.28566,2025-09-09 16:31:01,17251622.0,,3.0,0.0,0.0,False,House,House,RentBetter,27499.0,,"Air conditioning, Alarm System, Built in wardrobes, Fully fenced, Furnished, Garden / Courtyard, Heating, Secure Parking, Shed, Solar hot water, Solar panels",https://www.domain.com.au/boronia-vic-3155-17251622
17455832,BORONIA,3155,250.0,1080.0,"Thursday, 31 July 2025",2025-02-25,196.0,1,1,,Studio,Room 9/51 Albert Avenue,-37.856823,145.29562,2025-09-09 16:31:01,17455832.0,,14.0,0.0,0.0,False,Apartment,Studio,CHN Real Estate Group,29444.0,"Chris Sun, Winnie Wen","Gas, Ducted Heating, Evaporative Cooling, Air conditioning, Dishwasher, Built in wardrobes",https://www.domain.com.au/room-9-51-albert-avenue-boronia-vic-3155-17455832
17672769,BORONIA,3155,600.0,2607.0,"Monday, 04 August 2025",2025-07-17,54.0,3,2,1.0,House,113 Albert Avenue,-37.85067,145.2984,2025-09-09 16:31:01,17672769.0,,9.0,0.0,0.0,False,House,House,Ray White Wantirna,16586.0,Angelika Bogdanov,"Air conditioning, Floorboards, Bath, Heating, Dishwasher, Study, Solar panels",https://www.domain.com.au/113-albert-avenue-boronia-vic-3155-17672769
17674223,BORONIA,3155,570.0,2477.0,"Monday, 25 August 2025",2025-08-25,15.0,3,2,2.0,House,7 Beech Court,-37.87017,145.28592,2025-09-09 16:31:01,17674223.0,,8.0,0.0,0.0,False,House,House,First National Real Estate Ranges,4668.0,Nat Clayton,"Ensuite, Built in wardrobes, Air-Conditioner, Split System Heating, Remote Garage, Secure Parking, Fully fenced",https://www.domain.com.au/7-beech-court-boronia-vic-3155-17674223
17722144,BORONIA,3155,610.0,2651.0,"Friday, 29 August 2025",2025-08-19,21.0,4,2,2.0,House,66 Kanooka Road,-37.857662,145.25406,2025-09-09 16:31:01,17722144.0,,8.0,0.0,0.0,False,House,House,Ray White Wantirna,16586.0,Angelika Bogdanov,"Internal Laundry, Floorboards, Built in wardrobes, Bath, Heating, Dishwasher, Secure Parking",https://www.domain.com.au/66-kanooka-road-boronia-vic-3155-17722144
17729054,BORONIA,3155,550.0,2390.0,"Friday, 05 September 2025",2025-08-24,16.0,2,1,1.0,Apartment / Unit / Flat,3/11 Narcissus Avenue,-37.863537,145.2784,2025-09-09 16:31:01,17729054.0,,12.0,0.0,1.0,False,Apartment,Apartment / Unit / Flat,OBrien Real Estate Wantirna,30597.0,"Juanita Kozbiel, Nicole Gardner","Internal Laundry, Dishwasher, Study, Air conditioning, Heating, Built in wardrobes, Close to transport, Close to shops, Pets Allowed, Close to schools, Openable Windows, Toilet Facilities",https://www.domain.com.au/3-11-narcissus-avenue-boronia-vic-3155-17729054
17729833,BORONIA,3155,800.0,3476.0,"Friday, 05 September 2025",2025-08-25,15.0,4,2,1.0,House,61A Western Road,-37.865868,145.27055,2025-09-09 16:31:01,17729833.0,,7.0,0.0,1.0,False,House,House,OBrien Real Estate Wantirna,30597.0,Nicole Gardner,"Gas, Dishwasher, Balcony / Deck, Air conditioning, Heating, Built in wardrobes, Close to transport, Close to shops, Close to schools, Ensuite",https://www.domain.com.au/61a-western-road-boronia-vic-3155-17729833
17733820,BORONIA,3155,540.0,2346.0,"Monday, 22 September 2025",2025-08-27,13.0,2,1,1.0,Apartment / Unit / Flat,4/9 Elsie Street,-37.85626,145.28783,2025-09-09 16:31:01,17733820.0,,4.0,0.0,0.0,False,Apartment,Apartment / Unit / Flat,Ray White Ferntree Gully,7876.0,,"Built in wardrobes, Gas, Internal Laundry, Secure Parking, Balcony / Deck, Air conditioning",https://www.domain.com.au/4-9-elsie-street-boronia-vic-3155-17733820
17736803,BORONIA,3155,370.0,1608.0,"Wednesday, 10 September 2025",2025-08-28,12.0,1,1,,Apartment / Unit / Flat,329 Dorset Road,-37.852848,145.28569,2025-09-09 16:31:01,17736803.0,,13.0,0.0,0.0,False,Apartment,Apartment / Unit / Flat,Professionals Wantirna Knox,18311.0,Professionals Wantirna Knox,"Air conditioning, Built in wardrobes, Internal Laundry, Broadband internet access, Heating",https://www.domain.com.au/329-dorset-road-boronia-vic-3155-17736803
17745718,BORONIA,3155,660.0,2860.0,"Monday, 29 September 2025",2025-09-03,6.0,3,2,2.0,House,19A Hazelwood Rd,-37.869297,145.2817,2025-09-09 16:31:01,17745718.0,,9.0,0.0,0.0,False,House,House,AREA SPECIALIST NEXUS,38101.0,Yasman Janfada,"Gas, Secure Parking, Heating, Balcony / Deck",https://www.domain.com.au/19a-hazelwood-rd-boronia-vic-3155-17745718
17749044,BORONIA,3155,600.0,2607.0,"Wednesday, 17 September 2025",2025-09-05,4.0,3,2,1.0,Apartment / Unit / Flat,1/9 Landscape Drive,-37.8454,145.28818,2025-09-09 16:31:01,17749044.0,,7.0,0.0,0.0,False,Apartment,Apartment / Unit / Flat,Ray White Wantirna,16586.0,Elle Leonhardt,"Internal Laundry, Floorboards, Bath, Heating, Dishwasher, Secure Parking, Garden / Courtyard",https://www.domain.com.au/1-9-landscape-drive-boronia-vic-3155-17749044
17753633,BORONIA,3155,570.0,2477.0,"Tuesday, 09 September 2025",2025-09-09,0.0,3,1,,House,386 Boronia Rd,-37.857224,145.25572,2025-09-09 16:31:01,17753633.0,,10.0,0.0,0.0,False,House,House,"Barry Plant Noble Park, Keysborough & Dandenong",17354.0,Rental Dept - Barry Plant Noble Park,"Internal Laundry, Fireplace(s), Dishwasher, Balcony / Deck, Built in wardrobes, Bathtub, Split System Heating, Split System Air Conditioning, Outdoor Entertainment Area",https://www.domain.com.au/386-boronia-rd-boronia-vic-3155-17753633
15244231,BORONIA,3155,,3500.0,,2023-03-20,904.0,3,2,1.0,House,3B Faraday Street,-37.857677,145.27231,2025-09-09 16:31:07,15244231.0,,13.0,0.0,0.0,False,House,House,BRW Group,34868.0,,"Heating, Balcony / Deck",https://www.domain.com.au/3b-faraday-street-boronia-vic-3155-15244231
16737479,BORONIA,3155,300.0,1303.0,"Wednesday, 15 November 2023",2023-11-09,670.0,1,1,,Studio,184 Dorset Road,-37.86583,145.28568,2025-09-09 16:31:07,16737479.0,,8.0,0.0,0.0,False,Apartment,Studio,LANDNEST REAL ESTATE,30082.0,Clayton Leasing team,"Gas, Broadband internet access, Heating",https://www.domain.com.au/184-dorset-road-boronia-vic-3155-16737479
16740821,BORONIA,3155,580.0,2520.0,"Friday, 05 September 2025",2025-07-23,48.0,2,1,1.0,Apartment / Unit / Flat,4/476 Dorset Road,-37.834846,145.28795,2025-09-09 16:31:07,16740821.0,ZC-8402-BE,9.0,0.0,0.0,False,Apartment,Apartment / Unit / Flat,Professionals Wantirna Knox,18311.0,Professionals Wantirna Knox,"Air conditioning, Built in wardrobes",https://www.domain.com.au/4-476-dorset-road-boronia-vic-3155-16740821
17278902,BORONIA,3155,,1434.0,,2024-10-31,313.0,1,1,,Studio,184 Dorset Road,-37.86583,145.28568,2025-09-09 16:31:07,17278902.0,,8.0,0.0,0.0,False,Apartment,Studio,Dynamic Estate Group,23759.0,Rental Dynamic,"Gas, Heating, Furnished",https://www.domain.com.au/184-dorset-road-boronia-vic-3155-17278902
17556879,BORONIA,3155,625.0,2716.0,"Tuesday, 27 May 2025",2025-05-05,127.0,3,2,2.0,House,62 Allanfield Crescent,-37.86291,145.25587,2025-09-09 16:31:07,17556879.0,JK-8174-HY,10.0,0.0,0.0,False,House,House,Barry Plant Wantirna,7284.0,Dusica Tomic,"Air conditioning, Heating, Shed, Solar panels, Bedrooms, Bathrooms, Secure Parking, Gas Heating",https://www.domain.com.au/62-allanfield-crescent-boronia-vic-3155-17556879
17727626,Boronia,3155,800.0,,,,,4,3,2.0,Townhouse,,,,2025-09-09 16:31:13,,,,,,,,,,,,,https://www.domain.com.au/1-11-foster-crescent-knoxfield-vic-3180-17727626
