listing_id,suburb,postcode,weekly_rent,bond,available_date,date_listed,days_listed,bedrooms,bathrooms,carspaces,property_type,address,lat,lon,scraped_date,domain_page_id,property_id,photo_count,video_count,floorplans_count,virtual_tour,primary_type,secondary_type,agency,agency_id,agent_names,structured_features,url
14724011,BRAYBROOK,3019,570,2477.0,"Thursday, 02 October 2025",2025-08-29,11,3,2,2,Townhouse,23A Shepherd Street,-37.783337,144.85532,2025-09-09 17:00:45,14724011,CW-2890-ZD,10,0,0,False,Townhouse/Villa,Townhouse,Jas Stephens Real Estate,22,Stephanie Knight,"Internal Laundry, Built in wardrobes, Dishwasher, Bathtub, Gas Appliances, Split System Heating, Split System Air Conditioning, Courtyard, Remote Garage, Pets Allowed",https://www.domain.com.au/23a-shepherd-street-braybrook-vic-3019-14724011
15562836,BRAYBROOK,3019,690,2998.0,"Thursday, 21 August 2025",2025-08-21,19,3,2,2,Townhouse,98 Royal Road,-37.794052,144.84666,2025-09-09 17:00:45,15562836,XS-4616-AJ,7,0,1,False,Townhouse/Villa,Townhouse,LITTLE Real Estate Victoria,24974,Pelin Vural,"Heating: Reverse Cycle Air Conditioning, Cooling: Reverse Cycle Air Conditioning, Kitchen: Modern, Cooking: Gas Hotplates and Electric Oven, Pool/Spa Count: 0",https://www.domain.com.au/98-royal-road-braybrook-vic-3019-15562836
16820278,BRAYBROOK,3019,550,2383.0,"Sunday, 15 June 2025",2025-05-23,109,3,1,4,House,9 Vine Street,-37.783745,144.85632,2025-09-09 17:00:45,16820278,OH-5288-TO,9,0,0,False,House,House,Raine & Horne St Albans,19493,Bojan Lojanica,"Air conditioning, Built in wardrobes, Internal Laundry, Shed",https://www.domain.com.au/9-vine-street-braybrook-vic-3019-16820278
17149481,BRAYBROOK,3019,630,2738.0,"Saturday, 06 September 2025",2025-09-05,4,3,2,1,House,2/19 Wilson Street,-37.78987,144.85092,2025-09-09 17:00:45,17149481,ID-5206-MP,18,1,0,False,House,House,CROZIERS & CO,26116,"Elissa Privitelli, Stephanie Privitelli","Intercom, Heating",https://www.domain.com.au/2-19-wilson-street-braybrook-vic-3019-17149481
17209804,BRAYBROOK,3019,515,2237.0,"Tuesday, 08 October 2024",2025-08-27,13,2,1,1,Apartment / Unit / Flat,10/1 Marnoo Street,-37.790165,144.84633,2025-09-09 17:00:45,17209804,VO-1999-WW,9,0,2,False,Apartment,Apartment / Unit / Flat,Jas Stephens Real Estate,22,Stephanie Njomkam,"Internal Laundry, Floorboards, Built in wardrobes, Bathtub, Gas Appliances, Split System Heating, Split System Air Conditioning, Balcony, Secure Parking, Pets Allowed",https://www.domain.com.au/10-1-marnoo-street-braybrook-vic-3019-17209804
17622398,BRAYBROOK,3019,650,2824.0,"Friday, 27 June 2025",2025-06-16,85,3,2,2,Townhouse,13 Kent Street,-37.792355,144.84929,2025-09-09 17:00:45,17622398,,11,0,2,False,Townhouse/Villa,Townhouse,Melo Real Estate Pty Ltd,38412,"Carmelo Caputa, Admin Team","Balcony, Remote Garage, Secure Parking, Built in wardrobes, Dishwasher, Floorboards, Split-System Air Conditioning, Split-System Heating, Water Tank, Ensuite",https://www.domain.com.au/13-kent-street-braybrook-vic-3019-17622398
17652316,BRAYBROOK,3019,620,2694.0,"Thursday, 31 July 2025",2025-07-03,67,2,2,1,Townhouse,58 Cole Street,-37.794605,144.84663,2025-09-09 17:00:45,17652316,,12,0,0,False,Townhouse/Villa,Townhouse,Create Real Estate,13833,Create Rentals,Balcony / Deck,https://www.domain.com.au/58-cole-street-braybrook-vic-3019-17652316
17665922,BRAYBROOK,3019,380,1647.0,"Friday, 08 August 2025",2025-08-12,28,3,1,1,House,5C Vine Street,-37.784035,144.85628,2025-09-09 17:00:45,17665922,,8,0,0,False,House,House, Sweeney Estate Agents St. Albans,18290,"Roz Gauci, Administration Sunshine","Gas, Internal Laundry, Secure Parking, Bath, Shed",https://www.domain.com.au/5c-vine-street-braybrook-vic-3019-17665922
17676805,BRAYBROOK,3019,615,2672.0,"Monday, 04 August 2025",2025-07-21,50,3,2,2,Townhouse,15 Hines Way,-37.795235,144.84877,2025-09-09 17:00:45,17676805,,14,0,1,False,Townhouse/Villa,Townhouse,First National Real Estate D & K ,15204,"Jordon Gillett, Dorothy Schembri",,https://www.domain.com.au/15-hines-way-braybrook-vic-3019-17676805
17696878,BRAYBROOK,3019,400,1734.0,"Friday, 11 July 2025",2025-08-01,39,2,1,1,House,237 Ballarat Road,-37.781136,144.8629,2025-09-09 17:00:45,17696878,,9,0,0,False,House,House,Bells Real Estate Sunshine,4389,"Tris Waters, Rentals Sunshine",Gas,https://www.domain.com.au/237-ballarat-road-braybrook-vic-3019-17696878
17702449,BRAYBROOK,3019,575,,"Friday, 05 September 2025",2025-08-06,34,3,2,2,Townhouse,18/15 Mullenger Road,-37.775196,144.85245,2025-09-09 17:00:45,17702449,,6,0,0,False,Townhouse/Villa,Townhouse,Aurora Estate Agents,31835,Aurora Leasing  Department,,https://www.domain.com.au/18-15-mullenger-road-braybrook-vic-3019-17702449
17713574,BRAYBROOK,3019,800,3476.0,"Tuesday, 12 August 2025",2025-08-13,27,4,3,2,Townhouse,3A Bradford Court,-37.782413,144.8629,2025-09-09 17:00:45,17713574,,17,0,0,False,Townhouse/Villa,Townhouse,Create Real Estate,13833,Create Rentals,"Built in wardrobes, Heating, Secure Parking",https://www.domain.com.au/3a-bradford-court-braybrook-vic-3019-17713574
17718597,BRAYBROOK,3019,500,2260.0,"Wednesday, 20 August 2025",2025-08-16,24,2,2,1,Apartment / Unit / Flat,1/24 Barrie Court,-37.782772,144.85551,2025-09-09 17:00:45,17718597,,9,0,0,False,Apartment,Apartment / Unit / Flat,Create Real Estate,13833,Create Rentals,"Balcony / Deck, Built in wardrobes, Garden / Courtyard",https://www.domain.com.au/1-24-barrie-court-braybrook-vic-3019-17718597
17721625,BRAYBROOK,3019,500,2173.0,"Monday, 01 September 2025",2025-08-19,21,2,1,1,Townhouse,2/38 McLennan Street,-37.781918,144.84772,2025-09-09 17:00:45,17721625,,23,0,0,False,Townhouse/Villa,Townhouse,DK Property Partners Melbourne,17655,Nhi Dinh,,https://www.domain.com.au/2-38-mclennan-street-braybrook-vic-3019-17721625
17730273,BRAYBROOK,3019,620,2694.0,"Monday, 22 September 2025",2025-08-25,15,3,2,2,Townhouse,3 Munitions Walk,-37.794716,144.84552,2025-09-09 17:00:45,17730273,,13,1,0,False,Townhouse/Villa,Townhouse,Ironfish Real Estate Melbourne,21689,Sisi Peng,"Built in wardrobes, Gas, Car Accom: Carport, Pool/Spa Count: 0",https://www.domain.com.au/3-munitions-walk-braybrook-vic-3019-17730273
17732038,BRAYBROOK,3019,510,2216.0,"Saturday, 20 September 2025",2025-08-26,14,2,2,1,Townhouse,3/115 Melon Street,-37.781612,144.85909,2025-09-09 17:00:45,17732038,,15,0,0,False,Townhouse/Villa,Townhouse,Nicholas Scott Real Estate,8676,Charles Mammoliti,Air conditioning,https://www.domain.com.au/3-115-melon-street-braybrook-vic-3019-17732038
17733579,BRAYBROOK,3019,475,,"Friday, 05 September 2025",2025-08-27,13,3,1,1,Apartment / Unit / Flat,4/16 Lawn Crescent,-37.782745,144.86043,2025-09-09 17:00:45,17733579,,15,0,1,False,Apartment,Apartment / Unit / Flat,Barry Plant Yarraville,37282,"Alice Mosut, Sorelle Webster","Built in wardrobes, Gas, Internal Laundry, Secure Parking, Bath, Heating, Dishwasher",https://www.domain.com.au/4-16-lawn-crescent-braybrook-vic-3019-17733579
17740877,BRAYBROOK,3019,600,2607.0,"Monday, 01 September 2025",2025-09-01,8,2,1,1,Townhouse,1/13 Wilson street,-37.789917,144.85149,2025-09-09 17:00:45,17740877,,10,0,0,False,Townhouse/Villa,Townhouse,Nguyen Real Estate,19313,"Andy Toan Pham, Kevin Nguyen","Air conditioning, Heating",https://www.domain.com.au/1-13-wilson-street-braybrook-vic-3019-17740877
17746859,BRAYBROOK,3019,550,2383.0,"Thursday, 04 September 2025",2025-09-04,5,4,1,4,House,64 South Road,-37.790985,144.8508,2025-09-09 17:00:45,17746859,,22,0,0,False,House,House, Sweeney Estate Agents St. Albans,18290,"Phillip Lam, Administration St Albans","Air conditioning, Built in wardrobes, Secure Parking",https://www.domain.com.au/64-south-road-braybrook-vic-3019-17746859
17753221,BRAYBROOK,3019,600,,"Thursday, 25 September 2025",2025-09-09,0,2,2,1,Townhouse,13 Holzer Crescent,-37.794548,144.84602,2025-09-09 17:00:45,17753221,,11,0,0,False,Townhouse/Villa,Townhouse,Barry Plant Yarraville,37282,"Alice Mosut, Sorelle Webster","Built in wardrobes, Gas, Secure Parking, Heating, Balcony / Deck, Pets Allowed",https://www.domain.com.au/13-holzer-crescent-braybrook-vic-3019-17753221
15003037,BRAYBROOK,3019,600,2607.0,"Monday, 22 July 2024",2024-06-28,438,2,2,1,Townhouse,72B South Road,-37.790928,144.8496,2025-09-09 17:00:51,15003037,UY-7596-TS,10,0,0,False,Townhouse/Villa,Townhouse,Zed Real Estate,30678,Dean Ghausi,"Internal Laundry, Secure Parking, Heating",https://www.domain.com.au/72b-south-road-braybrook-vic-3019-15003037
17495376,BRAYBROOK,3019,630,2738.0,"Wednesday, 23 April 2025",2025-03-21,172,3,2,1,Townhouse,88 Royal Road,-37.79408,144.84705,2025-09-09 17:00:51,17495376,PP-0577-ZY,13,0,0,False,Townhouse/Villa,Townhouse,Ironfish Real Estate Melbourne,21689,Sisi Peng,"Built in wardrobes, Gas, Secure Parking",https://www.domain.com.au/88-royal-road-braybrook-vic-3019-17495376
17559940,BRAYBROOK,3019,660,2868.0,"Tuesday, 13 May 2025",2025-05-06,125,3,2,2,Townhouse,1 Basalt Walk,-37.794895,144.84966,2025-09-09 17:00:51,17559940,GM-0171-TE,13,0,0,False,Townhouse/Villa,Townhouse,Ironfish Real Estate Melbourne,21689,Sisi Peng,"Built in wardrobes, Gas, Secure Parking",https://www.domain.com.au/1-basalt-walk-braybrook-vic-3019-17559940
17567096,BRAYBROOK,3019,500,2173.0,"Friday, 16 May 2025",2025-05-12,119,2,1,1,House,14/1 Marnoo Street,-37.790165,144.84633,2025-09-09 17:00:51,17567096,AN-1348-ZE,20,0,0,False,House,House,Jas Stephens Real Estate,22,"Jesseigh Stella, Damien Welch","Internal Laundry, Intercom, Built in wardrobes, Bathtub, Split System Heating, Split System Air Conditioning, Outdoor Entertainment Area, Courtyard, Fully fenced, Pets Allowed",https://www.domain.com.au/14-1-marnoo-street-braybrook-vic-3019-17567096
17622396,BRAYBROOK,3019,670,2911.0,"Friday, 27 June 2025",2025-06-16,85,3,2,2,Townhouse,13 Kent Street,-37.792355,144.84929,2025-09-09 17:00:51,17622396,,8,0,1,False,Townhouse/Villa,Townhouse,Melo Real Estate Pty Ltd,38412,"Carmelo Caputa, Admin Team","Balcony, Remote Garage, Secure Parking, Built in wardrobes, Dishwasher, Floorboards, Split-System Air Conditioning, Split-System Heating, Water Tank, Ensuite",https://www.domain.com.au/13-kent-street-braybrook-vic-3019-17622396
