listing_id,suburb,postcode,weekly_rent,bond,available_date,date_listed,days_listed,bedrooms,bathrooms,carspaces,property_type,address,lat,lon,scraped_date,domain_page_id,property_id,photo_count,video_count,floorplans_count,virtual_tour,primary_type,secondary_type,agency,agency_id,agent_names,structured_features,url
11173876,BRUNSWICK,3056,420.0,1825.0,"Thursday, 11 September 2025",2025-09-08,1,2,1,1.0,Apartment / Unit / Flat,3/829 Park Street,-37.77686,144.95189,2025-09-09 16:45:19,11173876,IG-2177-YN,6,0,0,False,Apartment,Apartment / Unit / Flat,LITTLE Real Estate Victoria,24974,Cooper Modica,"Bath, Car Accom: Single Off-Street Parking, Heating: Other, Kitchen: Open Plan, Cooking: Electric Upright Stove, Pool/Spa Count: 0",https://www.domain.com.au/3-829-park-street-brunswick-vic-3056-11173876
16907098,BRUNSWICK,3056,520.0,2260.0,"Wednesday, 03 September 2025",2025-09-03,6,1,1,,Apartment / Unit / Flat,508/601 Sydney Road,-37.76301,144.96262,2025-09-09 16:45:19,16907098,HG-0523-ZI,11,1,0,False,Apartment,Apartment / Unit / Flat,Ray White Brunswick,21490,"Danny Campos, Hassan Allouche",,https://www.domain.com.au/508-601-sydney-road-brunswick-vic-3056-16907098
17705777,BRUNSWICK,3056,890.0,3867.0,"Friday, 08 August 2025",2025-08-07,33,3,2,2.0,Apartment / Unit / Flat,905/288 Albert Street,-37.76887,144.96066,2025-09-09 16:45:19,17705777,,11,0,0,False,Apartment,Apartment / Unit / Flat,Jellis Craig - Brunswick,6216,"David Johnston, Elliott Heslop","Split System Air Con, Split System Heating, Balcony / Deck, Built in wardrobes, Remote Garage, Floorboards, Secure Parking",https://www.domain.com.au/905-288-albert-street-brunswick-vic-3056-17705777
17712967,BRUNSWICK,3056,600.0,2716.0,"Tuesday, 16 September 2025",2025-08-13,27,2,1,1.0,Apartment / Unit / Flat,717/1 Lygon Street,-37.77863,144.97035,2025-09-09 16:45:19,17712967,,10,1,1,False,Apartment,Apartment / Unit / Flat,Metropole Properties Melbourne,18456,Larah Dalton,"Secure Parking, Intercom, Floorboards, Built in wardrobes, Dishwasher, Split System Air Conditioning, Balcony",https://www.domain.com.au/717-1-lygon-street-brunswick-vic-3056-17712967
17717403,BRUNSWICK,3056,850.0,3693.0,"Friday, 22 August 2025",2025-08-15,25,3,2,2.0,Apartment / Unit / Flat,128/108-124 Union Street,-37.773243,144.9534,2025-09-09 16:45:19,17717403,,10,0,0,False,Apartment,Apartment / Unit / Flat,Jellis Craig - Brunswick,6216,"David Johnston, Elliott Heslop","Split System Air Con, Split System Heating, Balcony / Deck, Built in wardrobes, Dishwasher, Floorboards, Remote Garage, Secure Parking",https://www.domain.com.au/128-108-124-union-street-brunswick-vic-3056-17717403
17734159,BRUNSWICK,3056,800.0,3476.0,"Monday, 06 October 2025",2025-08-27,13,3,2,2.0,House,20 Eva Buhlert Close,-37.76976,144.9635,2025-09-09 16:45:19,17734159,,12,0,0,False,House,House,Jellis Craig - Brunswick,6216,David Johnston,"Evaporative Cooling, Built in wardrobes, Secure Parking, Electric Heating",https://www.domain.com.au/20-eva-buhlert-close-brunswick-vic-3056-17734159
17738273,BRUNSWICK,3056,675.0,2933.0,"Monday, 22 September 2025",2025-08-29,11,2,2,1.0,Apartment / Unit / Flat,517/288 Albert Street,-37.76887,144.96066,2025-09-09 16:45:19,17738273,,13,0,0,False,Apartment,Apartment / Unit / Flat,Jellis Craig - Brunswick,6216,"David Johnston, Elliott Heslop","Split System Air Con, Split System Heating, Balcony / Deck, Built in wardrobes, Dishwasher, Floorboards, Remote Garage, Secure Parking",https://www.domain.com.au/517-288-albert-street-brunswick-vic-3056-17738273
17742268,BRUNSWICK,3056,640.0,2781.0,"Tuesday, 02 September 2025",2025-09-02,7,2,1,1.0,Apartment / Unit / Flat,110/288 Albert Street,-37.76887,144.96066,2025-09-09 16:45:19,17742268,,13,1,1,False,Apartment,Apartment / Unit / Flat,Ray White Brunswick,21490,"Hassan Allouche, Property Management Brunswick",,https://www.domain.com.au/110-288-albert-street-brunswick-vic-3056-17742268
17743363,BRUNSWICK,3056,490.0,2129.0,"Thursday, 25 September 2025",2025-09-02,7,1,1,1.0,Apartment / Unit / Flat,204/356-360 Lygon Street,-37.778282,144.97061,2025-09-09 16:45:19,17743363,,1,0,0,False,Apartment,Apartment / Unit / Flat,Jellis Craig Kensington,20419,"Megan Reddy, Kate McLellan",Built in wardrobes,https://www.domain.com.au/204-356-360-lygon-street-brunswick-vic-3056-17743363
17746791,BRUNSWICK,3056,570.0,2476.0,"Monday, 29 September 2025",2025-09-04,5,2,1,,House,227 Albert Street,-37.768982,144.96396,2025-09-09 16:45:19,17746791,,9,0,0,False,House,House,Jellis Craig - Brunswick,6216,David Johnston,"Split System Air Con, Split System Heating, Floorboards, Built in wardrobes",https://www.domain.com.au/227-albert-street-brunswick-vic-3056-17746791
17747096,BRUNSWICK,3056,875.0,3802.0,"Friday, 19 September 2025",2025-09-04,5,3,1,,House,315 Albion Street,-37.75961,144.95432,2025-09-09 16:45:19,17747096,,12,0,1,False,House,House,Jellis Craig - Brunswick,6216,"David Johnston, Elliott Heslop","Split System Air Con, Split System Heating, Built in wardrobes, Garden / Courtyard, Outdoor Entertainment Area, Dishwasher, Floorboards",https://www.domain.com.au/315-albion-street-brunswick-vic-3056-17747096
17748996,BRUNSWICK,3056,450.0,1955.0,"Monday, 29 September 2025",2025-09-05,4,2,1,1.0,Apartment / Unit / Flat,3/97 Brickworks Drive,-37.769512,144.95282,2025-09-09 16:45:19,17748996,,6,0,0,False,Apartment,Apartment / Unit / Flat,Jellis Craig - Brunswick,6216,David Johnston,"Dishwasher, Built in wardrobes, Electric Heating",https://www.domain.com.au/3-97-brickworks-drive-brunswick-vic-3056-17748996
17749064,BRUNSWICK,3056,955.0,5104.0,"Tuesday, 30 September 2025",2025-09-05,4,3,1,1.0,Townhouse,244A Brunswick Road,-37.776897,144.95741,2025-09-09 16:45:19,17749064,,11,0,0,False,Townhouse/Villa,Townhouse,Jellis Craig - Brunswick,6216,David Johnston,"Split System Air Con, Split System Heating, Built in wardrobes, Dishwasher, Remote Garage, Floorboards",https://www.domain.com.au/244a-brunswick-road-brunswick-vic-3056-17749064
17749356,BRUNSWICK,3056,785.0,3411.0,"Friday, 19 September 2025",2025-09-05,4,3,2,,House,42 Austral Avenue,-37.761127,144.95656,2025-09-09 16:45:19,17749356,,8,0,1,True,House,House,Nelson Alexander Brunswick,4720,Angus Woodyard,Built in wardrobes,https://www.domain.com.au/42-austral-avenue-brunswick-vic-3056-17749356
17749488,BRUNSWICK,3056,580.0,2521.0,"Tuesday, 09 September 2025",2025-09-05,4,2,1,1.0,Apartment / Unit / Flat,610/288 Albert Street,-37.76887,144.96066,2025-09-09 16:45:19,17749488,,9,0,0,False,Apartment,Apartment / Unit / Flat,Biggin & Scott Inner North,23934,Emily Karamoshou,"Built in wardrobes, Internal Laundry, Heating, Balcony / Deck, Air conditioning, Furnished, City Views",https://www.domain.com.au/610-288-albert-street-brunswick-vic-3056-17749488
17749913,BRUNSWICK,3056,495.0,2151.0,"Wednesday, 10 September 2025",2025-09-05,3,2,1,,Apartment / Unit / Flat,406/34 Union Street,-37.773785,144.95851,2025-09-09 16:45:19,17749913,,9,0,0,False,Apartment,Apartment / Unit / Flat,Nelson Alexander Brunswick,4720,Penny Tsiamis,"Air conditioning, Built in wardrobes, Gas, Internal Laundry, Heating, Dishwasher, Balcony / Deck",https://www.domain.com.au/406-34-union-street-brunswick-vic-3056-17749913
17750726,BRUNSWICK,3056,500.0,2173.0,"Tuesday, 11 November 2025",2025-09-08,1,1,1,,Apartment / Unit / Flat,2/653 Park Street,-37.77839,144.96498,2025-09-09 16:45:19,17750726,,8,0,1,False,Apartment,Apartment / Unit / Flat,Woodards Ascot Vale,26361,Caterina Italiano,Furnished,https://www.domain.com.au/2-653-park-street-brunswick-vic-3056-17750726
17750907,BRUNSWICK,3056,625.0,2716.0,"Thursday, 25 September 2025",2025-09-08,1,2,1,1.0,Townhouse,1/115 Albion Street,-37.761353,144.96886,2025-09-09 16:45:19,17750907,,5,0,0,False,Townhouse/Villa,Townhouse,Belle Property Carlton | Melbourne | North Melbourne,24322,Helena Eglezos,"Air conditioning, Built in wardrobes, Close to transport, Close to shops, Close to schools, Dishwasher",https://www.domain.com.au/1-115-albion-street-brunswick-vic-3056-17750907
17753219,BRUNSWICK,3056,460.0,1999.0,"Friday, 03 October 2025",2025-09-09,0,1,1,1.0,Apartment / Unit / Flat,122/808-818 Sydney Road,-37.757797,144.96397,2025-09-09 16:45:19,17753219,,12,0,0,False,Apartment,Apartment / Unit / Flat,Barry Plant (Brunswick-Coburg),6048,Brea Nicolaides,"Built in wardrobes, Internal Laundry, Secure Parking, Broadband internet access, Balcony / Deck, Study",https://www.domain.com.au/122-808-818-sydney-road-brunswick-vic-3056-17753219
17754246,BRUNSWICK,3056,820.0,3563.0,"Tuesday, 16 September 2025",2025-09-09,0,3,1,1.0,House,20 Victoria Grove,-37.763447,144.97043,2025-09-09 16:45:19,17754246,,11,0,1,True,House,House,Jellis Craig Kensington,20419,"Justin Jovanov, Vicki Lekanis","Gas, Internal Laundry, Built in wardrobes, Dishwasher, Remote Garage, Ducted Heating, Evaporative Cooling",https://www.domain.com.au/20-victoria-grove-brunswick-vic-3056-17754246
16768755,BRUNSWICK,3056,600.0,2607.0,"Friday, 26 September 2025",2025-09-02,7,2,1,1.0,Apartment / Unit / Flat,208/80 Dawson Street,-37.77022,144.9523,2025-09-09 16:45:23,16768755,KI-9584-JG,11,1,1,False,Apartment,Apartment / Unit / Flat,Ray White Brunswick,21490,"Danny Campos, Property Management Brunswick",,https://www.domain.com.au/208-80-dawson-street-brunswick-vic-3056-16768755
17702934,BRUNSWICK,3056,850.0,3683.0,"Saturday, 19 July 2025",2025-08-06,34,3,1,2.0,House,44 Canberra Street,-37.758022,144.9566,2025-09-09 16:45:23,17702934,,16,0,1,False,House,House,Nicholson Real Estate,11229,Mayu Yamamoto,"Air conditioning, Close to transport, Close to shops, Car Parking - Surface, Courtyard, Dishwasher",https://www.domain.com.au/44-canberra-street-brunswick-vic-3056-17702934
17725799,BRUNSWICK,3056,895.0,3888.0,"Friday, 22 August 2025",2025-08-21,19,3,1,1.0,House,12 Murdock Street,-37.75586,144.95868,2025-09-09 16:45:23,17725799,,14,0,0,False,House,House,Jellis Craig - Brunswick,6216,"Brandon Antrim, Elliott Heslop","Split System Air Con, Split System Heating, Built in wardrobes, Garden / Courtyard, Outdoor Entertainment Area, Dishwasher, Floorboards",https://www.domain.com.au/12-murdock-street-brunswick-vic-3056-17725799
17726380,BRUNSWICK,3056,580.0,2520.0,"Thursday, 21 August 2025",2025-08-21,19,1,1,1.0,Apartment / Unit / Flat,310/8 Michael Street,-37.772434,144.95978,2025-09-09 16:45:23,17726380,,9,0,1,True,Apartment,Apartment / Unit / Flat,Woodards,19,Brittany Kaklikos,"Built in wardrobes, Internal Laundry, Secure Parking, Heating, Balcony / Deck",https://www.domain.com.au/310-8-michael-street-brunswick-vic-3056-17726380
17727155,BRUNSWICK,3056,780.0,3389.0,"Tuesday, 16 September 2025",2025-08-22,18,2,1,1.0,House,7 Bennie Street,-37.766926,144.96605,2025-09-09 16:45:23,17727155,,18,0,1,False,House,House,Jellis Craig - Brunswick,6216,Brandon Antrim,"Dishwasher, Split System Air Con, Split System Heating, Floorboards",https://www.domain.com.au/7-bennie-street-brunswick-vic-3056-17727155
17730135,BRUNSWICK,3056,575.0,2499.0,"Friday, 05 September 2025",2025-08-25,15,2,2,1.0,Apartment / Unit / Flat,508/201 Albert Street,-37.768753,144.96487,2025-09-09 16:45:23,17730135,,8,0,0,False,Apartment,Apartment / Unit / Flat,Biggin & Scott Inner North,23934,Maxine Alderson,"Internal Laundry, Heating, Ensuite",https://www.domain.com.au/508-201-albert-street-brunswick-vic-3056-17730135
17737704,BRUNSWICK,3056,510.0,2216.0,"Friday, 26 September 2025",2025-08-29,11,1,1,1.0,Apartment / Unit / Flat,214/808 Sydney Road,-37.7579,144.96391,2025-09-09 16:45:23,17737704,,6,0,0,False,Apartment,Apartment / Unit / Flat,Jellis Craig - Brunswick,6216,Brandon Antrim,"Split System Air Con, Split System Heating, Balcony / Deck, Built in wardrobes, Dishwasher, Floorboards, Intercom, Secure Parking",https://www.domain.com.au/214-808-sydney-road-brunswick-vic-3056-17737704
17737799,BRUNSWICK,3056,500.0,2172.0,"Friday, 05 September 2025",2025-08-29,11,1,1,1.0,Apartment / Unit / Flat,609/601 Sydney Road,-37.76301,144.96262,2025-09-09 16:45:23,17737799,,8,0,0,False,Apartment,Apartment / Unit / Flat,Jellis Craig - Brunswick,6216,"Brandon Antrim, Elliott Heslop","Split System Air Con, Split System Heating, Balcony / Deck, Built in wardrobes, Remote Garage, Floorboards, Secure Parking",https://www.domain.com.au/609-601-sydney-road-brunswick-vic-3056-17737799
17742193,BRUNSWICK,3056,550.0,2390.0,"Thursday, 25 September 2025",2025-09-02,7,2,1,1.0,Apartment / Unit / Flat,14/10-18 Minnie Street,-37.77156,144.9687,2025-09-09 16:45:23,17742193,,6,0,0,False,Apartment,Apartment / Unit / Flat,Nelson Alexander Brunswick,4720,Daniel Carusi,"Built in wardrobes, Broadband internet access, Bath, Heating, Dishwasher, Balcony / Deck",https://www.domain.com.au/14-10-18-minnie-street-brunswick-vic-3056-17742193
17742508,BRUNSWICK,3056,500.0,2173.0,"Tuesday, 16 September 2025",2025-09-02,7,2,1,1.0,Apartment / Unit / Flat,532A Sydney Road,-37.765358,144.96255,2025-09-09 16:45:23,17742508,,7,0,0,False,Apartment,Apartment / Unit / Flat,Biggin & Scott Inner North,23934,Emily Karamoshou,,https://www.domain.com.au/532a-sydney-road-brunswick-vic-3056-17742508
17742612,BRUNSWICK,3056,400.0,,"Wednesday, 03 September 2025",2025-09-02,7,1,1,1.0,Apartment / Unit / Flat,1/95 Dawson Road,-37.770428,144.95088,2025-09-09 16:45:23,17742612,,3,0,0,False,Apartment,Apartment / Unit / Flat,McGrath Ivanhoe,28224,Molly Booker,"Built in wardrobes, Close to transport, Close to shops, Close to schools",https://www.domain.com.au/1-95-dawson-road-brunswick-vic-3056-17742612
17743410,BRUNSWICK,3056,750.0,3259.0,"Friday, 23 August 2024",2025-09-02,7,3,1,1.0,House,11 Brickworks Dr,-37.76989,144.95158,2025-09-09 16:45:23,17743410,,7,0,0,False,House,House,Lewis Real Estate - Heidelberg,38534,Amelie Cutinelli,"Air conditioning, Built in wardrobes, Gas, Internal Laundry, Secure Parking",https://www.domain.com.au/11-brickworks-dr-brunswick-vic-3056-17743410
17743509,BRUNSWICK,3056,515.0,2238.0,"Monday, 06 October 2025",2025-09-02,7,2,1,1.0,Apartment / Unit / Flat,1/171 Albert Street,-37.76924,144.96667,2025-09-09 16:45:23,17743509,,8,0,1,False,Apartment,Apartment / Unit / Flat,Barry Plant (Brunswick-Coburg),6048,Tahlia Moussa,"Air conditioning, Built in wardrobes, Internal Laundry, Heating",https://www.domain.com.au/1-171-albert-street-brunswick-vic-3056-17743509
17744307,BRUNSWICK,3056,430.0,1868.0,"Wednesday, 03 September 2025",2025-09-03,6,1,1,,Apartment / Unit / Flat,107/26 Breese Street,-37.76259,144.96172,2025-09-09 16:45:23,17744307,,11,0,1,False,Apartment,Apartment / Unit / Flat,Metro Real Estate Pty Ltd,3997,Quoc Ho,"Air conditioning, Furnished, Built in wardrobes, Internal Laundry",https://www.domain.com.au/107-26-breese-street-brunswick-vic-3056-17744307
17744652,BRUNSWICK,3056,570.0,2477.0,"Thursday, 18 September 2025",2025-09-03,6,1,1,1.0,Apartment / Unit / Flat,504/2 Duckett Street,-37.763027,144.96095,2025-09-09 16:45:23,17744652,,12,0,0,False,Apartment,Apartment / Unit / Flat,Ray White Pascoe Vale,36756,Filiz Cabukoglu,"Secure Parking, Balcony / Deck",https://www.domain.com.au/504-2-duckett-street-brunswick-vic-3056-17744652
17745657,BRUNSWICK,3056,495.0,2150.0,"Monday, 15 September 2025",2025-09-03,6,1,1,,Apartment / Unit / Flat,209/2A Michael Street,-37.77253,144.96051,2025-09-09 16:45:23,17745657,,7,0,0,False,Apartment,Apartment / Unit / Flat,Nelson Alexander Fitzroy,4718,Imigen Johnson,"Gas, Intercom, Heating, Balcony / Deck",https://www.domain.com.au/209-2a-michael-street-brunswick-vic-3056-17745657
17746240,BRUNSWICK,3056,830.0,3596.0,"Monday, 01 September 2025",2025-09-03,5,2,2,1.0,Apartment / Unit / Flat,406/7 Ovens St,-37.765778,144.96094,2025-09-09 16:45:23,17746240,,16,0,1,False,Apartment,Apartment / Unit / Flat,RentBetter,27499,,"Air conditioning, Balcony / Deck, Built in wardrobes, Dishwasher, Furnished, Garden / Courtyard, Heating, Intercom, Secure Parking",https://www.domain.com.au/406-7-ovens-st-brunswick-vic-3056-17746240
17746506,BRUNSWICK,3056,600.0,2607.0,"Friday, 12 September 2025",2025-09-04,5,2,1,1.0,Apartment / Unit / Flat,3B/10 Breese Street,-37.763367,144.96158,2025-09-09 16:45:23,17746506,,9,0,0,False,Apartment,Apartment / Unit / Flat,Belle Property Carlton | Melbourne | North Melbourne,24322,Helena Eglezos,"Air conditioning, Built in wardrobes, Intercom, Floorboards, Secure Parking, Dishwasher",https://www.domain.com.au/3b-10-breese-street-brunswick-vic-3056-17746506
17746948,BRUNSWICK,3056,1300.0,5649.0,"Thursday, 04 September 2025",2025-09-04,5,3,2,1.0,Townhouse,1E Stewart Street,-37.76332,144.96336,2025-09-09 16:45:23,17746948,,12,0,1,False,Townhouse/Villa,Townhouse,Capital Property Marketing,32412,Lana Juresko-Krpina,"Built in wardrobes, Dishwasher, Ensuite, Floorboards, Intercom, Study, Balcony, Courtyard, Deck, Fully fenced, Outdoor Entertainment, Remote Garage, Secure Parking, Split System (Heating), Split System (Air Con)",https://www.domain.com.au/1e-stewart-street-brunswick-vic-3056-17746948
17748566,BRUNSWICK,3056,560.0,2433.0,"Tuesday, 07 October 2025",2025-09-05,4,2,1,,Apartment / Unit / Flat,2/478 Sydney Road,-37.766754,144.9624,2025-09-09 16:45:23,17748566,,12,0,0,False,Apartment,Apartment / Unit / Flat,Jellis Craig - Brunswick,6216,Brandon Antrim,"Split System Air Con, Split System Heating, Balcony / Deck, Built in wardrobes, Dishwasher, Floorboards",https://www.domain.com.au/2-478-sydney-road-brunswick-vic-3056-17748566
10475427,BRUNSWICK,3056,620.0,2694.0,"Friday, 22 August 2025",2025-08-22,18,2,2,1.0,Apartment / Unit / Flat,2/1 Gumbri Place,-37.76958,144.95328,2025-09-09 16:45:28,10475427,DW-9452-TL,6,0,0,False,Apartment,Apartment / Unit / Flat,LITTLE Real Estate Victoria,24974,Amira Khatoun,"Car Accom: Single Off-Street Parking, Heating: Other, Cooking: Electric Hotplates & Oven",https://www.domain.com.au/2-1-gumbri-place-brunswick-vic-3056-10475427
12881206,BRUNSWICK,3056,795.0,3445.0,"Saturday, 27 September 2025",2025-08-19,21,3,2,2.0,House,38b Dunstan Avenue,-37.75927,144.97353,2025-09-09 16:45:28,12881206,MF-7591-MR,5,0,0,False,House,House,Walshe & Whitelock Pty Ltd,29046,"Walshe and Whitelock, Matthew Zammit","Heating, Air conditioning, Built in wardrobes, Secure Parking, Separate Laundry, Floorboards, Courtyard",https://www.domain.com.au/38b-dunstan-avenue-brunswick-vic-3056-12881206
14324162,BRUNSWICK,3056,600.0,2607.0,"Saturday, 06 September 2025",2025-09-01,8,2,1,1.0,Townhouse,2/102 Union Street,-37.773167,144.95456,2025-09-09 16:45:28,14324162,SG-4375-EA,12,0,1,False,Townhouse/Villa,Townhouse,LITTLE Real Estate Victoria,24974,Cooper Modica,"Car Accom: Single Garage, Cooking: Gas Upright Stove",https://www.domain.com.au/2-102-union-street-brunswick-vic-3056-14324162
15248600,BRUNSWICK,3056,550.0,2390.0,"Thursday, 25 September 2025",2025-08-25,15,2,1,1.0,Apartment / Unit / Flat,307/611 Sydney Road,-37.76269,144.96266,2025-09-09 16:45:28,15248600,ZQ-2547-HC,13,1,0,False,Apartment,Apartment / Unit / Flat,Samma Real Estate,15424,Allen Iverson,"Intercom, Floorboards, Built in wardrobes, Dishwasher, Split System Heating, Reverse Cycle Air Conditioning, Balcony, Remote Garage, Secure Parking",https://www.domain.com.au/307-611-sydney-road-brunswick-vic-3056-15248600
16731446,BRUNSWICK,3056,750.0,3260.0,"Friday, 19 September 2025",2025-08-26,14,2,1,1.0,Apartment / Unit / Flat,204/18 Lobb Street,-37.76847,144.96461,2025-09-09 16:45:28,16731446,AX-3586-LE,14,0,0,True,Apartment,Apartment / Unit / Flat,Richardson & Wrench Projects Victoria,31321,Daniel Aldieri,"Dishwasher, Split System Heating, Split System Air Conditioning, Furnished",https://www.domain.com.au/204-18-lobb-street-brunswick-vic-3056-16731446
17621114,BRUNSWICK,3056,340.0,1477.0,"Tuesday, 02 September 2025",2025-09-01,7,1,1,,Apartment / Unit / Flat,787 Park Street,-37.777004,144.95436,2025-09-09 16:45:28,17621114,,4,0,0,False,Apartment,Apartment / Unit / Flat,Park & Weston Pty Ltd,15728,"Kym Ryan, Martine Bannister","Heating, Built in wardrobes, Intercom",https://www.domain.com.au/787-park-street-brunswick-vic-3056-17621114
17718030,BRUNSWICK,3056,950.0,5077.0,"Friday, 22 August 2025",2025-08-15,25,3,2,1.0,House,148 Donald Street,-37.75882,144.97327,2025-09-09 16:45:28,17718030,,13,0,1,False,House,House,Jellis Craig - Brunswick,6216,"Brandon Antrim, Elliott Heslop","Split System Air Con, Split System Heating, Built in wardrobes, Dishwasher, Floorboards, Secure Parking",https://www.domain.com.au/148-donald-street-brunswick-vic-3056-17718030
17724368,BRUNSWICK,3056,800.0,,"Friday, 22 August 2025",2025-08-20,20,3,1,,Studio,Upper Floor/297 Sydney Road,-37.770588,144.96129,2025-09-09 16:45:28,17724368,,8,0,0,False,Apartment,Studio,A E Gibson & Co The Professionals Glenroy,29857,Peter Gibson,"Air conditioning, Laundry",https://www.domain.com.au/upper-floor-297-sydney-road-brunswick-vic-3056-17724368
17727503,BRUNSWICK,3056,850.0,3693.0,"Monday, 22 September 2025",2025-08-22,18,3,2,1.0,Townhouse,5 Amelia Street,-37.77635,144.96558,2025-09-09 16:45:28,17727503,,6,0,0,False,Townhouse/Villa,Townhouse,Jellis Craig - Brunswick,6216,David Johnston,"Split System Air Con, Split System Heating, Balcony / Deck, Study, Built in wardrobes, Dishwasher, Remote Garage, Secure Parking",https://www.domain.com.au/5-amelia-street-brunswick-vic-3056-17727503
17727845,BRUNSWICK,3056,530.0,2303.0,"Friday, 26 September 2025",2025-08-22,18,2,1,,House,3/405 Brunswick Road,-37.77561,144.94943,2025-09-09 16:45:28,17727845,,6,0,0,False,House,House,Barry Plant Manningham,7015,"Paul Sim, Pamela Wilson","Gas, Internal Laundry, Dishwasher",https://www.domain.com.au/3-405-brunswick-road-brunswick-vic-3056-17727845
17729898,BRUNSWICK,3056,700.0,3042.0,"Monday, 29 September 2025",2025-08-25,15,2,1,1.0,Townhouse,14/80 Hope Street,-37.763454,144.95676,2025-09-09 16:45:28,17729898,,8,0,2,False,Townhouse/Villa,Townhouse,Woodards,19,Doug King,"Air conditioning, Built in wardrobes, Gas, Internal Laundry, Heating, Dishwasher",https://www.domain.com.au/14-80-hope-street-brunswick-vic-3056-17729898
17730578,BRUNSWICK,3056,980.0,,"Monday, 25 August 2025",2025-08-25,15,3,1,2.0,House,54 Cassels Road,-37.756416,144.96008,2025-09-09 16:45:28,17730578,,9,0,0,False,House,House,OBrien Real Estate Preston/Reservoir,30751,Anna Varrica,"Gas, Internal Laundry, Secure Parking, Heating, Dishwasher",https://www.domain.com.au/54-cassels-road-brunswick-vic-3056-17730578
17733256,BRUNSWICK,3056,750.0,3259.0,"Saturday, 06 September 2025",2025-08-27,13,2,2,1.0,Townhouse,4/4 Florence Street Brunswick,-37.761406,144.96114,2025-09-09 16:45:28,17733256,,9,0,1,True,Townhouse/Villa,Townhouse,Outlook Property Group,21388,"Rebecca Ozmetin, Onder Ozmetin","Bath, Remote garage, Secure Parking, Built in wardrobes, Intercom, Broadband, Dishwasher, Floorboards, Cable or Satellite, Study, Air conditioning, Solar hot water, 0, Energy Eff. Rating: 6",https://www.domain.com.au/4-4-florence-street-brunswick-brunswick-vic-3056-17733256
17733884,BRUNSWICK,3056,570.0,2477.0,"Monday, 29 September 2025",2025-08-27,13,2,1,1.0,Apartment / Unit / Flat,309/201-207 Albert Street,-37.768753,144.96487,2025-09-09 16:45:28,17733884,,5,0,0,False,Apartment,Apartment / Unit / Flat,The Hopkins Group,17841,Phoebe Tayler,,https://www.domain.com.au/309-201-207-albert-street-brunswick-vic-3056-17733884
17734095,BRUNSWICK,3056,550.0,2390.0,"Tuesday, 16 September 2025",2025-08-27,13,2,1,2.0,Apartment / Unit / Flat,2/815 Park Street,-37.77695,144.95279,2025-09-09 16:45:28,17734095,,8,0,1,True,Apartment,Apartment / Unit / Flat,Woodards,19,Sharyn Webber,"Built in wardrobes, Internal Laundry, Intercom, Broadband internet access, Bath, Heating, Balcony / Deck",https://www.domain.com.au/2-815-park-street-brunswick-vic-3056-17734095
17735861,BRUNSWICK,3056,825.0,3585.0,"Friday, 19 September 2025",2025-08-28,12,3,1,1.0,House,29 Collier Crescent,-37.771706,144.95161,2025-09-09 16:45:28,17735861,,7,0,0,False,House,House,Nelson Alexander Brunswick,4720,Daniel Carusi,"Built in wardrobes, Gas, Heating",https://www.domain.com.au/29-collier-crescent-brunswick-vic-3056-17735861
17738665,BRUNSWICK,3056,800.0,3476.0,"Monday, 29 September 2025",2025-08-29,11,2,1,,House,8 Bourke Street,-37.76697,144.96722,2025-09-09 16:45:28,17738665,,11,0,1,False,House,House,Woodards,19,Caroline DeAbel,"Built in wardrobes, Gas, Internal Laundry, Fireplace(s), Heating, Dishwasher, Balcony / Deck",https://www.domain.com.au/8-bourke-street-brunswick-vic-3056-17738665
17738862,BRUNSWICK,3056,640.0,2781.0,"Friday, 12 September 2025",2025-08-29,11,2,1,1.0,House,332 Albion Street,-37.75979,144.95279,2025-09-09 16:45:28,17738862,,8,0,1,False,House,House,Nelson Alexander Brunswick,4720,Prudence Walton-Pearce,Heating,https://www.domain.com.au/332-albion-street-brunswick-vic-3056-17738862
17741549,BRUNSWICK,3056,950.0,4128.0,"Monday, 22 September 2025",2025-09-01,8,3,2,1.0,Townhouse,35 Amelia Street,-37.77581,144.96593,2025-09-09 16:45:28,17741549,,14,0,1,False,Townhouse/Villa,Townhouse,The Neighbourhood Property Collective,31493,"Carmela Dimasi, Chris Gialis","Internal Laundry, Broadband internet access, Balcony, Deck, Outdoor Entertainment Area, Remote Garage, Built in wardrobes, Dishwasher, Floorboards, Intercom, Split-System Air Conditioning, Split-System Heating, Ensuite",https://www.domain.com.au/35-amelia-street-brunswick-vic-3056-17741549
17741791,BRUNSWICK,3056,975.0,4237.0,"Saturday, 04 October 2025",2025-09-01,8,3,2,1.0,House,62 Dunstan Avenue,-37.757824,144.97382,2025-09-09 16:45:28,17741791,,7,0,0,False,House,House,Nelson Alexander Coburg,22514,Travis Reeves,"Air conditioning, Internal Laundry, Bath, Heating, Dishwasher",https://www.domain.com.au/62-dunstan-avenue-brunswick-vic-3056-17741791
