listing_id,suburb,postcode,weekly_rent,bond,available_date,date_listed,days_listed,bedrooms,bathrooms,carspaces,property_type,address,lat,lon,scraped_date,domain_page_id,property_id,photo_count,video_count,floorplans_count,virtual_tour,primary_type,secondary_type,agency,agency_id,agent_names,structured_features,url
17744899,FOOTSCRAY,3011,575.0,2499.0,"Friday, 12 September 2025",2025-09-03,6,2,1,,House,57 Pickett Street,-37.801502,144.89392,2025-09-09 16:33:49,17744899,,14,0,0,False,House,House,Jas Stephens Real Estate,22,Cassie Favero,"Built in wardrobes, Internal Laundry, Fireplace(s), Heating",https://www.domain.com.au/57-pickett-street-footscray-vic-3011-17744899
14378239,FOOTSCRAY,3011,450.0,1950.0,"Saturday, 16 August 2025",2025-08-11,29,1,1,1.0,Apartment / Unit / Flat,301/55 Hopkins Street,-37.80059,144.90527,2025-09-09 16:33:55,14378239,WY-2384-FF,9,0,0,False,Apartment,Apartment / Unit / Flat,Raine & Horne Footscray,19896,"Richard Miller, Anna Dao","Secure Parking, Air conditioning, Built in wardrobes, Balcony / Deck",https://www.domain.com.au/301-55-hopkins-street-footscray-vic-3011-14378239
15336283,FOOTSCRAY,3011,530.0,2303.0,"Monday, 29 September 2025",2025-08-28,12,1,1,1.0,Apartment / Unit / Flat,604/6 Joseph Road,-37.800327,144.90956,2025-09-09 16:33:55,15336283,XQ-1212-DZ,10,1,1,False,Apartment,Apartment / Unit / Flat,Richardson & Wrench Projects Victoria,31321,Daniel Aldieri,"Gym, Intercom, Study, Floorboards, Built in wardrobes, Dishwasher, Gas Appliances, Split System Heating, Split System Air Conditioning, Balcony, Remote Garage, Secure Parking",https://www.domain.com.au/604-6-joseph-road-footscray-vic-3011-15336283
16587921,FOOTSCRAY,3011,370.0,1608.0,"Monday, 22 September 2025",2025-08-28,12,1,1,1.0,Apartment / Unit / Flat,3/37 Macpherson Street,-37.79408,144.89038,2025-09-09 16:33:55,16587921,HJ-5856-WO,10,0,0,False,Apartment,Apartment / Unit / Flat,JWC Property Group,32932,Billy Soe,"Built in wardrobes, Bath",https://www.domain.com.au/3-37-macpherson-street-footscray-vic-3011-16587921
16722426,FOOTSCRAY,3011,550.0,2548.0,"Thursday, 18 September 2025",2025-08-27,12,2,1,,Apartment / Unit / Flat,301/35 Victoria Street,-37.80146,144.89291,2025-09-09 16:33:55,16722426,YY-8065-BO,10,0,0,False,Apartment,Apartment / Unit / Flat,Lease A Property ,21230,Marc Angelone,"Internal Laundry, Intercom, Heating, Dishwasher, Balcony / Deck, Pets Allowed",https://www.domain.com.au/301-35-victoria-street-footscray-vic-3011-16722426
17284905,FOOTSCRAY,3011,450.0,1955.0,"Wednesday, 10 September 2025",2025-08-29,11,2,1,1.0,Apartment / Unit / Flat,7/28 Eldridge Street,-37.78865,144.89325,2025-09-09 16:33:55,17284905,SC-8726-OZ,6,0,0,False,Apartment,Apartment / Unit / Flat,Burnham Real Estate Footscray,3381,Bryson De Guzman,"Built in wardrobes, Internal Laundry, Balcony / Deck",https://www.domain.com.au/7-28-eldridge-street-footscray-vic-3011-17284905
17617585,FOOTSCRAY,3011,320.0,1390.0,"Thursday, 12 June 2025",2025-06-12,89,1,1,,Apartment / Unit / Flat,5/98 Nicholson Street,-37.800262,144.89928,2025-09-09 16:33:55,17617585,,4,0,1,False,Apartment,Apartment / Unit / Flat,APG ESTATE,30107,"Leor Wong, Rental Department","Floorboards, Split System Heating, Split System Air Conditioning, Balcony",https://www.domain.com.au/5-98-nicholson-street-footscray-vic-3011-17617585
17698438,FOOTSCRAY,3011,680.0,2955.0,"Friday, 22 August 2025",2025-08-04,36,3,2,1.0,House,30 Titch Street,-37.789288,144.89268,2025-09-09 16:33:55,17698438,,15,0,0,False,House,House,Jas Stephens Real Estate,22,"Alexandra Damasoliotis, Alex Boyce","Built in wardrobes, Bathtub, Split System Heating, Split System Air Conditioning, Ensuite(s), Balcony",https://www.domain.com.au/30-titch-street-footscray-vic-3011-17698438
17699829,FOOTSCRAY,3011,370.0,1608.0,"Monday, 04 August 2025",2025-08-04,35,1,1,1.0,Apartment / Unit / Flat,3/44 Geelong Road,-37.797005,144.89514,2025-09-09 16:33:55,17699829,,8,0,0,True,Apartment,Apartment / Unit / Flat,P Di Natale Real Estate,15264,Anthony Amanatidis,"Built in wardrobes, Split-System Air Conditioning, Split-System Heating",https://www.domain.com.au/3-44-geelong-road-footscray-vic-3011-17699829
17716262,FOOTSCRAY,3011,600.0,2607.0,"Tuesday, 02 September 2025",2025-08-14,25,2,2,1.0,Apartment / Unit / Flat,726/18 Albert Street,-37.801308,144.89767,2025-09-09 16:33:55,17716262,,9,0,0,False,Apartment,Apartment / Unit / Flat,Nelson Alexander Essendon,4722,Mia Stanley,"Gas, Internal Laundry, Heating, Balcony / Deck",https://www.domain.com.au/726-18-albert-street-footscray-vic-3011-17716262
17721418,FOOTSCRAY,3011,425.0,1850.0,"Tuesday, 19 August 2025",2025-08-19,21,1,1,1.0,Apartment / Unit / Flat,10/21 Eldridge St,-37.78911,144.89272,2025-09-09 16:33:55,17721418,,6,0,1,False,Apartment,Apartment / Unit / Flat,Jarrel Estate Agents,3691,Leasing Manager,"Heating, Air conditioning, Built in wardrobes, Pets Allowed",https://www.domain.com.au/10-21-eldridge-st-footscray-vic-3011-17721418
17726429,FOOTSCRAY,3011,600.0,2607.0,"Tuesday, 19 August 2025",2025-08-21,19,2,1,,Apartment / Unit / Flat,1014/188 Ballarat Road,-37.791363,144.89069,2025-09-09 16:33:55,17726429,,18,0,0,False,Apartment,Apartment / Unit / Flat,Lifein Real Estate Pty Ltd,32895,Inchi Zhang,"Internal Laundry, Air conditioning, Floorboards, Built in wardrobes, Gas, Dishwasher, Balcony / Deck",https://www.domain.com.au/1014-188-ballarat-road-footscray-vic-3011-17726429
17730491,FOOTSCRAY,3011,600.0,2607.0,"Friday, 19 September 2025",2025-08-25,15,2,2,1.0,Apartment / Unit / Flat,1710/8 Hallenstein St,-37.80004,144.9082,2025-09-09 16:33:55,17730491,,9,0,0,False,Apartment,Apartment / Unit / Flat,Bow Residential,33223,Patrick Siah,"Built in wardrobes, Balcony / Deck",https://www.domain.com.au/1710-8-hallenstein-st-footscray-vic-3011-17730491
17730703,FOOTSCRAY,3011,550.0,2390.0,"Wednesday, 27 August 2025",2025-08-25,15,2,2,1.0,Apartment / Unit / Flat,202/27-29 Victoria Street,-37.801,144.893,2025-09-09 16:33:55,17730703,,11,0,1,False,Apartment,Apartment / Unit / Flat,Nelson Alexander Brunswick,4720,Prudence Walton-Pearce,"Built in wardrobes, Intercom, Heating, Dishwasher, Balcony / Deck",https://www.domain.com.au/202-27-29-victoria-street-footscray-vic-3011-17730703
17731173,FOOTSCRAY,3011,680.0,2955.0,"Sunday, 24 August 2025",2025-08-26,14,3,2,2.0,Apartment / Unit / Flat,318/1 Moreland St,-37.80162,144.9082,2025-09-09 16:33:55,17731173,,1,0,0,False,Apartment,Apartment / Unit / Flat,First National Real Estate D & K ,15204,"Dorothy Schembri, Jordon Gillett",,https://www.domain.com.au/318-1-moreland-st-footscray-vic-3011-17731173
17732461,FOOTSCRAY,3011,725.0,2960.0,"Friday, 03 October 2025",2025-08-26,14,3,2,1.0,House,3 Dudley Street,-37.79421,144.88351,2025-09-09 16:33:55,17732461,,15,0,1,False,House,House,RentBetter,27499,,"Internal Laundry, Bath, Shed, Balcony / Deck, Air conditioning, Built in wardrobes, Dishwasher, Fully fenced, Pets Allowed, Secure Parking",https://www.domain.com.au/3-dudley-street-footscray-vic-3011-17732461
17735498,FOOTSCRAY,3011,610.0,2651.0,"Monday, 15 September 2025",2025-08-27,12,2,2,1.0,Apartment / Unit / Flat,608/2 Hallenstein St,-37.80043,144.90816,2025-09-09 16:33:55,17735498,,5,0,0,False,Apartment,Apartment / Unit / Flat,Bow Residential,33223,Patrick Siah,"Gym, Dishwasher, Split System Heating, Air conditioning, Gas Hot Water, Above Ground Pool",https://www.domain.com.au/608-2-hallenstein-st-footscray-vic-3011-17735498
17735746,FOOTSCRAY,3011,675.0,2933.0,"Monday, 29 September 2025",2025-08-28,12,2,2,1.0,Apartment / Unit / Flat,2705/6 Joseph Road,-37.800327,144.90956,2025-09-09 16:33:55,17735746,,13,0,1,False,Apartment,Apartment / Unit / Flat,Richardson & Wrench Projects Victoria,31321,Daniel Aldieri,"Dishwasher, Split System Heating, Split System Air Conditioning",https://www.domain.com.au/2705-6-joseph-road-footscray-vic-3011-17735746
17736985,FOOTSCRAY,3011,795.0,3454.0,"Tuesday, 02 September 2025",2025-08-28,12,2,3,1.0,House,6/8 Rosamond Road,-37.788086,144.88338,2025-09-09 16:33:55,17736985,,10,0,0,True,House,House,Ray White Southbank,20626,Alex Mees,Furnished,https://www.domain.com.au/6-8-rosamond-road-footscray-vic-3011-17736985
17737597,FOOTSCRAY,3011,490.0,2129.0,"Tuesday, 02 September 2025",2025-08-29,11,2,1,1.0,Apartment / Unit / Flat,3/20 Stanlake Street,-37.79154,144.88336,2025-09-09 16:33:55,17737597,,15,0,0,False,Apartment,Apartment / Unit / Flat,Jas Stephens Real Estate,22,"Caitlyn Colquhoun, Alex Boyce","Built in wardrobes, Secure Parking",https://www.domain.com.au/3-20-stanlake-street-footscray-vic-3011-17737597
17738238,FOOTSCRAY,3011,460.0,1999.0,"Monday, 01 September 2025",2025-08-29,11,2,1,1.0,Apartment / Unit / Flat,3/18 Eldridge Street,-37.789543,144.89307,2025-09-09 16:33:55,17738238,,11,0,0,False,Apartment,Apartment / Unit / Flat,Areal Property - Hawthorn,12104,Kevin Sun,"Air conditioning, Dishwasher, Furnished",https://www.domain.com.au/3-18-eldridge-street-footscray-vic-3011-17738238
8431360,FOOTSCRAY,3011,300.0,1304.0,"Thursday, 20 February 2020",2018-09-20,2546,1,1,,Studio,133 Droop Street,-37.79257,144.8933,2025-09-09 16:34:01,8431360,,6,0,1,False,Apartment,Studio,Student Housing Australia,11870,Huey Lim,"Intercom, Built in wardrobes, Furnished",https://www.domain.com.au/133-droop-street-footscray-vic-3011-8431360
11777326,FOOTSCRAY,3011,310.0,1564.0,"Monday, 19 September 2022",2017-11-10,2860,1,1,,Apartment / Unit / Flat,117-119 Ballarat Road,-37.79313,144.8955,2025-09-09 16:34:01,11777326,,2,0,1,False,Apartment,Apartment / Unit / Flat,Student Housing Australia,11870,Huey Lim,"Split System Air Con, Balcony / Deck, Built in wardrobes, Furnished, Air conditioning",https://www.domain.com.au/117-119-ballarat-road-footscray-vic-3011-11777326
11850097,FOOTSCRAY,3011,340.0,1477.0,"Monday, 18 August 2025",2025-08-18,22,1,1,,Apartment / Unit / Flat,10/117-119 Ballarat Road,-37.793148,144.89545,2025-09-09 16:34:01,11850097,,8,1,2,False,Apartment,Apartment / Unit / Flat,Student Housing Australia,11870,Huey Lim,"Air conditioning, Built in wardrobes, Gas, Furnished, Intercom, Heating",https://www.domain.com.au/10-117-119-ballarat-road-footscray-vic-3011-11850097
16295730,FOOTSCRAY,3011,390.0,1695.0,"Friday, 05 September 2025",2025-08-19,21,1,1,1.0,Apartment / Unit / Flat,2/37 Macpherson Street,-37.79408,144.89038,2025-09-09 16:34:01,16295730,XL-7816-VO,10,0,0,False,Apartment,Apartment / Unit / Flat,JWC Property Group,32932,Billy Soe,"Built in wardrobes, Bath",https://www.domain.com.au/2-37-macpherson-street-footscray-vic-3011-16295730
16587889,FOOTSCRAY,3011,480.0,2086.0,"Wednesday, 10 September 2025",2025-08-18,22,1,1,1.0,Apartment / Unit / Flat,1306E/6 Tannery Walk,-37.800232,144.9071,2025-09-09 16:34:01,16587889,DH-2561-OY,10,0,0,False,Apartment,Apartment / Unit / Flat,JWC Property Group,32932,Billy Soe,"Built in wardrobes, Gas, Gym, Dishwasher, Balcony / Deck",https://www.domain.com.au/1306e-6-tannery-walk-footscray-vic-3011-16587889
16802315,FOOTSCRAY,3011,570.0,2477.0,"Monday, 25 August 2025",2025-08-18,22,2,2,1.0,Apartment / Unit / Flat,303/205-207 Ballarat Road,-37.791122,144.88885,2025-09-09 16:34:01,16802315,BZ-2173-OL,6,0,1,False,Apartment,Apartment / Unit / Flat,Bow Residential,33223,Patrick Siah,"Built in wardrobes, Gas, Internal Laundry, Intercom, Heating, Dishwasher",https://www.domain.com.au/303-205-207-ballarat-road-footscray-vic-3011-16802315
17022830,FOOTSCRAY,3011,620.0,2694.0,"Friday, 22 August 2025",2025-08-19,21,2,2,1.0,Apartment / Unit / Flat,502/6 Joseph Road,-37.800327,144.90956,2025-09-09 16:34:01,17022830,HX-7675-ZP,17,0,2,False,Apartment,Apartment / Unit / Flat,Burnham Real Estate Footscray,3381,Bryson De Guzman,"Gas, Balcony / Deck",https://www.domain.com.au/502-6-joseph-road-footscray-vic-3011-17022830
17694299,FOOTSCRAY,3011,600.0,2608.0,"Tuesday, 02 September 2025",2025-07-31,40,3,1,1.0,Townhouse,8/29 Gordon Street,-37.79007,144.88992,2025-09-09 16:34:01,17694299,,11,0,1,False,Townhouse/Villa,Townhouse,JMRE Real Estate,24502,Molly Bradshaw,"Air conditioning, Heating, Built in wardrobes, Close to transport, Close to shops, Close to schools",https://www.domain.com.au/8-29-gordon-street-footscray-vic-3011-17694299
17711897,FOOTSCRAY,3011,600.0,2607.0,"Tuesday, 12 August 2025",2025-08-12,28,2,2,1.0,Apartment / Unit / Flat,907/8 Hallenstein Street,-37.80004,144.9082,2025-09-09 16:34:01,17711897,,12,1,0,False,Apartment,Apartment / Unit / Flat,Forge Group Australia Pty Ltd,32680,"Wayne Deng, Forge Leasing","Swimming Pool, Gym, Heating, Balcony, Remote Garage, Secure Parking, Broadband Internet Available, Built in wardrobes, Dishwasher, Floorboards, Intercom, Study, Air conditioning",https://www.domain.com.au/907-8-hallenstein-street-footscray-vic-3011-17711897
17717122,FOOTSCRAY,3011,500.0,2173.0,"Tuesday, 16 September 2025",2025-08-15,25,1,1,1.0,Apartment / Unit / Flat,1108C/6 Joseph Road,-37.79914,144.90976,2025-09-09 16:34:01,17717122,,6,0,0,False,Apartment,Apartment / Unit / Flat,Wood Property,27439,"Jade Wilson, Brooke `Te Angina","Built in wardrobes, Gas, Secure Parking, Balcony / Deck",https://www.domain.com.au/1108c-6-joseph-road-footscray-vic-3011-17717122
17717841,FOOTSCRAY,3011,425.0,1847.0,"Friday, 19 September 2025",2025-08-15,25,1,1,1.0,Apartment / Unit / Flat,4/129 Hyde Street,-37.810272,144.89899,2025-09-09 16:34:01,17717841,,11,0,1,False,Apartment,Apartment / Unit / Flat,Reside Real Estate,22849,Anthony Watson,"Built in wardrobes, Air conditioning, Heating, Close to transport, Close to shops, Close to schools, Carpeted",https://www.domain.com.au/4-129-hyde-street-footscray-vic-3011-17717841
17720015,FOOTSCRAY,3011,580.0,2520.0,"Friday, 19 September 2025",2025-08-18,22,2,1,,Townhouse,6b Liverpool Street,-37.794025,144.88258,2025-09-09 16:34:01,17720015,,6,0,0,False,Townhouse/Villa,Townhouse,Woodards Yarraville,3724,Anastasia Jajo,"Built in wardrobes, Internal Laundry, Heating, Dishwasher",https://www.domain.com.au/6b-liverpool-street-footscray-vic-3011-17720015
17720515,FOOTSCRAY,3011,425.0,1846.0,"Monday, 18 August 2025",2025-08-18,22,2,1,1.0,Apartment / Unit / Flat,13/104 Cross Street,-37.80111,144.88455,2025-09-09 16:34:01,17720515,,9,0,0,False,Apartment,Apartment / Unit / Flat,Melo Real Estate Pty Ltd,38412,Carmelo Caputa,"Internal Laundry, Balcony, Built in wardrobes",https://www.domain.com.au/13-104-cross-street-footscray-vic-3011-17720515
17722090,FOOTSCRAY,3011,500.0,2173.0,"Tuesday, 07 October 2025",2025-08-19,21,1,1,1.0,Apartment / Unit / Flat,802/4 Joseph Road,-37.800327,144.90956,2025-09-09 16:34:01,17722090,,19,0,1,False,Apartment,Apartment / Unit / Flat,Motion Property,8551,"Mark Reading, Nirvana Kane",Pets Allowed,https://www.domain.com.au/802-4-joseph-road-footscray-vic-3011-17722090
17722384,FOOTSCRAY,3011,600.0,2607.0,"Tuesday, 12 August 2025",2025-08-19,21,2,2,1.0,Apartment / Unit / Flat,907/8 Hallenstein Street,-37.80004,144.9082,2025-09-09 16:34:01,17722384,,12,1,0,False,Apartment,Apartment / Unit / Flat,Forge Group Australia Pty Ltd,32680,"Wayne Deng, Forge Leasing","Swimming Pool, Gym, Heating, Balcony, Remote Garage, Secure Parking, Broadband Internet Available, Built in wardrobes, Dishwasher, Floorboards, Intercom, Study, Air conditioning",https://www.domain.com.au/907-8-hallenstein-street-footscray-vic-3011-17722384
17722468,FOOTSCRAY,3011,610.0,2651.0,"Monday, 08 September 2025",2025-08-19,21,2,2,1.0,Apartment / Unit / Flat,1003/5 Joseph Road,-37.80022,144.90916,2025-09-09 16:34:01,17722468,,11,0,0,False,Apartment,Apartment / Unit / Flat,VICPROP Point Cook and Williams Landing,33528,"Lisha Wen, Leasing Team Vicprop","Air conditioning, Gas, Gym, Intercom, Dishwasher, Balcony / Deck",https://www.domain.com.au/1003-5-joseph-road-footscray-vic-3011-17722468
17722690,FOOTSCRAY,3011,650.0,2824.0,"Tuesday, 23 September 2025",2025-08-19,21,2,2,1.0,Apartment / Unit / Flat,2402C/6 Joseph Road,-37.79914,144.90976,2025-09-09 16:34:01,17722690,,14,0,0,False,Apartment,Apartment / Unit / Flat,Image Property South Melbourne,31002,Jacinta Azzopardi,"Air conditioning, Gas, Internal Laundry, Secure Parking, Broadband internet access, Heating, Dishwasher, Balcony / Deck",https://www.domain.com.au/2402c-6-joseph-road-footscray-vic-3011-17722690
17723588,FOOTSCRAY,3011,625.0,2716.0,"Friday, 29 August 2025",2025-08-20,20,2,2,1.0,Apartment / Unit / Flat,810/1 Joseph Rd,-37.800526,144.90912,2025-09-09 16:34:01,17723588,,13,0,0,False,Apartment,Apartment / Unit / Flat,Area Specialist Dynamic,38901,Siena Andrit,"Heating, Air conditioning, Secure Parking, Intercom, Swimming Pool, Balcony / Deck, Broadband internet access, Built in wardrobes, Floorboards, Gym, Internal Laundry, Pets Allowed",https://www.domain.com.au/810-1-joseph-rd-footscray-vic-3011-17723588
17723812,FOOTSCRAY,3011,710.0,3085.0,"Wednesday, 20 August 2025",2025-08-20,20,4,1,1.0,House,8 Southampton street,-37.794773,144.88612,2025-09-09 16:34:01,17723812,,7,0,0,False,House,House,Nguyen Real Estate,19313,"Andy Toan Pham, Kevin Nguyen","Gas, Internal Laundry, Heating, Dishwasher",https://www.domain.com.au/8-southampton-street-footscray-vic-3011-17723812
17723990,FOOTSCRAY,3011,570.0,2477.0,"Thursday, 11 September 2025",2025-08-20,20,2,1,1.0,Apartment / Unit / Flat,501/94 Buckley Street,-37.80336,144.89397,2025-09-09 16:34:01,17723990,,10,0,0,False,Apartment,Apartment / Unit / Flat,Nicholas Scott Real Estate,8676,Lisa Nguyen,"Built in wardrobes, Balcony / Deck, Air conditioning, Alarm System, Swimming Pool, City Views",https://www.domain.com.au/501-94-buckley-street-footscray-vic-3011-17723990
8548283,FOOTSCRAY,3011,300.0,1304.0,"Monday, 18 August 2025",2025-05-07,125,1,1,,Studio,220/133 Droop Street,-37.792564,144.89342,2025-09-09 16:34:06,8548283,YN-0784-BH,10,0,2,False,Apartment,Studio,Student Housing Australia,11870,Huey Lim,,https://www.domain.com.au/220-133-droop-street-footscray-vic-3011-8548283
11970124,FOOTSCRAY,3011,340.0,1477.0,"Tuesday, 12 August 2025",2025-08-05,34,1,1,,Apartment / Unit / Flat,30/117-119 Ballarat Road,-37.793148,144.89545,2025-09-09 16:34:06,11970124,,8,1,2,False,Apartment,Apartment / Unit / Flat,Student Housing Australia,11870,Huey Lim,"Gas, Split System Air Con, Split System Heating, Balcony / Deck, Built in wardrobes, Furnished, Intercom, Rumpus Room, Washing/Dryer Machine",https://www.domain.com.au/30-117-119-ballarat-road-footscray-vic-3011-11970124
15459474,FOOTSCRAY,3011,525.0,2282.0,"Thursday, 11 September 2025",2025-08-11,29,1,1,1.0,Apartment / Unit / Flat,813/4 Joseph Road,-37.800327,144.90956,2025-09-09 16:34:06,15459474,EN-5391-GM,10,1,1,False,Apartment,Apartment / Unit / Flat,Motion Property,8551,Mark Reading,"Gym, Floorboards, Built in wardrobes, Dishwasher, Gas Appliances, Split System Heating, Split System Air Conditioning, Outdoor Entertainment Area, Balcony, Secure Parking, City Views, Water Views, Pets Allowed",https://www.domain.com.au/813-4-joseph-road-footscray-vic-3011-15459474
16024597,FOOTSCRAY,3011,525.0,2282.0,"Monday, 22 September 2025",2025-08-11,29,1,1,1.0,Apartment / Unit / Flat,1603/6 Joseph Road,-37.800327,144.90956,2025-09-09 16:34:06,16024597,OF-0343-KV,16,1,1,False,Apartment,Apartment / Unit / Flat,Motion Property,8551,"Mark Reading, Nirvana Kane","Intercom, Built in wardrobes, Dishwasher, Split System Heating, Split System Air Conditioning, Balcony",https://www.domain.com.au/1603-6-joseph-road-footscray-vic-3011-16024597
16338832,FOOTSCRAY,3011,620.0,2694.0,"Wednesday, 13 August 2025",2025-08-13,27,2,2,1.0,Apartment / Unit / Flat,603/2 Joseph Road,-37.800327,144.90956,2025-09-09 16:34:06,16338832,LQ-4581-ZP,15,0,1,False,Apartment,Apartment / Unit / Flat,Motion Property,8551,Mark Reading,"Ensuite(s), Pets Allowed",https://www.domain.com.au/603-2-joseph-road-footscray-vic-3011-16338832
16768045,FOOTSCRAY,3011,630.0,2737.0,"Monday, 21 July 2025",2025-08-11,29,2,2,1.0,Apartment / Unit / Flat,2310/1 Warde Street,-37.79945,144.9075,2025-09-09 16:34:06,16768045,NI-8410-ZI,35,0,0,False,Apartment,Apartment / Unit / Flat,Greville Pabst Real Estate Pty Ltd,34777,"Emma-jayne Iles, Cheryl Gravina",Gym,https://www.domain.com.au/2310-1-warde-street-footscray-vic-3011-16768045
17640968,FOOTSCRAY,3011,575.0,2499.0,"Wednesday, 03 September 2025",2025-06-26,75,2,2,1.0,Apartment / Unit / Flat,1109/8 Hallenstein Street,-37.80004,144.9082,2025-09-09 16:34:06,17640968,,6,0,0,False,Apartment,Apartment / Unit / Flat,Motion Property,8551,Sabrina El-Hares,,https://www.domain.com.au/1109-8-hallenstein-street-footscray-vic-3011-17640968
17695313,FOOTSCRAY,3011,640.0,2781.0,"Tuesday, 26 August 2025",2025-07-31,39,2,2,1.0,Apartment / Unit / Flat,1112b/2 Hopkins St,-37.800636,144.90955,2025-09-09 16:34:06,17695313,,7,1,0,True,Apartment,Apartment / Unit / Flat,Wood Property,27439,"Jade Wilson, Brooke `Te Angina","Built in wardrobes, Internal Laundry, Secure Parking",https://www.domain.com.au/1112b-2-hopkins-st-footscray-vic-3011-17695313
17696795,FOOTSCRAY,3011,800.0,3476.0,"Tuesday, 05 August 2025",2025-08-01,39,4,2,,House,43 Droop Street,-37.797684,144.89767,2025-09-09 16:34:06,17696795,,6,0,0,False,House,House,Buxton Inner West,4371,Eliza O'Donnell,"Split System Air Con, Split System Heating, Built in wardrobes, Garden / Courtyard, Dishwasher, Floorboards",https://www.domain.com.au/43-droop-street-footscray-vic-3011-17696795
17701613,FOOTSCRAY,3011,600.0,2607.0,"Friday, 26 September 2025",2025-08-05,35,2,1,1.0,Apartment / Unit / Flat,608/55 Hopkins Street,-37.800606,144.90526,2025-09-09 16:34:06,17701613,,7,0,0,False,Apartment,Apartment / Unit / Flat,Nelson Alexander Flemington,4478,Catherine Maugeri,"Built in wardrobes, Secure Parking, Intercom, Dishwasher, Balcony / Deck",https://www.domain.com.au/608-55-hopkins-street-footscray-vic-3011-17701613
17707111,FOOTSCRAY,3011,560.0,2433.0,"Monday, 08 September 2025",2025-08-08,32,2,2,,Apartment / Unit / Flat,603/8 Hallenstein St,-37.80004,144.9082,2025-09-09 16:34:06,17707111,,11,0,0,False,Apartment,Apartment / Unit / Flat,Bow Residential,33223,Patrick Siah,"Balcony / Deck, Dishwasher, Swimming Pool",https://www.domain.com.au/603-8-hallenstein-st-footscray-vic-3011-17707111
17708666,FOOTSCRAY,3011,480.0,2086.0,"Monday, 25 August 2025",2025-08-11,29,2,1,1.0,Apartment / Unit / Flat,2/59 Droop Street,-37.79625,144.89616,2025-09-09 16:34:06,17708666,,9,0,0,False,Apartment,Apartment / Unit / Flat,Burnham Real Estate Footscray,3381,Bryson De Guzman,"Built in wardrobes, Internal Laundry, Secure Parking, Intercom, Heating, Pets Allowed",https://www.domain.com.au/2-59-droop-street-footscray-vic-3011-17708666
17708844,FOOTSCRAY,3011,500.0,2172.0,"Friday, 29 August 2025",2025-08-11,29,2,1,1.0,Apartment / Unit / Flat,3/22 Summerhill Road,-37.795273,144.88187,2025-09-09 16:34:06,17708844,,8,0,0,False,Apartment,Apartment / Unit / Flat,Nelson Alexander Essendon,4722,Simon Vella,"Built in wardrobes, Bath, Heating",https://www.domain.com.au/3-22-summerhill-road-footscray-vic-3011-17708844
17710324,FOOTSCRAY,3011,690.0,2998.0,"Monday, 18 August 2025",2025-08-11,28,3,2,1.0,Apartment / Unit / Flat,8/2 Saltriver Place,-37.801632,144.90823,2025-09-09 16:34:06,17710324,,14,0,0,False,Apartment,Apartment / Unit / Flat,JWC Property Group,32932,Billy Soe,"Built in wardrobes, Internal Laundry, Balcony / Deck",https://www.domain.com.au/8-2-saltriver-place-footscray-vic-3011-17710324
17711367,FOOTSCRAY,3011,595.0,2585.0,"Friday, 29 August 2025",2025-08-12,28,2,1,,House,8 Jerrold Street,-37.79218,144.89105,2025-09-09 16:34:06,17711367,,9,0,0,False,House,House,Village Real Estate ,20880,Chantal Borg,"Built in wardrobes, Internal Laundry, Fireplace(s), Dishwasher",https://www.domain.com.au/8-jerrold-street-footscray-vic-3011-17711367
17712016,FOOTSCRAY,3011,560.0,2433.0,"Friday, 05 September 2025",2025-08-12,28,2,1,1.0,Apartment / Unit / Flat,601/94 Buckley St,-37.80336,144.89397,2025-09-09 16:34:06,17712016,,5,0,0,False,Apartment,Apartment / Unit / Flat,My Agent Real Estate,18474,"Amy McIntosh, Adrian Anastovski","Built in wardrobes, Secure Parking, Gym, Intercom, Heating, Balcony / Deck",https://www.domain.com.au/601-94-buckley-st-footscray-vic-3011-17712016
17712647,FOOTSCRAY,3011,700.0,3260.0,"Monday, 18 August 2025",2025-08-12,27,3,2,2.0,Townhouse,12 Levien Lane,-37.80407,144.9071,2025-09-09 16:34:06,17712647,,11,0,0,False,Townhouse/Villa,Townhouse,LEO Real Estate,38205,Minh Vu,"Internal Laundry, Dishwasher, Balcony / Deck, Air conditioning, Built in wardrobes, Close to transport, Ensuite, City Views, River Views, Study",https://www.domain.com.au/12-levien-lane-footscray-vic-3011-17712647
17713946,FOOTSCRAY,3011,380.0,1651.0,"Friday, 22 August 2025",2025-08-13,27,1,1,1.0,Apartment / Unit / Flat,8/39-41 Hyde Street,-37.80488,144.90144,2025-09-09 16:34:06,17713946,,6,0,0,False,Apartment,Apartment / Unit / Flat,CORONIS YARRAVILLE,30644,Rita Galati,"Secure Parking, Reverse Cycle AirCon",https://www.domain.com.au/8-39-41-hyde-street-footscray-vic-3011-17713946
17713956,FOOTSCRAY,3011,600.0,2607.0,"Thursday, 11 September 2025",2025-08-13,27,3,1,1.0,House,47 Shepherd St,-37.795067,144.89014,2025-09-09 16:34:06,17713956,,6,0,0,False,House,House,BigginScott Richmond,3355,"Jade McMorrow, Casey Blaine",,https://www.domain.com.au/47-shepherd-st-footscray-vic-3011-17713956
17715315,FOOTSCRAY,3011,525.0,2281.0,"Friday, 22 August 2025",2025-08-14,26,1,1,1.0,Apartment / Unit / Flat,307/2B Ballarat Road,-37.79522,144.90959,2025-09-09 16:34:06,17715315,,10,0,0,True,Apartment,Apartment / Unit / Flat,Ray White Southbank,20626,"Jonathan Vallone, Emma Smith",,https://www.domain.com.au/307-2b-ballarat-road-footscray-vic-3011-17715315
8548305,FOOTSCRAY,3011,320.0,1390.0,"Monday, 28 July 2025",2024-11-12,301,1,1,,Studio,208/133 Droop Street,-37.792564,144.89342,2025-09-09 16:34:11,8548305,AA-6259-NK,7,0,2,False,Apartment,Studio,Student Housing Australia,11870,Huey Lim,"Gas, Furnished, Heating, Balcony / Deck, Broadband internet access, Built in wardrobes, Alarm System, Intercom",https://www.domain.com.au/208-133-droop-street-footscray-vic-3011-8548305
