listing_id,suburb,postcode,weekly_rent,bond,available_date,date_listed,days_listed,bedrooms,bathrooms,carspaces,property_type,address,lat,lon,scraped_date,domain_page_id,property_id,photo_count,video_count,floorplans_count,virtual_tour,primary_type,secondary_type,agency,agency_id,agent_names,structured_features,url
16196096,KIALLA,3631,650,2816.0,"Tuesday, 05 August 2025",2025-07-15,56,4,2,2,House,12 Apostle Street,-36.431328,145.38701,2025-09-09 16:33:57,16196096,LJ-1265-VE,14,0,0,False,House,House,Gagliardi Scott Real Estate,8642,Thomas Favaro,"Gas, Pets Allowed, Secure Parking, Broadband internet access, Bath, Heating, Dishwasher, Laundry",https://www.domain.com.au/12-apostle-street-kialla-vic-3631-16196096
17642034,KIALLA,3631,550,,"Tuesday, 15 July 2025",2025-06-27,74,3,2,1,Townhouse,2/17 Buckworth Street,-36.411003,145.39091,2025-09-09 16:33:57,17642034,,7,0,0,False,Townhouse/Villa,Townhouse,Gagliardi Scott Real Estate,8642,Thomas Favaro,"Pets Allowed, Secure Parking, Heating, Laundry",https://www.domain.com.au/2-17-buckworth-street-kialla-vic-3631-17642034
17700326,KIALLA,3631,680,2946.0,"Monday, 08 September 2025",2025-08-05,35,4,2,2,House,4 Weyba Place,-36.4331,145.39471,2025-09-09 16:33:57,17700326,,19,0,0,False,House,House,Choice Real Estate Shepparton,28921,Property  Management,"Secure Parking, Solar panels, Air conditioning, Ensuite, Built in wardrobes, Internal Laundry, Gas, Bath, Dishwasher, Heating",https://www.domain.com.au/4-weyba-place-kialla-vic-3631-17700326
17701309,KIALLA,3631,590,2556.0,"Monday, 01 September 2025",2025-08-05,35,4,2,2,House,182 Waranga Drive,-36.427002,145.40063,2025-09-09 16:33:57,17701309,,12,0,0,False,House,House,Shepparton Real Estate,27371,Rental Department,"Secure Parking, Bath, Heating, Shed, Study",https://www.domain.com.au/182-waranga-drive-kialla-vic-3631-17701309
17736602,KIALLA,3631,680,2955.0,"Wednesday, 08 October 2025",2025-08-28,12,4,2,2,House,8 Clear Court,-36.416676,145.39856,2025-09-09 16:33:57,17736602,,16,0,0,False,House,House,Stockdale & Leggo Shepparton,22369,"Property Management Team, Fiona Butler","Bath, Heating, Dishwasher, Study",https://www.domain.com.au/8-clear-court-kialla-vic-3631-17736602
