listing_id,suburb,postcode,weekly_rent,bond,available_date,date_listed,days_listed,bedrooms,bathrooms,carspaces,property_type,address,lat,lon,scraped_date,domain_page_id,property_id,photo_count,video_count,floorplans_count,virtual_tour,primary_type,secondary_type,agency,agency_id,agent_names,structured_features,url
17201380,MANSFIELD,3722,1500.0,6518.0,"Thursday, 05 September 2024",2024-09-10,364,5,3,,Acreage / Semi-Rural,272 Glenroy Road,-37.061794,146.2158,2025-09-09 16:35:49,17201380,BO-0440-FR,12,0,0,False,Any,Acreage / Semi-Rural,McGrath Mansfield,33293,"Lauren Brett, Leasing Team",,https://www.domain.com.au/272-glenroy-road-mansfield-vic-3722-17201380
17272431,MANSFIELD,3722,,,,2024-10-28,316,5,3,5.0,House,17 Ford Drive,-37.05961,146.00261,2025-09-09 16:35:49,17272431,XE-9611-EN,19,0,0,False,House,House,Ausky Group,20742,"Ausky Real Estate, Rachel Teng","Fireplace(s), Heating",https://www.domain.com.au/17-ford-drive-mansfield-vic-3722-17272431
17649364,MANSFIELD,3722,570.0,,"Friday, 25 July 2025",2025-07-02,69,4,2,4.0,House,90 Howes Creek Road,-37.052254,146.05049,2025-09-09 16:35:49,17649364,,15,0,0,True,House,House,Mansfield Real Estate,26460,"Claire Higgins, Wiesha Sherwood","Pets Allowed, Bath, Study, Shed, Deck, Fully fenced, Outdoor Entertainment Area, Built in wardrobes, Dishwasher, Floorboards, Open Fireplace, Split-System Air Conditioning, Split-System Heating, Water Tank",https://www.domain.com.au/90-howes-creek-road-mansfield-vic-3722-17649364
17696960,MANSFIELD,3722,450.0,1955.0,"Friday, 01 August 2025",2025-08-29,11,3,1,1.0,Apartment / Unit / Flat,3 Parwanoff Street,-37.056202,146.0816,2025-09-09 16:35:49,17696960,,9,0,0,False,Apartment,Apartment / Unit / Flat,Ray White (Mansfield),8537,Tammie Fleming,"Built in wardrobes, Internal Laundry",https://www.domain.com.au/3-parwanoff-street-mansfield-vic-3722-17696960
17735416,MANSFIELD,3722,580.0,,"Wednesday, 27 September 2017",2025-08-27,12,3,2,3.0,House,210 Malcolm Street,-37.056217,146.0697,2025-09-09 16:35:49,17735416,,11,0,0,False,House,House,Mansfield Real Estate,26460,"Claire Higgins, Wiesha Sherwood","Internal Laundry, Fully fenced, Built in wardrobes, Air conditioning, Split-System Air Conditioning, Split-System Heating",https://www.domain.com.au/210-malcolm-street-mansfield-vic-3722-17735416
17736416,MANSFIELD,3722,470.0,,"Tuesday, 30 September 2025",2025-08-28,12,2,2,1.0,Apartment / Unit / Flat,1/9 Chenery Street,-37.054173,146.09227,2025-09-09 16:35:49,17736416,,7,0,0,False,Apartment,Apartment / Unit / Flat,Mansfield Real Estate,26460,"Claire Higgins, Wiesha Sherwood","Bath, Heating, Shed, Fully fenced, Remote Garage, Secure Parking, Built in wardrobes, Dishwasher, Ducted Vacuum System, Air conditioning, Reverse Cycle Air Conditioning",https://www.domain.com.au/1-9-chenery-street-mansfield-vic-3722-17736416
