listing_id,suburb,postcode,weekly_rent,bond,available_date,date_listed,days_listed,bedrooms,bathrooms,carspaces,property_type,address,lat,lon,scraped_date,domain_page_id,property_id,photo_count,video_count,floorplans_count,virtual_tour,primary_type,secondary_type,agency,agency_id,agent_names,structured_features,url
15810556,RINGWOOD,3134,780,3389,"Tuesday, 07 October 2025",2025-09-08,1,3,2,2,Townhouse,5/13-15 Kendall Street,-37.817654,145.22986,2025-09-09 17:00:35,15810556,,8,0,1,False,Townhouse/Villa,Townhouse,LongView Real Estate,7797,Ella Harris,"Internal Laundry, Floorboards, Built in wardrobes, Dishwasher, Gas Appliances, Ducted Heating, Split System Air Conditioning, Ensuite(s), Courtyard, Deck, Remote Garage",https://www.domain.com.au/5-13-15-kendall-street-ringwood-vic-3134-15810556
17002753,RINGWOOD,3134,710,3085,"Tuesday, 16 September 2025",2025-09-01,8,5,2,2,House,18 Sonia Street,-37.801594,145.24252,2025-09-09 17:00:35,17002753,JG-5704-KI,8,0,0,False,House,House,JRW Property International,21901,JRW  RENTALS DEPARTMENT 4,"Heating, electrical cooktop, Dishwasher, Ensuite, shower",https://www.domain.com.au/18-sonia-street-ringwood-vic-3134-17002753
17647846,RINGWOOD,3134,500,2173,"Tuesday, 01 July 2025",2025-07-01,70,3,1,2,House,140 Wantirna Road,-37.82969,145.2269,2025-09-09 17:00:35,17647846,,5,0,0,False,House,House,Ray White Ferntree Gully,7876,Ray White Rental Centre,"Bath, Heating",https://www.domain.com.au/140-wantirna-road-ringwood-vic-3134-17647846
17724393,RINGWOOD,3134,480,2086,"Friday, 19 September 2025",2025-08-20,20,2,1,1,Apartment / Unit / Flat,5/25 Arlington Street,-37.819782,145.22418,2025-09-09 17:00:35,17724393,,8,0,0,False,Apartment,Apartment / Unit / Flat,Barry Plant Manningham,7015,"Katerina Fountas, Lachlan Wilson","Built in wardrobes, Secure Parking, Heating, Bathtub",https://www.domain.com.au/5-25-arlington-street-ringwood-vic-3134-17724393
17730168,RINGWOOD,3134,640,2781,"Monday, 22 September 2025",2025-08-25,15,3,2,2,House,2 Belle Vue Ave,-37.821205,145.23958,2025-09-09 17:00:35,17730168,,11,0,0,False,House,House,Fletchers Maroondah,23129,Penny Makin,,https://www.domain.com.au/2-belle-vue-ave-ringwood-vic-3134-17730168
17731380,RINGWOOD,3134,510,2216,"Friday, 12 September 2025",2025-08-26,14,2,1,1,Apartment / Unit / Flat,4/25 Pitt Street,-37.81461,145.23492,2025-09-09 17:00:35,17731380,,10,0,0,False,Apartment,Apartment / Unit / Flat,hockingstuart Ringwood,12997,Samantha O'Regan,"Built in wardrobes, Internal Laundry, Secure Parking, Bath, Heating",https://www.domain.com.au/4-25-pitt-street-ringwood-vic-3134-17731380
17736315,RINGWOOD,3134,660,2868,"Wednesday, 03 September 2025",2025-08-28,12,3,2,2,House,2/20 Maidstone Street,-37.82237,145.2246,2025-09-09 17:00:35,17736315,,9,0,1,False,House,House,Jellis Craig Mount Waverley ,17805,"John Jin, Jayden Hong, Jane Yuan","Bath, Dishwasher, Remote Garage, Built in wardrobes, Shed",https://www.domain.com.au/2-20-maidstone-street-ringwood-vic-3134-17736315
17737794,RINGWOOD,3134,600,2600,"Monday, 22 September 2025",2025-08-29,11,2,2,1,House,107/3-5 Heatherbrae Avenue,-37.814713,145.21817,2025-09-09 17:00:35,17737794,,7,0,0,False,House,House,Ray White Ferntree Gully,7876,Ray White Rental Centre,"Built in wardrobes, Gas, Internal Laundry, Secure Parking, Balcony / Deck",https://www.domain.com.au/107-3-5-heatherbrae-avenue-ringwood-vic-3134-17737794
17739111,RINGWOOD,3134,550,2390,"Wednesday, 08 October 2025",2025-08-29,11,2,1,1,Apartment / Unit / Flat,17/9 Browns Avenue,-37.812138,145.22408,2025-09-09 17:00:35,17739111,,7,0,0,False,Apartment,Apartment / Unit / Flat,Ray White Ringwood,14582,Ringwood Leasing,"Air conditioning, Internal Laundry, Built in wardrobes, Dishwasher, Balcony / Deck",https://www.domain.com.au/17-9-browns-avenue-ringwood-vic-3134-17739111
17739188,RINGWOOD,3134,600,2607,"Friday, 05 September 2025",2025-08-29,10,3,2,2,House,1/15 Bourke Street,-37.81306,145.22528,2025-09-09 17:00:35,17739188,,5,0,0,False,House,House,Barry Plant Manningham,7015,"Katerina Fountas, Deep Sareen","Gas, Internal Laundry, Secure Parking, Bath, Heating",https://www.domain.com.au/1-15-bourke-street-ringwood-vic-3134-17739188
17742317,RINGWOOD,3134,590,2564,"Tuesday, 02 September 2025",2025-09-02,7,2,2,1,Apartment / Unit / Flat,704/233 Maroondah Highway,-37.81406,145.23174,2025-09-09 17:00:35,17742317,,17,0,1,False,Apartment,Apartment / Unit / Flat,Docking Real Estate,12356,Chris Sung,"Built in wardrobes, Gas, Internal Laundry, Intercom, Heating, Dishwasher",https://www.domain.com.au/704-233-maroondah-highway-ringwood-vic-3134-17742317
17743768,RINGWOOD,3134,600,2607,"Tuesday, 07 October 2025",2025-09-02,7,2,2,1,Apartment / Unit / Flat,413/233 Maroondah Highway,-37.81406,145.23174,2025-09-09 17:00:35,17743768,,11,0,0,False,Apartment,Apartment / Unit / Flat,Barry Plant Manningham,7015,"Katerina Fountas, Emily Stoneham","Gas, Internal Laundry, Intercom, Heating, Dishwasher",https://www.domain.com.au/413-233-maroondah-highway-ringwood-vic-3134-17743768
17743779,RINGWOOD,3134,520,2260,"Monday, 06 October 2025",2025-09-02,7,3,1,1,House,4/356 Maroondah Highway,-37.8029,145.24852,2025-09-09 17:00:35,17743779,,8,0,0,False,House,House,Barry Plant Manningham,7015,"Katerina Fountas, Kristi Gilcrist","Gas, Secure Parking, Bath, Heating",https://www.domain.com.au/4-356-maroondah-highway-ringwood-vic-3134-17743779
17746581,RINGWOOD,3134,540,2346,"Friday, 05 September 2025",2025-09-04,5,2,1,1,Apartment / Unit / Flat,3/1 Greenwood Ave,-37.81635,145.23108,2025-09-09 17:00:35,17746581,,12,0,0,False,Apartment,Apartment / Unit / Flat,Ray White (Box Hill),34590,Jerry Bao,"Built in wardrobes, Secure Parking, Heating",https://www.domain.com.au/3-1-greenwood-ave-ringwood-vic-3134-17746581
17746901,RINGWOOD,3134,560,2433,"Friday, 12 September 2025",2025-09-04,5,2,2,1,House,2/23 Braeside Avenue,-37.80839,145.24155,2025-09-09 17:00:35,17746901,,6,0,0,False,House,House,Harcourts Manningham,33307,Alana Kolders,"Built in wardrobes, Gas, Secure Parking, Heating, Dishwasher, Balcony / Deck",https://www.domain.com.au/2-23-braeside-avenue-ringwood-vic-3134-17746901
17747027,RINGWOOD,3134,390,1695,"Tuesday, 07 October 2025",2025-09-04,5,1,1,1,Apartment / Unit / Flat,8/32 New Street,-37.81399,145.22028,2025-09-09 17:00:35,17747027,,6,0,0,False,Apartment,Apartment / Unit / Flat,Noel Jones Doncaster,11515,"Rentals Noel Jones Doncaster, Michelle D'Assisi","Gas, Internal Laundry, Balcony / Deck, Built in wardrobes, Dishwasher, Intercom, Air conditioning, Heating, Split-System Air Conditioning, Split-System Heating",https://www.domain.com.au/8-32-new-street-ringwood-vic-3134-17747027
17747320,RINGWOOD,3134,475,2064,"Tuesday, 14 October 2025",2025-09-04,5,1,1,1,Apartment / Unit / Flat,306/7-9 Bardia Street,-37.81206,145.23312,2025-09-09 17:00:35,17747320,,7,0,0,False,Apartment,Apartment / Unit / Flat,Jellis Craig Maroondah,4081,Emily Revere,"Internal Laundry, Split System Air Con, Split System Heating, Balcony / Deck, Built in wardrobes, Dishwasher, Floorboards, Outdoor Entertainment Area, Secure Parking",https://www.domain.com.au/306-7-9-bardia-street-ringwood-vic-3134-17747320
17747326,RINGWOOD,3134,600,2607,"Monday, 13 October 2025",2025-09-04,5,2,1,1,Apartment / Unit / Flat,2/40 William Street,-37.807926,145.222,2025-09-09 17:00:35,17747326,,4,0,1,False,Apartment,Apartment / Unit / Flat,Jellis Craig Maroondah,4081,Emily Revere,"Internal Laundry, Split System Air Con, Split System Heating, Built in wardrobes, Garden / Courtyard, Dishwasher, Floorboards, Outdoor Entertainment Area, Secure Parking",https://www.domain.com.au/2-40-william-street-ringwood-vic-3134-17747326
17747421,RINGWOOD,3134,450,1955,"Thursday, 11 September 2025",2025-09-04,5,2,1,1,Apartment / Unit / Flat,1/10 Wantirna Road,-37.817883,145.22704,2025-09-09 17:00:35,17747421,,6,0,0,False,Apartment,Apartment / Unit / Flat,Noel Jones Doncaster,11515,"Rentals Noel Jones Doncaster, Michelle D'Assisi","Internal Laundry, Heating, Built in wardrobes",https://www.domain.com.au/1-10-wantirna-road-ringwood-vic-3134-17747421
17753832,RINGWOOD,3134,650,2824,"Tuesday, 09 September 2025",2025-09-09,0,4,1,1,House,2 Heatherbrae Avenue East,-37.814373,145.21837,2025-09-09 17:00:35,17753832,,7,0,1,False,House,House,NOEL JONES MAROONDAH & YARRA RANGES,6242,Suzaan  Wessels,"Air conditioning, Internal Laundry, Balcony / Deck, Built in wardrobes, Close to transport, Close to shops, Close to schools",https://www.domain.com.au/2-heatherbrae-avenue-east-ringwood-vic-3134-17753832
17549959,RINGWOOD,3134,630,2738,"Friday, 30 May 2025",2025-04-30,132,3,2,1,House,6/12-18 Bourke Street,-37.81269,145.22487,2025-09-09 17:00:40,17549959,VM-7380-AK,5,0,0,False,House,House,Barry Plant Manningham,7015,Katerina Fountas,"Heating, Balcony / Deck, Dishwasher",https://www.domain.com.au/6-12-18-bourke-street-ringwood-vic-3134-17549959
17682335,RINGWOOD,3134,580,2520,"Monday, 01 September 2025",2025-07-23,48,4,1,2,House,51 Loughnan Road,-37.80684,145.22394,2025-09-09 17:00:40,17682335,,7,0,0,False,House,House,Barry Plant Manningham,7015,Jane Gao,"Gas, Bath, Heating",https://www.domain.com.au/51-loughnan-road-ringwood-vic-3134-17682335
17682950,RINGWOOD,3134,460,1999,"Friday, 05 September 2025",2025-07-23,47,1,1,1,Apartment / Unit / Flat,303/7-9 Bardia Street,-37.81206,145.23312,2025-09-09 17:00:40,17682950,,10,0,0,False,Apartment,Apartment / Unit / Flat,hockingstuart Ringwood,12997,Samantha O'Regan,"Built in wardrobes, Internal Laundry, Secure Parking, Intercom, Dishwasher, Balcony / Deck",https://www.domain.com.au/303-7-9-bardia-street-ringwood-vic-3134-17682950
17689088,RINGWOOD,3134,550,2390,"Friday, 22 August 2025",2025-07-28,43,3,1,2,Apartment / Unit / Flat,11/158 Wantirna Road,-37.830944,145.2266,2025-09-09 17:00:40,17689088,,5,0,0,False,Apartment,Apartment / Unit / Flat,Barry Plant Croydon,12205,Jessica Bini,"Internal Laundry, Secure Parking, Heating, Air conditioning, Built in wardrobes",https://www.domain.com.au/11-158-wantirna-road-ringwood-vic-3134-17689088
17704762,RINGWOOD,3134,700,3042,"Friday, 29 August 2025",2025-08-07,33,3,2,2,House,105/42B Nelson Street,-37.81108,145.22238,2025-09-09 17:00:40,17704762,,8,0,0,False,House,House,Barry Plant Manningham,7015,"Katerina Fountas, Anthony Viney",Heating,https://www.domain.com.au/105-42b-nelson-street-ringwood-vic-3134-17704762
17707905,RINGWOOD,3134,490,2129,"Friday, 19 September 2025",2025-08-08,32,2,1,1,Apartment / Unit / Flat,3/2 Munro Street,-37.809437,145.2239,2025-09-09 17:00:40,17707905,,9,0,0,False,Apartment,Apartment / Unit / Flat,McGrath Blackburn,12105,Michael Li,"Secure Parking, Heating, Built in wardrobes, Close to transport",https://www.domain.com.au/3-2-munro-street-ringwood-vic-3134-17707905
17707950,RINGWOOD,3134,525,2281,"Friday, 22 August 2025",2025-08-08,32,2,1,1,Apartment / Unit / Flat,9/4 Browns Avenue,-37.81215,145.22443,2025-09-09 17:00:40,17707950,,5,0,0,False,Apartment,Apartment / Unit / Flat,Barry Plant Manningham,7015,"Katerina Fountas, Deep Sareen","Built in wardrobes, Internal Laundry, Intercom, Heating, Balcony / Deck",https://www.domain.com.au/9-4-browns-avenue-ringwood-vic-3134-17707950
17717556,RINGWOOD,3134,510,2216,"Monday, 29 September 2025",2025-08-15,25,2,1,1,Apartment / Unit / Flat,313/92 Maroondah Highway,-37.816666,145.2256,2025-09-09 17:00:40,17717556,,3,0,0,False,Apartment,Apartment / Unit / Flat,OBrien Real Estate - Blackburn,7625,"Brigida Francesca, Property Management Team","Gas, Internal Laundry, Dishwasher, Balcony / Deck, Built in wardrobes, Close to transport, Close to shops, Close to schools, Carpeted",https://www.domain.com.au/313-92-maroondah-highway-ringwood-vic-3134-17717556
