listing_id,suburb,postcode,weekly_rent,bond,available_date,date_listed,days_listed,bedrooms,bathrooms,carspaces,property_type,address,lat,lon,scraped_date,domain_page_id,property_id,photo_count,video_count,floorplans_count,virtual_tour,primary_type,secondary_type,agency,agency_id,agent_names,structured_features,url
15249079,ROCKBANK,3335,500.0,2173.0,"Wednesday, 03 September 2025",2025-08-04,36,4,2,2.0,House,12 Haven Way,-37.74112,144.66574,2025-09-09 16:18:36,15249079,YK-5511-QJ,15,0,0,False,House,House,Ray White Tarneit,23886.0,"Marvin Paed, Savi Sarain","Secure Parking, Broadband internet access, Heating, Dishwasher",https://www.domain.com.au/12-haven-way-rockbank-vic-3335-15249079
15815355,ROCKBANK,3335,475.0,2064.0,"Saturday, 08 November 2025",2025-09-04,4,3,2,2.0,House,10 Noble Road,-37.740498,144.66429,2025-09-09 16:18:36,15815355,ZQ-6062-SH,7,1,0,False,House,House,Ray White Werribee,29214.0,"Marc Tanti, Maya Hunak","Air conditioning, Built in wardrobes, Secure Parking",https://www.domain.com.au/10-noble-road-rockbank-vic-3335-15815355
16312279,ROCKBANK,3335,490.0,2129.0,"Friday, 26 September 2025",2025-09-03,6,3,2,2.0,House,25 Amaya Way,-37.733753,144.66008,2025-09-09 16:18:36,16312279,GJ-0132-ER,12,0,0,False,House,House,Ray White Truganina,29324.0,"Akash Sharma, Palak Joshi","Air conditioning, Secure Parking, Heating",https://www.domain.com.au/25-amaya-way-rockbank-vic-3335-16312279
17077231,ROCKBANK,3335,490.0,2129.0,"Monday, 18 August 2025",2025-08-18,22,4,2,2.0,House,21 DELHI GROVE,-37.74356,144.66353,2025-09-09 16:18:36,17077231,UH-0479-HN,12,0,0,False,House,House,Ray White Truganina,29324.0,"Akash Sharma, Palak Joshi",,https://www.domain.com.au/21-delhi-grove-rockbank-vic-3335-17077231
17132699,ROCKBANK,3335,440.0,1906.0,"Tuesday, 02 September 2025",2025-08-07,32,3,2,2.0,House,17 Capari Walk,-37.741295,144.65503,2025-09-09 16:18:36,17132699,EF-2202-WM,10,0,0,False,House,House,Ray White Rockbank,34315.0,"Neha Chaudhary, Reet Sarain","Secure Parking, Heating, Ensuite",https://www.domain.com.au/17-capari-walk-rockbank-vic-3335-17132699
17629270,ROCKBANK,3335,500.0,2166.0,"Thursday, 26 June 2025",2025-08-29,11,4,2,2.0,House,5 Bellview Drive,-37.742073,144.66444,2025-09-09 16:18:36,17629270,,8,0,0,False,House,House,Ray White Taylors Lakes,19113.0,"Katherine Kowalczyk, Jack Desira","Internal Laundry, Secure Parking, Broadband internet access, Heating, Dishwasher",https://www.domain.com.au/5-bellview-drive-rockbank-vic-3335-17629270
17654076,ROCKBANK,3335,475.0,2064.0,"Thursday, 31 July 2025",2025-07-04,67,4,2,2.0,House,6 Oakdale Way,-37.741272,144.6593,2025-09-09 16:18:36,17654076,,7,0,0,False,House,House,YPA Estate Agents Melton,15655.0,"Kimberley McLelland, Andrijana Talevska","Internal Laundry, Secure Parking, Heating, Dishwasher",https://www.domain.com.au/6-oakdale-way-rockbank-vic-3335-17654076
17710120,ROCKBANK,3335,460.0,1999.0,"Monday, 15 September 2025",2025-08-11,29,4,2,2.0,House,109 Restful Way,-37.737934,144.65575,2025-09-09 16:18:36,17710120,,8,0,0,False,House,House,Ray White West Realty,28524.0,"Mel Mallia, Chantae Jones","Gas, Internal Laundry, Secure Parking, Heating",https://www.domain.com.au/109-restful-way-rockbank-vic-3335-17710120
17738385,ROCKBANK,3335,550.0,2390.0,"Friday, 19 September 2025",2025-08-29,11,4,2,2.0,House,6 Hunt road,-37.73491,144.64342,2025-09-09 16:18:36,17738385,,17,0,0,False,House,House,Estal Real Estate,38990.0,"Rentals Estal, Yuvi  Singh","Secure Parking, Heating",https://www.domain.com.au/6-hunt-road-rockbank-vic-3335-17738385
17744734,ROCKBANK,3335,460.0,1999.0,"Wednesday, 03 September 2025",2025-09-03,6,3,2,2.0,House,20 Listowel Grove,-37.739017,144.65039,2025-09-09 16:18:36,17744734,,12,0,0,False,House,House,YPA Estate Agents Caroline Springs,21306.0,"Victoria Galea, Rental Department Caroline Springs","Internal Laundry, Secure Parking, Bath, Heating, Dishwasher",https://www.domain.com.au/20-listowel-grove-rockbank-vic-3335-17744734
17744780,ROCKBANK,3335,460.0,2086.0,"Monday, 30 October 2023",2025-09-03,6,3,2,2.0,House,7 Dundalk Way,-37.739285,144.65082,2025-09-09 16:18:36,17744780,,7,0,0,False,House,House,hockingstuart Melton,19180.0,"Britt Jones, Frank Giurleo","Gas, Secure Parking, Heating, Air conditioning, Close to schools, Floorboards, Study, Fully fenced, Dishwasher",https://www.domain.com.au/7-dundalk-way-rockbank-vic-3335-17744780
17747077,ROCKBANK,3335,520.0,2259.0,"Monday, 13 October 2025",2025-09-04,5,3,2,2.0,House,47 Westbury Avenue,-37.74201,144.66742,2025-09-09 16:18:36,17747077,,11,0,0,False,House,House,Barry Plant Taylors Lakes,4692.0,"Shari Jansz, Stevo Sekulic","Secure Parking, Close to transport, Close to schools, Evaporative Cooling, Ducted Heating",https://www.domain.com.au/47-westbury-avenue-rockbank-vic-3335-17747077
17747575,ROCKBANK,3335,500.0,2173.0,"Friday, 26 September 2025",2025-09-04,5,3,2,1.0,House,3 Hampshire Avenue,-37.741707,144.65604,2025-09-09 16:18:36,17747575,,8,0,0,False,House,House,Huxley Real Estate,38920.0,"Jetah Keighran, Shae Joiner",,https://www.domain.com.au/3-hampshire-avenue-rockbank-vic-3335-17747575
17748218,ROCKBANK,3335,450.0,1955.0,"Friday, 05 September 2025",2025-09-04,4,3,2,2.0,House,12 Milliri Way,-37.739098,144.65176,2025-09-09 16:18:36,17748218,,15,0,0,False,House,House,361 WYNDHAM CITY,34918.0,"Pooja Kundu, Nick Miglani","Secure Parking, Air conditioning, Heating, Built in wardrobes, Close to transport, Close to shops, Alarm System, Intercom, Close to schools, Ensuite, Exhaust, Openable Windows, Toilet Facilities",https://www.domain.com.au/12-milliri-way-rockbank-vic-3335-17748218
17748368,ROCKBANK,3335,550.0,2390.0,"Friday, 05 September 2025",2025-09-05,4,4,2,2.0,House,23 Derrimut Street,-37.742756,144.65814,2025-09-09 16:18:36,17748368,,12,0,1,False,House,House,Victoria Real Estate Agency Pty Ltd,27202.0,Sonita Dawood,"Floorboards, Built in wardrobes, Dishwasher, Remote Garage, Pets Allowed",https://www.domain.com.au/23-derrimut-street-rockbank-vic-3335-17748368
17750470,ROCKBANK,3335,530.0,2303.0,"Tuesday, 30 September 2025",2025-09-08,1,4,2,2.0,House,7 Azalea Way,-37.74053,144.65495,2025-09-09 16:18:36,17750470,,14,0,0,True,House,House,Areal Property - Melbourne,35843.0,Velia Perri,,https://www.domain.com.au/7-azalea-way-rockbank-vic-3335-17750470
17751493,ROCKBANK,3335,435.0,1890.0,"Friday, 12 September 2025",2025-09-08,1,3,2,2.0,House,84 Bluebottle Parade,-37.742733,144.64287,2025-09-09 16:18:36,17751493,,8,0,1,False,House,House,Nicholas Scott Real Estate,8676.0,Matthew Aspiotis,"Gas, Secure Parking",https://www.domain.com.au/84-bluebottle-parade-rockbank-vic-3335-17751493
17752079,ROCKBANK,3335,600.0,2607.0,"Friday, 05 September 2025",2025-09-08,1,4,2,3.0,House,25 Kerala Street,-37.742424,144.6644,2025-09-09 16:18:36,17752079,,6,0,0,False,House,House,LJ Hooker – Property Link,30303.0,Shubham Duhan,"Internal Laundry, Secure Parking, Broadband internet access, Bath, Heating, Dishwasher",https://www.domain.com.au/25-kerala-street-rockbank-vic-3335-17752079
17752415,ROCKBANK,3335,480.0,2086.0,"Monday, 08 September 2025",2025-09-08,0,4,2,2.0,House,4 Tipperary Drive,-37.73888,144.64638,2025-09-09 16:18:36,17752415,,10,0,0,False,House,House,Harcourts Rata & Co,30123.0,Taylah Lowe,"Gas, Internal Laundry, Secure Parking, Heating, Built in wardrobes, Pets Allowed, Carpeted, Openable Windows, Split System Cooling, Dishwasher",https://www.domain.com.au/4-tipperary-drive-rockbank-vic-3335-17752415
17752760,ROCKBANK,3335,495.0,2151.0,"Wednesday, 10 September 2025",2025-09-09,0,4,2,1.0,House,15 Galway Grove,-37.738354,144.64598,2025-09-09 16:18:36,17752760,,14,0,0,False,House,House,LongView Real Estate,7797.0,Edward Wu,"Internal Laundry, Floorboards, Built in wardrobes, Dishwasher, Bathtub, Gas Appliances, Split System Air Conditioning, Ensuite(s), Remote Garage, Fully fenced",https://www.domain.com.au/15-galway-grove-rockbank-vic-3335-17752760
15588803,ROCKBANK,3335,450.0,1955.0,"Wednesday, 03 September 2025",2025-08-26,14,3,2,1.0,House,18 Reverence Drive,-37.738945,144.65602,2025-09-09 16:18:41,15588803,FD-6881-HQ,8,0,0,False,House,House,LITTLE Real Estate Victoria,24974.0,Jason King,"Secure Parking, Heating: Gas Ducted Heating, Kitchen: Modern, Cooking: Gas Hotplates and Electric Oven, Pool/Spa Count: 0",https://www.domain.com.au/18-reverence-drive-rockbank-vic-3335-15588803
17138064,ROCKBANK,3335,470.0,2042.0,"Sunday, 15 September 2024",2025-08-25,15,4,2,1.0,House,10 Uttar Way,-37.74311,144.664,2025-09-09 16:18:41,17138064,CL-6633-OR,19,0,0,False,House,House,ACE Real Estate,19089.0,"Julie  Strnak, Swati Patel","Air conditioning, Internal Laundry, Secure Parking, Heating, Dishwasher",https://www.domain.com.au/10-uttar-way-rockbank-vic-3335-17138064
17650427,ROCKBANK,3335,180.0,720.0,"Monday, 28 July 2025",2025-07-02,68,1,1,,House,9 Dandelion Cres,-37.73998,144.65355,2025-09-09 16:18:41,17650427,,9,0,0,False,House,House,RentBetter,27499.0,,"Gas, Internal Laundry, Broadband internet access, Bath, Study, Air conditioning, Alarm System, Built in wardrobes, Dishwasher, Fully fenced, Furnished, Heating, Rainwater storage tank",https://www.domain.com.au/9-dandelion-cres-rockbank-vic-3335-17650427
17674506,ROCKBANK,3335,570.0,2477.0,"Thursday, 24 July 2025",2025-07-17,53,4,2,2.0,House,12 Livingston Drive,-37.74022,144.66682,2025-09-09 16:18:41,17674506,,14,0,0,False,House,House,Ray White Rockbank,34315.0,Neha Chaudhary,"Secure Parking, Bath, Heating",https://www.domain.com.au/12-livingston-drive-rockbank-vic-3335-17674506
17686426,ROCKBANK,3335,500.0,2166.0,"Thursday, 28 August 2025",2025-07-25,46,4,2,2.0,House,8 Uttar Way,-37.743034,144.66402,2025-09-09 16:18:41,17686426,,11,0,0,False,House,House,Pinewoods,39169.0,"Rady Sandhu, Shailesh Goswami","Secure Parking, Ensuite",https://www.domain.com.au/8-uttar-way-rockbank-vic-3335-17686426
17693406,ROCKBANK,3335,450.0,1955.0,"Monday, 03 November 2025",2025-07-30,40,3,2,1.0,House,7 Miandad St,-37.7333,144.64624,2025-09-09 16:18:41,17693406,,11,0,0,False,House,House,Barry Plant Bayside,16215.0,Dimmy Alevizos,"Air conditioning, Internal Laundry, Secure Parking, Heating, Dishwasher",https://www.domain.com.au/7-miandad-st-rockbank-vic-3335-17693406
17714699,ROCKBANK,3335,530.0,2303.0,"Wednesday, 27 August 2025",2025-08-14,26,4,2,2.0,House,3 Tesla Road,-37.737526,144.66188,2025-09-09 16:18:41,17714699,,11,0,0,False,House,House,LITTLE Real Estate Victoria,24974.0,Jason King,"Internal Laundry, Secure Parking, Dishwasher, Study, Heating: Gas Ducted Heating, Cooling: Evaporative Cooling, Kitchen: Modern, Cooking: Gas Hotplates and Electric Oven, Pool/Spa Count: 0",https://www.domain.com.au/3-tesla-road-rockbank-vic-3335-17714699
17715479,ROCKBANK,3335,490.0,2129.0,"Monday, 18 August 2025",2025-08-14,26,4,2,2.0,House,8 Distaff Way,-37.742992,144.64693,2025-09-09 16:18:41,17715479,,8,0,1,False,House,House,hockingstuart Melton,19180.0,"Britt Jones, Frank Giurleo","Internal Laundry, Heating, Built in wardrobes, Close to transport, Close to shops, Close to schools, Courtyard, Secure Parking, Dishwasher",https://www.domain.com.au/8-distaff-way-rockbank-vic-3335-17715479
17715702,ROCKBANK,3335,499.0,2168.0,"Thursday, 14 August 2025",2025-08-14,26,4,2,2.0,House,18 Miandad Street,-37.732513,144.64691,2025-09-09 16:18:41,17715702,,13,0,0,False,House,House,361 WYNDHAM CITY,34918.0,"Pooja Kundu, Nick Miglani","Internal Laundry, Pets Allowed, Study, Air conditioning, Heating, Built in wardrobes, Close to transport, Close to shops, Intercom, Close to schools, Ensuite, Car Parking - Surface, Carpeted, Exhaust, Openable Windows, Security System",https://www.domain.com.au/18-miandad-street-rockbank-vic-3335-17715702
17718092,ROCKBANK,3335,520.0,2260.0,"Friday, 15 August 2025",2025-08-15,25,4,2,2.0,House,65 Restful Way,-37.7376,144.65254,2025-09-09 16:18:41,17718092,,16,0,1,False,House,House,Westside Realty Group,33914.0,Sarita Anumalla,"Internal Laundry, Secure Parking, Broadband internet access, Heating",https://www.domain.com.au/65-restful-way-rockbank-vic-3335-17718092
17719694,ROCKBANK,3335,450.0,1955.0,"Wednesday, 20 August 2025",2025-08-18,22,3,2,2.0,House,24 Listowel Grove,-37.739143,144.65036,2025-09-09 16:18:41,17719694,,11,0,0,False,House,House,Infiniti Property Corporation,35258.0,Lucia Hou,"Air conditioning, Internal Laundry, Heating, Alarm System, Floorboards, Built in wardrobes, Dishwasher, Bathtub, Gas Appliances, Courtyard, Remote Garage, Secure Parking, Fully fenced, Pets Allowed",https://www.domain.com.au/24-listowel-grove-rockbank-vic-3335-17719694
17721815,ROCKBANK,3335,450.0,1955.0,"Monday, 25 August 2025",2025-08-19,21,3,1,1.0,House,9 Akram Way,-37.733265,144.64873,2025-09-09 16:18:41,17721815,,26,0,0,False,House,House,RELIANCE REAL ESTATE TARNEIT,18363.0,Prerna Singh,"Internal Laundry, Bath, Air conditioning, Heating, Built in wardrobes, Close to transport, Car Parking - Surface, Carpeted, Creative, Exhaust, High Clearance",https://www.domain.com.au/9-akram-way-rockbank-vic-3335-17721815
17730458,ROCKBANK,3335,480.0,2086.0,"Monday, 25 August 2025",2025-08-25,15,3,2,2.0,House,26 Listowel Grove,-37.739197,144.65036,2025-09-09 16:18:41,17730458,,6,0,0,False,House,House,Ray White Sunbury Pty Ltd,12373.0,Ramona Darrell,"Built in wardrobes, Broadband internet access, Heating, Pets Allowed",https://www.domain.com.au/26-listowel-grove-rockbank-vic-3335-17730458
17731923,ROCKBANK,3335,450.0,1955.0,"Wednesday, 27 August 2025",2025-08-26,14,3,2,2.0,House,28 Listowel Grove,-37.73925,144.65034,2025-09-09 16:18:41,17731923,,11,0,0,False,House,House,YPA Estate Agents Caroline Springs,21306.0,"Charlotte Ryder, Rental Department Caroline Springs","Air conditioning, Secure Parking, Bath, Heating",https://www.domain.com.au/28-listowel-grove-rockbank-vic-3335-17731923
17732077,ROCKBANK,3335,520.0,2260.0,"Tuesday, 30 September 2025",2025-08-26,14,4,2,1.0,House,8 Delhi Grove,-37.742836,144.66324,2025-09-09 16:18:41,17732077,,6,0,0,False,House,House,OSKO Real Estate Agency,37723.0,Osko Rentals,"Secure Parking, Heating",https://www.domain.com.au/8-delhi-grove-rockbank-vic-3335-17732077
17732891,ROCKBANK,3335,450.0,1955.0,"Thursday, 25 September 2025",2025-08-26,13,3,2,2.0,House,15 Lilypad Way,-37.74008,144.65425,2025-09-09 16:18:41,17732891,,1,0,0,False,House,House,ACE Real Estate,19089.0,"Julie  Strnak, Swati Patel","Built in wardrobes, Internal Laundry, Secure Parking, Dishwasher",https://www.domain.com.au/15-lilypad-way-rockbank-vic-3335-17732891
17732924,ROCKBANK,3335,460.0,1999.0,"Friday, 12 September 2025",2025-08-26,13,3,2,2.0,Townhouse,87 Brundell Avenue,-37.735764,144.6427,2025-09-09 16:18:41,17732924,,16,0,0,False,Townhouse/Villa,Townhouse,Ristic Real Estate,17959.0,"Jacinta Scott, Nadine Augello","Gas, Internal Laundry, Bath, Heating, Dishwasher, Study",https://www.domain.com.au/87-brundell-avenue-rockbank-vic-3335-17732924
17738534,ROCKBANK,3335,600.0,,"Monday, 22 September 2025",2025-08-29,11,4,2,2.0,House,9 Ambrose Street,-37.73293,144.64745,2025-09-09 16:18:41,17738534,,14,0,0,False,House,House,Westside Realty Group,33914.0,Sarita Anumalla,"Internal Laundry, Secure Parking, Bath, Heating, Study",https://www.domain.com.au/9-ambrose-street-rockbank-vic-3335-17738534
17740608,ROCKBANK,3335,545.0,2368.0,"Saturday, 11 October 2025",2025-09-01,8,4,2,2.0,House,10 Akthar Avenue,-37.73424,144.64647,2025-09-09 16:18:41,17740608,,11,0,0,False,House,House,LJ Hooker Property Point,22180.0,"Dema Haddad, Nathan Long","Internal Laundry, Secure Parking, Bath, Heating, Dishwasher",https://www.domain.com.au/10-akthar-avenue-rockbank-vic-3335-17740608
17743055,ROCKBANK,3335,520.0,2253.0,"Tuesday, 02 September 2025",2025-09-02,7,4,2,2.0,House,9 Inspire Street,-37.739704,144.6651,2025-09-09 16:18:41,17743055,,11,0,1,False,House,House,Barry Plant Melton,12902.0,Melton Rentals,Heating,https://www.domain.com.au/9-inspire-street-rockbank-vic-3335-17743055
16994882,ROCKBANK,3335,,,,2024-05-02,495,4,2,2.0,House,11 Posy Street,-37.73612,144.65747,2025-09-09 16:18:47,16994882,MU-6363-GY,9,0,0,False,House,House,Pink and Blue Real Estate,36805.0,"Neeru Vimal, Riva Vimal","Secure Parking, Heating",https://www.domain.com.au/11-posy-street-rockbank-vic-3335-16994882
17073623,ROCKBANK,3335,500.0,,"Thursday, 27 June 2024",2024-06-20,446,4,2,2.0,House,23 Delhi Grove,-37.743813,144.66342,2025-09-09 16:18:47,17073623,AQ-0702-JV,14,0,0,False,House,House,Pink and Blue Real Estate,36805.0,"Riva Vimal, Neeru Vimal","Secure Parking, Bath, Heating",https://www.domain.com.au/23-delhi-grove-rockbank-vic-3335-17073623
17073767,ROCKBANK,3335,480.0,,"Friday, 12 July 2024",2024-06-20,446,3,2,2.0,House,42 Sedate Drive,-37.739464,144.65489,2025-09-09 16:18:47,17073767,WL-9486-FS,14,0,0,False,House,House,Pink and Blue Real Estate,36805.0,"Riva Vimal, Neeru Vimal","Secure Parking, Heating, Dishwasher",https://www.domain.com.au/42-sedate-drive-rockbank-vic-3335-17073767
17084336,ROCKBANK,3335,520.0,,"Monday, 01 July 2024",2024-06-27,439,4,2,2.0,House,28 Tamworth Drive,-37.73869,144.64827,2025-09-09 16:18:47,17084336,MY-1179-LL,9,0,0,False,House,House,Pink and Blue Real Estate,36805.0,Riva Vimal,"Secure Parking, Bath, Heating",https://www.domain.com.au/28-tamworth-drive-rockbank-vic-3335-17084336
17101713,ROCKBANK,3335,,,,2024-07-08,428,4,2,1.0,House,9 Delhi Grove,-37.743134,144.66353,2025-09-09 16:18:47,17101713,KC-6374-SX,15,0,0,False,House,House,Pink and Blue Real Estate,36805.0,"Riva Vimal, Neeru Vimal","Secure Parking, Bath, Heating, Study, Fully fenced",https://www.domain.com.au/9-delhi-grove-rockbank-vic-3335-17101713
17104241,ROCKBANK,3335,,,,2024-07-09,427,4,2,2.0,House,11 Jobs Road,-37.735653,144.6634,2025-09-09 16:18:47,17104241,OO-7784-OM,11,0,0,False,House,House,Pink and Blue Real Estate,36805.0,"Riva Vimal, Neeru Vimal","Secure Parking, Bath, Heating, Fully fenced",https://www.domain.com.au/11-jobs-road-rockbank-vic-3335-17104241
17125579,ROCKBANK,3335,,,,2024-07-23,413,4,2,2.0,House,6 Garner Grove,-37.734043,144.6516,2025-09-09 16:18:47,17125579,PQ-5525-QW,10,0,0,False,House,House,Pink and Blue Real Estate,36805.0,"Riva Vimal, Neeru Vimal","Secure Parking, Bath, Heating, Fully fenced",https://www.domain.com.au/6-garner-grove-rockbank-vic-3335-17125579
17359952,ROCKBANK,3335,,2260.0,"Saturday, 21 December 2024",2024-12-19,264,4,2,2.0,House,72 Lorikeet Circuit,-37.74241,144.65903,2025-09-09 16:18:47,17359952,JB-3034-EC,24,1,1,False,House,House,Pink and Blue Real Estate,36805.0,"Neeru Vimal, Riva Vimal","Internal Laundry, Fully fenced, Remote Garage, Secure Parking, Alarm System, Dishwasher, Air conditioning, Ducted Heating, Water Tank, Ensuite",https://www.domain.com.au/72-lorikeet-circuit-rockbank-vic-3335-17359952
17453211,ROCKBANK,3335,650.0,,"Friday, 21 March 2025",2025-02-23,198,4,2,2.0,House,,-37.734158,144.66681,2025-09-09 16:18:47,17453211,,6,1,1,False,House,House,First Step Homes 4U,24633.0,Kerry Smith,"Secure Parking, Air conditioning, Built in wardrobes, Courtyard, Dishwasher, Fully fenced",https://www.domain.com.au/rockbank-vic-3335-17453211
17576091,ROCKBANK,3335,530.0,2302.0,"Thursday, 15 May 2025",2025-05-15,116,4,2,2.0,House,12 Dewberry Drive,-37.742355,144.6443,2025-09-09 16:18:47,17576091,QP-8440-JB,9,0,0,False,House,House,AGENCY HQ Melbourne West,37657.0,"Sai Allamneni, Deepak Devaraj","Fully fenced, Outdoor Entertainment Area, Remote Garage, Dishwasher, Ducted Vacuum System, Floorboards, Ducted Heating, Evaporative Cooling",https://www.domain.com.au/12-dewberry-drive-rockbank-vic-3335-17576091
17584865,ROCKBANK,3335,440.0,1912.0,"Friday, 20 June 2025",2025-05-21,111,3,2,1.0,House,32 REVERENCE DRIVE,-37.739746,144.6559,2025-09-09 16:18:47,17584865,DC-0942-KQ,12,0,0,False,House,House,Ray White Truganina,29324.0,"Akash Sharma, Palak Joshi","Secure Parking, Bath",https://www.domain.com.au/32-reverence-drive-rockbank-vic-3335-17584865
17623186,ROCKBANK,3335,425.0,1847.0,"Tuesday, 01 July 2025",2025-06-16,85,3,2,2.0,House,54 Plymouth Drive,-37.723034,144.63882,2025-09-09 16:18:47,17623186,,14,0,0,False,House,House,ONE Agency Property Masters,32157.0,"Divya Sachdeva, Dinesh Khurana","Internal Laundry, Secure Parking, Heating",https://www.domain.com.au/54-plymouth-drive-rockbank-vic-3335-17623186
17659162,ROCKBANK,3335,470.0,2042.0,"Thursday, 31 July 2025",2025-07-08,63,4,2,2.0,House,5 Tamworth Drive,-37.738956,144.64989,2025-09-09 16:18:47,17659162,,10,0,0,False,House,House,Harcourts Rata & Co,30123.0,Taylah Lowe,"Gas, Secure Parking, Heating, Built in wardrobes, Close to transport, Close to shops, Close to schools, Ensuite, Carpeted, Openable Windows, Split System Cooling, Dishwasher",https://www.domain.com.au/5-tamworth-drive-rockbank-vic-3335-17659162
17671193,ROCKBANK,3335,550.0,2389.0,"Wednesday, 16 July 2025",2025-07-16,55,4,3,2.0,House,13 Equity Street,-37.741413,144.66383,2025-09-09 16:18:47,17671193,,1,0,0,False,House,House,AGENCY HQ Melbourne West,37657.0,"Sai Allamneni, Deepak Devaraj","Air conditioning, Built in wardrobes, Gas, Pets Allowed, Fully fenced, Secure Parking, Dishwasher, Floorboards, Study, Ducted Heating, Evaporative Cooling",https://www.domain.com.au/13-equity-street-rockbank-vic-3335-17671193
17675422,ROCKBANK,3335,500.0,2167.0,"Friday, 18 July 2025",2025-07-18,53,4,2,2.0,Townhouse,97 Brundell Avenue,-37.735504,144.64275,2025-09-09 16:18:47,17675422,,10,0,0,False,Townhouse/Villa,Townhouse,,,Elena Mandalas,"Secure Parking, Heating",https://www.domain.com.au/97-brundell-avenue-rockbank-vic-3335-17675422
17677864,ROCKBANK,3335,450.0,1955.0,"Friday, 12 September 2025",2025-07-21,50,3,2,1.0,House,8 Reverence Drive,-37.738354,144.6561,2025-09-09 16:18:47,17677864,,18,0,0,False,House,House,Barry Plant Caroline Springs,11528.0,"Garnet Rodrigues, Property Management","Secure Parking, Heating, Dishwasher",https://www.domain.com.au/8-reverence-drive-rockbank-vic-3335-17677864
17701658,ROCKBANK,3335,490.0,2129.0,"Tuesday, 05 August 2025",2025-08-05,35,4,2,1.0,House,13 Newcastle Road,-37.73954,144.64641,2025-09-09 16:18:47,17701658,,18,0,0,False,House,House,Area Specialist West,37887.0,"Jordan Chircop, Stephanie Scerri","Secure Parking, Heating",https://www.domain.com.au/13-newcastle-road-rockbank-vic-3335-17701658
17709672,ROCKBANK,3335,480.0,2085.0,"Friday, 05 September 2025",2025-08-11,29,3,2,1.0,House,9 Sobers Drive,-37.73346,144.64952,2025-09-09 16:18:47,17709672,,11,0,0,False,House,House,Alliance Estate Agents Wyndham,34960.0,"Simon Dangol, Ken Maharjan","Internal Laundry, Fully fenced, Remote Garage, Built in wardrobes, Dishwasher, Ducted Heating, Evaporative Cooling, Ensuite",https://www.domain.com.au/9-sobers-drive-rockbank-vic-3335-17709672
17710151,ROCKBANK,3335,530.0,2303.0,"Monday, 11 August 2025",2025-08-11,29,4,2,2.0,House,22 Moylan Drive,-37.73429,144.64323,2025-09-09 16:18:47,17710151,,10,0,1,False,House,House,Harcourts Rata & Co,30123.0,Taylah Lowe,"Internal Laundry, Secure Parking, Bath, Heating, Study, Built in wardrobes, Close to transport, Openable Windows, Split System Cooling, Dishwasher",https://www.domain.com.au/22-moylan-drive-rockbank-vic-3335-17710151
17714655,ROCKBANK,3335,520.0,2260.0,"Wednesday, 13 August 2025",2025-08-14,26,4,2,2.0,House,9 Ficus Way,-37.73927,144.65271,2025-09-09 16:18:47,17714655,,8,0,0,False,House,House,Sahara Real Estate,30767.0,"Robyn Morgan, Sahara RE Admin","Secure Parking, Study",https://www.domain.com.au/9-ficus-way-rockbank-vic-3335-17714655
