listing_id,suburb,postcode,weekly_rent,bond,available_date,date_listed,days_listed,bedrooms,bathrooms,carspaces,property_type,address,lat,lon,scraped_date,domain_page_id,property_id,photo_count,video_count,floorplans_count,virtual_tour,primary_type,secondary_type,agency,agency_id,agent_names,structured_features,url
15912591,SEBASTOPOL,3356,430.0,1864.0,"Friday, 29 August 2025",2025-08-18,22,4,2,3,House,64 Yarrowee Street,-37.588306,143.84256,2025-09-09 16:52:40,15912591,NC-3988-AY,19,0,0,True,House,House,PRDnationwide Ballarat,5808,"Jenna Tomada, Shari Plater","Internal Laundry, Heating, Air conditioning, Ensuite, Built in wardrobes, Pets Allowed, Dishwasher, Secure Parking, Shed, Fully fenced",https://www.domain.com.au/64-yarrowee-street-sebastopol-vic-3356-15912591
17520636,SEBASTOPOL,3356,415.0,1803.0,"Thursday, 25 September 2025",2025-08-22,17,2,1,1,House,5A Edwards Street,-37.59578,143.83705,2025-09-09 16:52:40,17520636,BV-2533-AM,11,0,0,False,House,House,Ray White Ballarat,11641,"Bernie Dickson, Tianna Vella","Air conditioning, Built in wardrobes, Secure Parking, Heating",https://www.domain.com.au/5a-edwards-street-sebastopol-vic-3356-17520636
17714099,SEBASTOPOL,3356,400.0,1738.0,"Friday, 22 August 2025",2025-08-13,27,3,1,2,House,10 Victoria Street,-37.59864,143.83954,2025-09-09 16:52:40,17714099,,8,0,0,False,House,House,Ray White Ballarat,11641,"Bernie Dickson, Chandra Budiman","Built in wardrobes, Heating",https://www.domain.com.au/10-victoria-street-sebastopol-vic-3356-17714099
17715299,SEBASTOPOL,3356,410.0,1781.0,"Monday, 18 August 2025",2025-08-14,26,3,1,1,House,1/109 Rubicon Street,-37.58234,143.83966,2025-09-09 16:52:40,17715299,,11,0,0,False,House,House,Ray White Ballarat,11641,"Bernie Dickson, Caine Hunter",Secure Parking,https://www.domain.com.au/1-109-rubicon-street-sebastopol-vic-3356-17715299
17716280,SEBASTOPOL,3356,440.0,1911.0,"Thursday, 28 August 2025",2025-08-14,25,4,2,2,House,119A Edwards Street,-37.607178,143.8352,2025-09-09 16:52:40,17716280,,8,0,0,False,House,House,Ray White Ballarat,11641,Lauren Hodgson,"Secure Parking, Bath, Air conditioning, Built in wardrobes, Heating, Fully fenced",https://www.domain.com.au/119a-edwards-street-sebastopol-vic-3356-17716280
17719302,SEBASTOPOL,3356,390.0,1695.0,"Friday, 05 September 2025",2025-08-18,22,3,1,1,House,108 Grant Street,-37.595627,143.83124,2025-09-09 16:52:40,17719302,,17,0,0,False,House,House,McGrath Ballarat,32266,Chantal Ryan,"Air conditioning, Built in wardrobes, Bath, Heating, Dishwasher",https://www.domain.com.au/108-grant-street-sebastopol-vic-3356-17719302
17719332,SEBASTOPOL,3356,365.0,1586.0,"Wednesday, 10 September 2025",2025-08-18,22,2,1,1,Apartment / Unit / Flat,3/30 Albion Street,-37.596157,143.83334,2025-09-09 16:52:40,17719332,,8,0,0,False,Apartment,Apartment / Unit / Flat,Ballarat Real Estate,13411,"Adrian Marshall, Henry Geljon","Internal Laundry, Secure Parking, Heating, Built in wardrobes, Pets Allowed",https://www.domain.com.au/3-30-albion-street-sebastopol-vic-3356-17719332
17725724,SEBASTOPOL,3356,420.0,1820.0,"Thursday, 21 August 2025",2025-08-21,19,4,2,2,House,208 Walker Street,-37.595154,143.82812,2025-09-09 16:52:40,17725724,,10,0,0,False,House,House,Buxton (Ballarat) Pty Ltd,26896,Buxton Ballarat Leasing,"Air conditioning, Secure Parking, Bath, Heating",https://www.domain.com.au/208-walker-street-sebastopol-vic-3356-17725724
17727724,SEBASTOPOL,3356,460.0,1998.0,"Friday, 29 August 2025",2025-08-22,18,4,2,2,House,28 Oscar Drive,-37.594402,143.8253,2025-09-09 16:52:40,17727724,,15,0,1,False,House,House,Ray White Ballarat,11641,Peter Ludbrook,"Air conditioning, Gas, Secure Parking, Bath, Heating, Dishwasher, Balcony / Deck",https://www.domain.com.au/28-oscar-drive-sebastopol-vic-3356-17727724
17728666,SEBASTOPOL,3356,400.0,,"Friday, 22 August 2025",2025-08-22,18,3,1,2,House,71 Albert Street,-37.587845,143.84131,2025-09-09 16:52:40,17728666,,8,0,0,False,House,House,Ballarat Real Estate,13411,"Tiarra Lockwood, Bailey Wilson","Secure Parking, Pets Allowed",https://www.domain.com.au/71-albert-street-sebastopol-vic-3356-17728666
17730841,SEBASTOPOL,3356,380.0,1647.0,"Thursday, 11 September 2025",2025-08-25,14,3,2,1,Apartment / Unit / Flat,1/6 Damon Court,-37.609837,143.83322,2025-09-09 16:52:40,17730841,,10,0,0,False,Apartment,Apartment / Unit / Flat,Buxton (Ballarat) Pty Ltd,26896,"Buxton Ballarat Leasing, Charlotte King","Secure Parking, Bath, Heating, Dishwasher",https://www.domain.com.au/1-6-damon-court-sebastopol-vic-3356-17730841
17731417,SEBASTOPOL,3356,360.0,1564.0,"Monday, 20 October 2025",2025-08-26,14,2,1,1,House,24 Westcliffe Crescent,-37.607464,143.84161,2025-09-09 16:52:40,17731417,,7,0,0,False,House,House,Ballarat Real Estate,13411,"David Newcombe, Mikayla Watt","Gas, Secure Parking, Bath, Heating, Built in wardrobes, Pets Allowed, Dishwasher",https://www.domain.com.au/24-westcliffe-crescent-sebastopol-vic-3356-17731417
17736232,SEBASTOPOL,3356,465.0,2015.0,"Friday, 12 September 2025",2025-08-28,12,4,2,4,House,15 Morgan Street,-37.606956,143.84258,2025-09-09 16:52:40,17736232,,11,0,0,False,House,House,Buxton (Ballarat) Pty Ltd,26896,Buxton Ballarat Leasing,"Built in wardrobes, Gas, Internal Laundry, Bath, Dishwasher, Shed",https://www.domain.com.au/15-morgan-street-sebastopol-vic-3356-17736232
17736746,SEBASTOPOL,3356,390.0,1694.0,"Thursday, 25 September 2025",2025-08-28,12,2,1,1,Townhouse,2/38 Beverin Street,-37.588768,143.83914,2025-09-09 16:52:40,17736746,,12,0,0,False,Townhouse/Villa,Townhouse,Ray White Ballarat,11641,Peter Ludbrook,"Built in wardrobes, Gas, Heating, Dishwasher",https://www.domain.com.au/2-38-beverin-street-sebastopol-vic-3356-17736746
17738087,SEBASTOPOL,3356,385.0,1668.0,"Thursday, 18 September 2025",2025-08-29,11,2,2,1,Apartment / Unit / Flat,13 Forza Place,-37.582657,143.83351,2025-09-09 16:52:40,17738087,,19,0,0,False,Apartment,Apartment / Unit / Flat,Jens Veal Byrne,29442,Julie Robson,"Secure Parking, Heating, Dishwasher, Ensuite",https://www.domain.com.au/13-forza-place-sebastopol-vic-3356-17738087
17739907,SEBASTOPOL,3356,390.0,1694.0,"Friday, 29 August 2025",2025-09-01,8,3,1,2,House,501 Sutton Street,-37.5813,143.82765,2025-09-09 16:52:40,17739907,,14,1,1,False,House,House,Ballarat Real Estate,13411,Joshua Dean,"Heating, Built in wardrobes, Pets Allowed, Roller Door Access, Dishwasher, Fully fenced",https://www.domain.com.au/501-sutton-street-sebastopol-vic-3356-17739907
17743020,SEBASTOPOL,3356,400.0,1738.0,"Tuesday, 02 September 2025",2025-09-02,7,2,1,1,House,7 Boxley Ct,-37.591896,143.8285,2025-09-09 16:52:40,17743020,,9,0,0,False,House,House,Trevor Petrie Real Estate,14353,Annie-Jo Ross,"Secure Parking, Bath, Heating, Air conditioning, Built in wardrobes, Dishwasher, Out door entertaining area",https://www.domain.com.au/7-boxley-ct-sebastopol-vic-3356-17743020
17744009,SEBASTOPOL,3356,400.0,1738.0,"Tuesday, 02 September 2025",2025-09-02,7,3,1,4,House,619 Rubicon Street,-37.581203,143.82916,2025-09-09 16:52:40,17744009,,16,0,0,True,House,House,Goldfish Real Estate,32614,"Rohit Rishi, Sonia MEHTA","Shed, Air conditioning, Heating, Built in wardrobes, Close to transport, Close to shops, Close to schools, Exhaust, Toilet Facilities",https://www.domain.com.au/619-rubicon-street-sebastopol-vic-3356-17744009
17749790,SEBASTOPOL,3356,400.0,1733.0,"Friday, 12 September 2025",2025-09-05,4,3,1,2,Townhouse,7 Eldridge Court,-37.591827,143.84645,2025-09-09 16:52:40,17749790,,17,0,0,False,Townhouse/Villa,Townhouse,Jens Veal Byrne,29442,"Chris Byrne, Julie Robson","Built in wardrobes, Internal Laundry, Secure Parking, Bath, Dishwasher",https://www.domain.com.au/7-eldridge-court-sebastopol-vic-3356-17749790
17750759,SEBASTOPOL,3356,400.0,1733.0,"Monday, 08 September 2025",2025-09-08,1,3,2,2,House,5 Rimmington Drive,-37.606083,143.84491,2025-09-09 16:52:40,17750759,,11,0,0,False,House,House,Buxton (Ballarat) Pty Ltd,26896,Buxton Ballarat Leasing,"Internal Laundry, Pets Allowed, Secure Parking, Bath, Heating, Dishwasher, Fully fenced",https://www.domain.com.au/5-rimmington-drive-sebastopol-vic-3356-17750759
16772125,SEBASTOPOL,3356,,1912.0,,2023-11-30,649,4,2,2,House,18 Hilderbrand Court,-37.601147,143.8249,2025-09-09 16:52:44,16772125,ED-0330-FN,7,0,0,False,House,House,Investors Choice Property Management Pty Ltd,18981,,"Internal Laundry, Heating, Dishwasher, Study, Ensuite(s), Secure Parking",https://www.domain.com.au/18-hilderbrand-court-sebastopol-vic-3356-16772125
16997400,SEBASTOPOL,3356,390.0,1694.0,"Friday, 11 July 2025",2025-05-23,109,3,1,1,House,8 Kent Street,-37.58354,143.8374,2025-09-09 16:52:44,16997400,QX-5933-PF,6,0,0,False,House,House,Ray White Ballarat,11641,"Bernie Dickson, Tianna Vella",Heating,https://www.domain.com.au/8-kent-street-sebastopol-vic-3356-16997400
17173424,SEBASTOPOL,3356,385.0,1672.0,"Friday, 19 September 2025",2025-08-07,33,3,1,2,House,197 Spencer Street,-37.605137,143.83844,2025-09-09 16:52:44,17173424,EC-6468-RY,12,0,0,False,House,House,Ray White Ballarat,11641,"Bernie Dickson, Caine Hunter",Internal Laundry,https://www.domain.com.au/197-spencer-street-sebastopol-vic-3356-17173424
17576683,SEBASTOPOL,3356,300.0,1300.0,"Monday, 30 June 2025",2025-05-16,116,1,1,1,Apartment / Unit / Flat,3/48 Bridge Street,-37.600014,143.84688,2025-09-09 16:52:44,17576683,TH-6310-VI,8,0,0,False,Apartment,Apartment / Unit / Flat,Buxton (Ballarat) Pty Ltd,26896,Buxton Ballarat Leasing,"Built in wardrobes, Internal Laundry",https://www.domain.com.au/3-48-bridge-street-sebastopol-vic-3356-17576683
17629226,SEBASTOPOL,3356,410.0,1776.0,"Monday, 14 July 2025",2025-06-19,82,3,1,3,House,30 Cromwell Street,-37.583813,143.83038,2025-09-09 16:52:44,17629226,,2,0,0,False,House,House,Ray White Ballarat,11641,"Bernie Dickson, Caine Hunter",Internal Laundry,https://www.domain.com.au/30-cromwell-street-sebastopol-vic-3356-17629226
17630370,SEBASTOPOL,3356,395.0,1716.0,"Monday, 28 July 2025",2025-06-20,81,3,1,1,House,601 Rubicon Street,-37.581333,143.83092,2025-09-09 16:52:44,17630370,,2,0,0,False,House,House,Ray White Ballarat,11641,"Bernie Dickson, Caine Hunter",,https://www.domain.com.au/601-rubicon-street-sebastopol-vic-3356-17630370
17642680,SEBASTOPOL,3356,375.0,1629.0,"Wednesday, 23 July 2025",2025-06-27,74,4,1,2,House,43 Birdwood Avenue,-37.597885,143.835,2025-09-09 16:52:44,17642680,,12,0,0,False,House,House,Ballarat Real Estate,13411,"David Newcombe, Mikayla Watt","Gas, Balcony / Deck, Air conditioning, Heating, Built in wardrobes, Pets Allowed, Study",https://www.domain.com.au/43-birdwood-avenue-sebastopol-vic-3356-17642680
17683051,SEBASTOPOL,3356,380.0,1651.0,"Friday, 01 August 2025",2025-07-23,47,3,1,1,House,312 Albert Street,-37.609695,143.83887,2025-09-09 16:52:44,17683051,,7,0,1,False,House,House,Doepel Lilley & Taylor,13691,Shane Kozaris,"Air conditioning, Heating, Built in wardrobes, Close to transport, Close to shops, Close to schools",https://www.domain.com.au/312-albert-street-sebastopol-vic-3356-17683051
17689760,SEBASTOPOL,3356,310.0,1343.0,"Monday, 25 August 2025",2025-07-29,42,2,1,1,Apartment / Unit / Flat,5/31 Beverin Street,-37.588326,143.83987,2025-09-09 16:52:44,17689760,,6,0,0,False,Apartment,Apartment / Unit / Flat,Ray White Ballarat,11641,"Bernie Dickson, Letisha McCarthy","Built in wardrobes, Bath, Fully fenced",https://www.domain.com.au/5-31-beverin-street-sebastopol-vic-3356-17689760
17704445,SEBASTOPOL,3356,400.0,1738.0,"Friday, 15 August 2025",2025-08-07,33,3,1,1,House,24 Alfred Street,-37.584267,143.83418,2025-09-09 16:52:44,17704445,,10,0,0,False,House,House,Ray White Ballarat,11641,Peter Ludbrook,"Built in wardrobes, Pets Allowed, Bath, Heating, Fully fenced",https://www.domain.com.au/24-alfred-street-sebastopol-vic-3356-17704445
17708088,SEBASTOPOL,3356,400.0,1738.0,"Friday, 08 August 2025",2025-08-08,31,3,2,2,Townhouse,9/33 Alexandra Street,-37.585373,143.83318,2025-09-09 16:52:44,17708088,,13,0,1,False,Townhouse/Villa,Townhouse,Ballarat Real Estate,13411,"Reynaldo Rilen, Joshua Jones","Secure Parking, Air conditioning, Heating, Built in wardrobes, Pets Allowed, Roller Door Access, Dishwasher, Fully fenced",https://www.domain.com.au/9-33-alexandra-street-sebastopol-vic-3356-17708088
17709393,SEBASTOPOL,3356,420.0,1825.0,"Wednesday, 20 August 2025",2025-08-11,29,3,1,2,House,150 Spencer St,-37.5974,143.83778,2025-09-09 16:52:44,17709393,,10,0,0,False,House,House,Fletchers Ballarat,16913,Katrina Weidemann,"Built in wardrobes, Gas, Secure Parking, Heating",https://www.domain.com.au/150-spencer-st-sebastopol-vic-3356-17709393
