listing_id,suburb,postcode,weekly_rent,bond,available_date,date_listed,days_listed,bedrooms,bathrooms,carspaces,property_type,address,lat,lon,scraped_date,domain_page_id,property_id,photo_count,video_count,floorplans_count,virtual_tour,primary_type,secondary_type,agency,agency_id,agent_names,structured_features,url
16505030,SOUTH MORANG,3752,1100,4780,"Monday, 29 September 2025",2025-09-03,6,4,3,3,House,18 Belinda Court,-37.62408,145.06424,2025-09-09 16:31:04,16505030,AZ-1835-AT,12,0,0,False,House,House,Ray White South Morang,12623,Brooklyn Ring,Balcony / Deck,https://www.domain.com.au/18-belinda-court-south-morang-vic-3752-16505030
16915208,SOUTH MORANG,3752,520,2260,"Monday, 18 March 2024",2025-09-09,0,3,1,1,House,262 The Lakes Boulevard,-37.63013,145.0829,2025-09-09 16:31:04,16915208,CU-5852-YL,11,1,0,False,House,House,Ray White South Morang,12623,Lauren Gray,"Internal Laundry, Secure Parking, Heating, Dishwasher",https://www.domain.com.au/262-the-lakes-boulevard-south-morang-vic-3752-16915208
17288432,SOUTH MORANG,3752,500,2173,"Friday, 24 October 2025",2025-09-03,6,3,2,2,House,40 Tuross Crescent,-37.635906,145.0914,2025-09-09 16:31:04,17288432,YY-5902-CJ,8,0,1,False,House,House,Millership & Co,18340,Ingrid Elliott,"Courtyard, Remote Garage, Secure Parking, Dishwasher, Air conditioning, Split-System Air Conditioning, Split-System Heating",https://www.domain.com.au/40-tuross-crescent-south-morang-vic-3752-17288432
17692994,SOUTH MORANG,3752,350,1521,"Wednesday, 27 August 2025",2025-07-30,41,1,1,1,Apartment / Unit / Flat,1/798 Plenty Road,-37.65261,145.08664,2025-09-09 16:31:04,17692994,,6,0,0,False,Apartment,Apartment / Unit / Flat,Ray White Mill Park,12621,"Emmanuela Kanavos, Mill Park Office",Built in wardrobes,https://www.domain.com.au/1-798-plenty-road-south-morang-vic-3752-17692994
17700319,SOUTH MORANG,3752,600,2607,"Friday, 22 August 2025",2025-08-05,35,4,2,2,House,2 Ellendale Way,-37.63716,145.0773,2025-09-09 16:31:04,17700319,,10,0,0,False,House,House,Ray White Mill Park,12621,"Emmanuela Kanavos, Mill Park Office","Secure Parking, Heating, Dishwasher",https://www.domain.com.au/2-ellendale-way-south-morang-vic-3752-17700319
17701893,SOUTH MORANG,3752,550,2389,"Tuesday, 02 September 2025",2025-08-05,35,3,2,2,Apartment / Unit / Flat,2/11 Payne Place,-37.651543,145.09358,2025-09-09 16:31:04,17701893,,10,0,0,False,Apartment,Apartment / Unit / Flat,Jellis Craig Ivanhoe,30455,"Karin Kaine, Michelle De Luca","Secure Parking, Furnished, Dishwasher",https://www.domain.com.au/2-11-payne-place-south-morang-vic-3752-17701893
17731517,SOUTH MORANG,3752,530,2303,"Monday, 08 September 2025",2025-08-26,14,3,2,4,House,9 Avion Rise,-37.638866,145.06529,2025-09-09 16:31:04,17731517,,22,0,0,False,House,House,Ray White Mill Park,12621,"Emmanuela Kanavos, Mill Park Office","Secure Parking, Heating",https://www.domain.com.au/9-avion-rise-south-morang-vic-3752-17731517
17733849,SOUTH MORANG,3752,550,2390,"Tuesday, 30 September 2025",2025-08-27,13,3,2,2,House,31 McGlynn Avenue,-37.65504,145.08914,2025-09-09 16:31:04,17733849,,9,0,0,False,House,House,Millership & Co,18340,Ingrid Elliott,"Deck, Fully fenced, Outdoor Entertainment Area, Remote Garage, Built in wardrobes, Dishwasher, Air conditioning, Ducted Heating, Reverse Cycle Air Conditioning",https://www.domain.com.au/31-mcglynn-avenue-south-morang-vic-3752-17733849
17741917,SOUTH MORANG,3752,560,2433,"Monday, 01 September 2025",2025-09-01,7,3,2,1,House,20 Lazar Grove,-37.637383,145.07413,2025-09-09 16:31:04,17741917,,11,0,0,False,House,House,Love & Co Mill Park,7119,Merve Ozer,,https://www.domain.com.au/20-lazar-grove-south-morang-vic-3752-17741917
17742936,SOUTH MORANG,3752,680,2955,"Tuesday, 02 September 2025",2025-09-02,7,4,2,2,House,1071 Plenty Road,-37.63168,145.09564,2025-09-09 16:31:04,17742936,,9,0,0,False,House,House,Ray White South Morang,12623,Brooklyn Ring,"Built in wardrobes, Secure Parking, Heating, Dishwasher",https://www.domain.com.au/1071-plenty-road-south-morang-vic-3752-17742936
17742947,SOUTH MORANG,3752,520,2260,"Monday, 15 September 2025",2025-09-02,7,2,1,1,House,302-308 The Lakes Boulevard,-37.631218,145.08614,2025-09-09 16:31:04,17742947,,9,0,0,False,House,House,Ray White Mernda,33841,Rental Department Mernda,"Built in wardrobes, Internal Laundry, Secure Parking, Broadband internet access, Heating, Balcony / Deck",https://www.domain.com.au/302-308-the-lakes-boulevard-south-morang-vic-3752-17742947
17743061,SOUTH MORANG,3752,560,2433,"Monday, 15 September 2025",2025-09-02,7,3,2,2,House,304-306 The Lakes Boulevard,-37.63109,145.08566,2025-09-09 16:31:04,17743061,,10,0,0,False,House,House,Ray White Mernda,33841,Rental Department Mernda,"Built in wardrobes, Internal Laundry, Broadband internet access, Heating, Balcony / Deck",https://www.domain.com.au/304-306-the-lakes-boulevard-south-morang-vic-3752-17743061
17744241,SOUTH MORANG,3752,435,1985,"Monday, 22 September 2025",2025-09-02,6,2,1,1,House,20 Chamonix Pde,-37.61847,145.09604,2025-09-09 16:31:04,17744241,,8,0,0,False,House,House,Pitra Real Estate Group,18350,Radmila Pitra,"Ensuite(s), Ground floor, Energy efficient appliances, Internal Laundry, Gas, Broadband internet access, Bath, Heating, Secure Parking, Fully fenced, Garden / Courtyard",https://www.domain.com.au/20-chamonix-pde-south-morang-vic-3752-17744241
17744435,SOUTH MORANG,3752,580,2520,"Monday, 08 September 2025",2025-09-03,6,4,2,3,House,29 Le Page Run,-37.621708,145.10281,2025-09-09 16:31:04,17744435,,6,0,1,False,House,House,Darren Jones Real Estate,11759,Sally Ekman,"Secure Parking, Heating, Dishwasher",https://www.domain.com.au/29-le-page-run-south-morang-vic-3752-17744435
17744527,SOUTH MORANG,3752,600,2607,"Wednesday, 10 September 2025",2025-09-03,6,3,2,2,House,7 Lazar Grove,-37.63778,145.07333,2025-09-09 16:31:04,17744527,,9,0,1,False,House,House,Barry Plant North Eastern Group,4902,"Peter Mac, Matthew Clark","Internal Laundry, Secure Parking, Broadband internet access, Dishwasher, Shed, Heating, Built in wardrobes, Close to transport, Close to shops, Close to schools, Ensuite",https://www.domain.com.au/7-lazar-grove-south-morang-vic-3752-17744527
17745649,SOUTH MORANG,3752,550,2390,"Monday, 15 September 2025",2025-09-03,6,4,2,1,House,6 Silkwood Grove,-37.632015,145.08089,2025-09-09 16:31:04,17745649,,6,0,0,False,House,House,Ray White South Morang,12623,Kate Steneker,"Heating, Dishwasher",https://www.domain.com.au/6-silkwood-grove-south-morang-vic-3752-17745649
17748475,SOUTH MORANG,3752,480,2086,"Monday, 22 September 2025",2025-09-05,4,2,2,1,Apartment / Unit / Flat,2/12 McGlynn Avenue,-37.653934,145.0875,2025-09-09 16:31:04,17748475,,2,0,0,False,Apartment,Apartment / Unit / Flat,Love & Co Mill Park,7119,Vicki Cianci,"Air conditioning, Secure Parking, Heating",https://www.domain.com.au/2-12-mcglynn-avenue-south-morang-vic-3752-17748475
17752666,SOUTH MORANG,3752,600,2607,"Sunday, 28 September 2025",2025-09-09,0,4,2,2,House,54 Grange Drive,-37.63841,145.08655,2025-09-09 16:31:04,17752666,,13,0,0,False,House,House,Ray White Mill Park,12621,"Emmanuela Kanavos, Mill Park Office",Secure Parking,https://www.domain.com.au/54-grange-drive-south-morang-vic-3752-17752666
17753267,SOUTH MORANG,3752,520,2260,"Friday, 10 October 2025",2025-09-09,0,2,2,1,House,2C Coleridge Way,-37.63597,145.08395,2025-09-09 16:31:04,17753267,,1,0,0,False,House,House,One Group Realty,32679,"Chantell Hawzi, Rouche Kour",,https://www.domain.com.au/2c-coleridge-way-south-morang-vic-3752-17753267
17753504,SOUTH MORANG,3752,750,3259,"Monday, 15 September 2025",2025-09-09,0,4,2,2,House,27 Hawkstowe Parade,-37.621292,145.09998,2025-09-09 16:31:04,17753504,,11,0,1,False,House,House,Morrison Kleeman Estate Agents,4241,"Marilyn Walters, Jenny Hussey","Internal Laundry, Secure Parking, Heating",https://www.domain.com.au/27-hawkstowe-parade-south-morang-vic-3752-17753504
15296801,SOUTH MORANG,3752,480,2086,"Tuesday, 09 September 2025",2025-08-22,18,2,1,1,House,8/12-14 McGlynn Avenue,-37.65397,145.08788,2025-09-09 16:31:10,15296801,,6,0,0,False,House,House,Ray White South Morang,12623,Kaitlyn O'Loughlin,"Internal Laundry, Heating, Built in wardrobes",https://www.domain.com.au/8-12-14-mcglynn-avenue-south-morang-vic-3752-15296801
15624569,SOUTH MORANG,3752,420,1825,"Friday, 26 September 2025",2025-08-25,15,2,1,1,Apartment / Unit / Flat,6/1 Bethany Court,-37.6468,145.0937,2025-09-09 16:31:10,15624569,EU-1873-HG,6,0,0,False,Apartment,Apartment / Unit / Flat,Millership & Co,18340,Ingrid Elliott,"Gas, Courtyard, Secure Parking, Built in wardrobes, Air conditioning, Split-System Air Conditioning, Split-System Heating",https://www.domain.com.au/6-1-bethany-court-south-morang-vic-3752-15624569
16604660,SOUTH MORANG,3752,570,2477,"Monday, 06 October 2025",2025-08-22,18,3,3,2,House,70 Gorge Road,-37.651955,145.09657,2025-09-09 16:31:10,16604660,TG-0912-AJ,6,0,0,False,House,House,Ray White South Morang,12623,Lauren Gray,"Gas, Heating, Dishwasher",https://www.domain.com.au/70-gorge-road-south-morang-vic-3752-16604660
17072937,SOUTH MORANG,3752,650,2824,"Monday, 01 September 2025",2025-08-14,26,3,2,2,Townhouse,2/10 Loveridge Way,-37.626648,145.06749,2025-09-09 16:31:10,17072937,BF-0386-LF,8,0,1,False,Townhouse/Villa,Townhouse,Leased and Sold Estate Agents,36316,Emily Buccella,"Built in wardrobes, Ducted Heating, Air conditioning, Ensuite(s), Courtyard",https://www.domain.com.au/2-10-loveridge-way-south-morang-vic-3752-17072937
17462529,SOUTH MORANG,3752,590,2564,"Friday, 28 February 2025",2025-02-28,193,3,2,2,House,7 Premier Avenue,-37.631153,145.06635,2025-09-09 16:31:10,17462529,HX-4861-VG,9,0,0,False,House,House,Areal Property - South Morang,35521,"Demi Georga, Ayda Badri","Air conditioning, Secure Parking, Heating, Close to transport, Close to shops, Close to schools",https://www.domain.com.au/7-premier-avenue-south-morang-vic-3752-17462529
17564316,SOUTH MORANG,3752,560,2433,"Friday, 29 August 2025",2025-08-28,12,4,2,2,House,16 Jezwing Avenue,-37.63779,145.08983,2025-09-09 16:31:10,17564316,PG-9939-ZJ,12,0,0,False,House,House,Fletchers Projects Rental,26073,"Leane Shea, Joyee Jiang","Gas, Secure Parking, Bath, Heating",https://www.domain.com.au/16-jezwing-avenue-south-morang-vic-3752-17564316
17620857,SOUTH MORANG,3752,495,2151,"Wednesday, 27 August 2025",2025-06-13,87,2,1,1,Townhouse,27 Glenorchy Way,-37.633266,145.08595,2025-09-09 16:31:10,17620857,,9,0,0,False,Townhouse/Villa,Townhouse,Harcourts Rata & Co,30123,Natasha Buhagiar,"Air conditioning, Heating, Built in wardrobes, Close to transport, Close to shops, Close to schools, Ensuite, Carpeted, Openable Windows, Cooling, Dishwasher",https://www.domain.com.au/27-glenorchy-way-south-morang-vic-3752-17620857
17650081,SOUTH MORANG,3752,550,2390,"Monday, 11 August 2025",2025-07-02,68,3,2,1,Townhouse,30 Gordons Road,-37.637257,145.09479,2025-09-09 16:31:10,17650081,,10,0,1,False,Townhouse/Villa,Townhouse,One Group Realty,32679,"Rouche Kour, Chantell Hawzi","Ensuite, Dishwasher, Built in wardrobes, Ducted Heating, Ducted Cooling, Remote Garage, Secure Parking, Balcony",https://www.domain.com.au/30-gordons-road-south-morang-vic-3752-17650081
17666532,SOUTH MORANG,3752,196,850,"Friday, 30 May 2025",2025-07-14,57,5,2,2,Studio,5 Palisades Boulevard,-37.617767,145.07051,2025-09-09 16:31:10,17666532,,17,0,0,False,Apartment,Studio,Grit Real Estate,39036,Dulip Jayakody,"Courtyard, Fully fenced, Built in wardrobes, Dishwasher, Air conditioning, Ducted Heating, Ensuite",https://www.domain.com.au/5-palisades-boulevard-south-morang-vic-3752-17666532
17702001,SOUTH MORANG,3752,680,2955,"Friday, 05 September 2025",2025-08-05,34,4,2,2,House,12 Freshwater Way,-37.631252,145.08398,2025-09-09 16:31:10,17702001,,15,0,0,False,House,House,Hockingstuart Epping,26544,Deepak Bawa,"Gas, Secure Parking, Heating, Dishwasher, Solar panels",https://www.domain.com.au/12-freshwater-way-south-morang-vic-3752-17702001
17704107,SOUTH MORANG,3752,470,2042,"Friday, 08 August 2025",2025-08-06,33,2,1,1,Apartment / Unit / Flat,4/812 Plenty Road,-37.652035,145.08817,2025-09-09 16:31:10,17704107,,10,0,1,False,Apartment,Apartment / Unit / Flat,One Group Realty,32679,"Chantell Hawzi, Kalley Singh","Broadband internet access, Ensuite, Dishwasher, Rumpus Room, Floorboards, Ducted Heating, Ducted Cooling, Secure Parking, Fully fenced",https://www.domain.com.au/4-812-plenty-road-south-morang-vic-3752-17704107
17715732,SOUTH MORANG,3752,580,2514,"Thursday, 14 August 2025",2025-08-14,26,2,2,1,Apartment / Unit / Flat,8/29 Old Plenty Road,-37.64318,145.09428,2025-09-09 16:31:10,17715732,,22,1,0,False,Apartment,Apartment / Unit / Flat,Del Monte Real Estate East Ivanhoe,19465,Morris Del Monte,"Balcony, Courtyard, Fully fenced, Remote Garage, Secure Parking, Shed, Built in wardrobes, Dishwasher, Floorboards, Pay TV Access, Split-System Air Conditioning, Split-System Heating, Greywater system, Water Tank, Pets Allowed",https://www.domain.com.au/8-29-old-plenty-road-south-morang-vic-3752-17715732
17720314,SOUTH MORANG,3752,650,2824,"Monday, 08 September 2025",2025-08-18,22,4,2,2,House,50 Darius Terrace,-37.63686,145.07109,2025-09-09 16:31:10,17720314,,6,0,0,False,House,House,Love & Co Mill Park,7119,Merve Ozer,"Gas, Secure Parking, Study",https://www.domain.com.au/50-darius-terrace-south-morang-vic-3752-17720314
17724506,SOUTH MORANG,3752,495,2151,"Friday, 03 October 2025",2025-08-20,20,2,2,2,Townhouse,11/40 Gorge Road,-37.650948,145.0908,2025-09-09 16:31:10,17724506,,7,0,1,False,Townhouse/Villa,Townhouse,Harcourts Rata & Co,30123,Monique Di Domenica,"Gas, Internal Laundry, Secure Parking, Built in wardrobes, Close to transport, Close to schools, Openable Windows, Split System Cooling, Dishwasher",https://www.domain.com.au/11-40-gorge-road-south-morang-vic-3752-17724506
17726329,SOUTH MORANG,3752,750,3258,"Monday, 25 August 2025",2025-08-21,19,4,2,2,House,10 Witchazel Drive,-37.629433,145.08778,2025-09-09 16:31:10,17726329,,30,0,0,False,House,House,Ray White Mernda,33841,Rental Department Mernda,"Internal Laundry, Secure Parking, Heating",https://www.domain.com.au/10-witchazel-drive-south-morang-vic-3752-17726329
17736833,SOUTH MORANG,3752,600,2607,"Wednesday, 03 September 2025",2025-08-28,12,4,2,2,House,286 The Lakes Boulevard,-37.63068,145.08464,2025-09-09 16:31:10,17736833,,9,1,1,False,House,House,Barry Plant North Eastern Group,4902,"Peter Mac, Matthew Clark","Secure Parking, Broadband internet access, Heating",https://www.domain.com.au/286-the-lakes-boulevard-south-morang-vic-3752-17736833
17740558,SOUTH MORANG,3752,520,2260,"Monday, 15 September 2025",2025-09-01,8,3,1,1,House,23 Axa Way,-37.632153,145.06996,2025-09-09 16:31:10,17740558,,10,1,1,False,House,House,Barry Plant North Eastern Group,4902,"Jarrod Pearce, Matthew Clark","Broadband internet access, Heating, Shed",https://www.domain.com.au/23-axa-way-south-morang-vic-3752-17740558
