listing_id,suburb,postcode,weekly_rent,bond,available_date,date_listed,days_listed,bedrooms,bathrooms,carspaces,property_type,address,lat,lon,scraped_date,domain_page_id,property_id,photo_count,video_count,floorplans_count,virtual_tour,primary_type,secondary_type,agency,agency_id,agent_names,structured_features,url
14847028,WENDOUREE,3355,380,1646,"Friday, 29 August 2025",2025-08-25,15,3,1,3.0,House,389 Forest Street,-37.526215,143.8336,2025-09-09 16:22:30,14847028,MS-7694-FO,14,0,1,True,House,House,PRDnationwide Ballarat,5808,"Alister Hosking, Ange Simpson","Air conditioning, Built in wardrobes, Internal Laundry, Pets Allowed, Bath, Heating, Study, Secure Parking, Shed, Fully fenced, Garden / Courtyard",https://www.domain.com.au/389-forest-street-wendouree-vic-3355-14847028
17113127,WENDOUREE,3355,415,1803,"Friday, 19 September 2025",2025-08-21,19,3,1,2.0,House,1112 Grevillea Road,-37.52741,143.83186,2025-09-09 16:22:30,17113127,XA-1799-XR,11,0,0,False,House,House,Ray White Ballarat,11641,"Bernie Dickson, Caine Hunter","Built in wardrobes, Shed, Central Heating, Split System",https://www.domain.com.au/1112-grevillea-road-wendouree-vic-3355-17113127
17250681,WENDOUREE,3355,420,1825,"Wednesday, 08 October 2025",2025-09-04,5,3,1,2.0,House,8 Linden Avenue,-37.539524,143.84215,2025-09-09 16:22:30,17250681,QU-5155-YD,7,0,1,False,House,House,Ray White Ballarat,11641,"Bernie Dickson, Brylee Chaffey","Built in wardrobes, Internal Laundry, Heating, Shed, Balcony / Deck",https://www.domain.com.au/8-linden-avenue-wendouree-vic-3355-17250681
17555743,WENDOUREE,3355,450,1950,"Sunday, 01 June 2025",2025-05-02,129,3,1,2.0,House,20 Carpenter Street,-37.52347,143.83365,2025-09-09 16:22:30,17555743,ZW-9750-VA,3,0,0,False,House,House,Raine & Horne Blackburn,29609,Patrick Mane,"Internal Laundry, Pets Allowed, Heating",https://www.domain.com.au/20-carpenter-street-wendouree-vic-3355-17555743
17724349,WENDOUREE,3355,380,1651,"Friday, 29 August 2025",2025-08-20,20,3,1,1.0,House,39 Hawthorn Grove,-37.535,143.8409,2025-09-09 16:22:30,17724349,,9,0,0,False,House,House,Ballarat Real Estate,13411,Joshua Dean,"Air conditioning, Heating, Built in wardrobes, Pets Allowed, Floorboards, Fully fenced",https://www.domain.com.au/39-hawthorn-grove-wendouree-vic-3355-17724349
17724408,WENDOUREE,3355,300,1200,"Wednesday, 20 August 2025",2025-08-20,20,1,1,1.0,Apartment / Unit / Flat,5/302 FOREST STREET,-37.533127,143.83313,2025-09-09 16:22:30,17724408,,7,0,1,False,Apartment,Apartment / Unit / Flat,Bartrop Real Estate,13303,Bartrop Real Estate,"Shed, Built in wardrobes, Split-System Air Conditioning",https://www.domain.com.au/5-302-forest-street-wendouree-vic-3355-17724408
17725516,WENDOUREE,3355,400,1738,"Wednesday, 27 August 2025",2025-08-21,19,3,1,3.0,House,101 Marigold St,-37.524193,143.82256,2025-09-09 16:22:30,17725516,,7,0,0,False,House,House,Trevor Petrie Real Estate,14353,Annie-Jo Ross,"Bath, Heating, Built in wardrobes, Out door entertaining area",https://www.domain.com.au/101-marigold-st-wendouree-vic-3355-17725516
17725942,WENDOUREE,3355,350,1521,"Sunday, 24 August 2025",2025-08-21,19,3,1,1.0,House,1266 Grevillea Road,-37.527424,143.81718,2025-09-09 16:22:30,17725942,,11,0,0,False,House,House,McGrath Ballarat,32266,Taneya Burke,"Internal Laundry, Pets Allowed, Bath, Heating, Shed",https://www.domain.com.au/1266-grevillea-road-wendouree-vic-3355-17725942
17726253,WENDOUREE,3355,470,2042,"Thursday, 25 September 2025",2025-08-21,19,3,2,1.0,Townhouse,14 Langstaffe Dr,-37.52078,143.8329,2025-09-09 16:22:30,17726253,,9,0,0,False,Townhouse/Villa,Townhouse,Trevor Petrie Real Estate,14353,Kayla Bown,"Secure Parking, Ensuite, Air conditioning, Garden / Courtyard, Built in wardrobes, Dishwasher",https://www.domain.com.au/14-langstaffe-dr-wendouree-vic-3355-17726253
17727548,WENDOUREE,3355,280,1213,"Friday, 29 August 2025",2025-08-22,18,1,1,1.0,Apartment / Unit / Flat,2/58 Park Street,-37.533787,143.82639,2025-09-09 16:22:30,17727548,,8,0,0,True,Apartment,Apartment / Unit / Flat,PRDnationwide Ballarat,5808,"Juanita Murray, Annabel Bennett","Built in wardrobes, Internal Laundry, Pets Allowed, Bath, Heating, Secure Parking, Shed, Garden / Courtyard",https://www.domain.com.au/2-58-park-street-wendouree-vic-3355-17727548
17729371,WENDOUREE,3355,410,1781,"Friday, 29 August 2025",2025-08-25,15,3,1,1.0,House,3 Stamford St,-37.529594,143.83145,2025-09-09 16:22:30,17729371,,11,0,0,False,House,House,Fletchers Ballarat,16913,Katrina Weidemann,"Internal Laundry, Secure Parking, Heating, Dishwasher",https://www.domain.com.au/3-stamford-st-wendouree-vic-3355-17729371
17729485,WENDOUREE,3355,400,1738,"Friday, 29 August 2025",2025-08-25,15,2,1,1.0,Townhouse,2/12 Yvonne Street,-37.523884,143.8392,2025-09-09 16:22:30,17729485,,25,0,0,False,Townhouse/Villa,Townhouse,Ray White Ballarat,11641,Lauren Hodgson,"Built in wardrobes, Internal Laundry, Secure Parking, Bath, Heating, Dishwasher",https://www.domain.com.au/2-12-yvonne-street-wendouree-vic-3355-17729485
17730062,WENDOUREE,3355,310,1347,"Friday, 26 September 2025",2025-08-25,15,2,1,1.0,Apartment / Unit / Flat,1/41 McNulty Drive,-37.52659,143.81326,2025-09-09 16:22:30,17730062,,8,0,0,False,Apartment,Apartment / Unit / Flat,Ray White Ballarat,11641,"Bernie Dickson, Caine Hunter",Built in wardrobes,https://www.domain.com.au/1-41-mcnulty-drive-wendouree-vic-3355-17730062
17735793,WENDOUREE,3355,460,1993,"Friday, 05 September 2025",2025-08-28,12,3,1,4.0,House,11 Freeman St,-37.53558,143.83675,2025-09-09 16:22:30,17735793,,1,0,1,False,House,House,Barry Plant Ballarat,23715,Casey Henderson,"Pets Allowed, Bath, Air conditioning, Secure Parking, Balcony / Deck, Garden / Courtyard, Shed, Fully fenced, Built in wardrobes, Dishwasher, Floorboards, Gas Heating, Out door entertaining area, Internal Laundry",https://www.domain.com.au/11-freeman-st-wendouree-vic-3355-17735793
17739018,WENDOUREE,3355,390,1694,"Friday, 05 September 2025",2025-08-29,10,3,1,2.0,House,42 Marigold Street,-37.52935,143.8231,2025-09-09 16:22:30,17739018,,12,0,1,False,House,House,Ballarat Real Estate,13411,"David Carton, Henry Geljon","Air conditioning, Built in wardrobes, Internal Laundry, Heating, Shed, Balcony / Deck",https://www.domain.com.au/42-marigold-street-wendouree-vic-3355-17739018
17740045,WENDOUREE,3355,430,1868,"Wednesday, 01 October 2025",2025-09-01,8,3,1,2.0,House,14 Hamlet Street,-37.532345,143.83354,2025-09-09 16:22:30,17740045,,6,0,0,False,House,House,Ballarat Real Estate,13411,"Leah Dickson, Bailey Wilson","Bath, Balcony / Deck, Heating, Built in wardrobes",https://www.domain.com.au/14-hamlet-street-wendouree-vic-3355-17740045
17741600,WENDOUREE,3355,420,1825,"Monday, 29 September 2025",2025-09-01,8,3,1,1.0,House,29 Pauls Cres,-37.532135,143.83986,2025-09-09 16:22:30,17741600,,10,0,0,False,House,House,Fletchers Ballarat,16913,Rebecca Duncan,"Secure Parking, Bath, Dishwasher",https://www.domain.com.au/29-pauls-cres-wendouree-vic-3355-17741600
17744786,WENDOUREE,3355,420,1820,"Friday, 12 September 2025",2025-09-03,6,3,1,2.0,House,18 Fisher Street,-37.53876,143.83801,2025-09-09 16:22:30,17744786,,14,0,0,True,House,House,PRDnationwide Ballarat,5808,"Jenna Tomada, Shari Plater","Floorboards, Built in wardrobes, Internal Laundry, Pets Allowed, Bath, Dishwasher, Fully fenced",https://www.domain.com.au/18-fisher-street-wendouree-vic-3355-17744786
17747727,WENDOUREE,3355,410,1690,"Friday, 12 September 2025",2025-09-04,5,3,2,1.0,House,17 Mathilda Street,-37.5298,143.8295,2025-09-09 16:22:30,17747727,,6,0,0,False,House,House,Jellis Craig Ballarat,6936,"Bella Dart, Kaeli O'Brien","Built in wardrobes, Internal Laundry, Secure Parking, Bath, Heating, Fully fenced, Air conditioning, Gas, Shed",https://www.domain.com.au/17-mathilda-street-wendouree-vic-3355-17747727
17748952,WENDOUREE,3355,350,1520,"Friday, 14 November 2025",2025-09-05,4,2,1,1.0,Apartment / Unit / Flat,3/410 Gillies Street,-37.531193,143.8242,2025-09-09 16:22:30,17748952,,13,0,0,False,Apartment,Apartment / Unit / Flat,Ray White Ballarat,11641,"Bernie Dickson, Tianna Vella","Built in wardrobes, Dishwasher",https://www.domain.com.au/3-410-gillies-street-wendouree-vic-3355-17748952
15327970,WENDOUREE,3355,385,1673,"Tuesday, 12 August 2025",2025-07-16,54,3,1,1.0,House,28 Lake Street,-37.536674,143.82727,2025-09-09 16:22:34,15327970,PD-9517-JV,6,0,0,False,House,House,Ray White Ballarat,11641,"Bernie Dickson, Chandra Budiman","Built in wardrobes, Gas, Secure Parking, Heating",https://www.domain.com.au/28-lake-street-wendouree-vic-3355-15327970
16540922,WENDOUREE,3355,380,1650,"Wednesday, 23 July 2025",2025-06-20,81,3,1,1.0,House,1004 Grevillea Road,-37.528286,143.83917,2025-09-09 16:22:34,16540922,XH-5211-RX,7,0,0,False,House,House,Ray White Ballarat,11641,"Bernie Dickson, Caine Hunter","Built in wardrobes, Heating, Dishwasher",https://www.domain.com.au/1004-grevillea-road-wendouree-vic-3355-16540922
16954385,WENDOUREE,3355,390,1694,"Thursday, 19 June 2025",2025-05-19,113,3,1,3.0,House,3 Marigold Street,-37.53226,143.8178,2025-09-09 16:22:34,16954385,QR-5035-WK,7,0,0,False,House,House,Ray White Ballarat,11641,"Bernie Dickson, Caine Hunter",Air conditioning,https://www.domain.com.au/3-marigold-street-wendouree-vic-3355-16954385
17151176,WENDOUREE,3355,250,1300,"Saturday, 10 August 2024",2025-01-20,232,1,1,,Studio,1/30 Browns Parade,-37.53712,143.8382,2025-09-09 16:22:34,17151176,,12,0,0,False,Apartment,Studio,Buxton (Ballarat) Pty Ltd,26896,"Buxton Ballarat Leasing, Sophie Moore",Internal Laundry,https://www.domain.com.au/1-30-browns-parade-wendouree-vic-3355-17151176
17583367,WENDOUREE,3355,350,1520,"Friday, 20 June 2025",2025-07-21,50,3,1,2.0,House,20 Violet Grove,-37.528793,143.82115,2025-09-09 16:22:34,17583367,BH-7238-DH,6,0,0,False,House,House,Ballarat Real Estate,13411,"David Newcombe, Mikayla Watt","Bath, Air conditioning, Heating, Pets Allowed",https://www.domain.com.au/20-violet-grove-wendouree-vic-3355-17583367
17638129,WENDOUREE,3355,400,1738,"Tuesday, 05 August 2025",2025-06-25,76,4,1,2.0,House,5 Hawthorn Grove,-37.537033,143.83876,2025-09-09 16:22:34,17638129,,5,0,0,False,House,House,Ray White Ballarat,11641,"Bernie Dickson, Chandra Budiman",,https://www.domain.com.au/5-hawthorn-grove-wendouree-vic-3355-17638129
17655367,WENDOUREE,3355,420,1825,"Friday, 25 July 2025",2025-07-07,64,3,1,2.0,House,11 Halbert St,-37.522102,143.82936,2025-09-09 16:22:34,17655367,,13,0,0,False,House,House,Trevor Petrie Real Estate,14353,Kayla Bown,"Internal Laundry, Secure Parking, Bath, Air conditioning, Built in wardrobes, Gas Heating, Out door entertaining area",https://www.domain.com.au/11-halbert-st-wendouree-vic-3355-17655367
17666659,WENDOUREE,3355,375,1625,"Friday, 15 August 2025",2025-07-14,57,3,1,1.0,House,21 Wattle Avenue,-37.531395,143.81845,2025-09-09 16:22:34,17666659,,11,0,0,False,House,House,Buxton (Ballarat) Pty Ltd,26896,Buxton Ballarat Leasing,"Internal Laundry, Bath, Heating, Dishwasher",https://www.domain.com.au/21-wattle-avenue-wendouree-vic-3355-17666659
17695349,WENDOUREE,3355,350,1520,"Thursday, 31 July 2025",2025-07-31,39,3,1,2.0,House,14 Cypress Avenue,-37.52454,143.81519,2025-09-09 16:22:34,17695349,,7,0,0,False,House,House,Ballarat Real Estate,13411,"Cooper Reid, Bailey Wilson","Internal Laundry, Bath, Shed, Heating, Built in wardrobes, Pets Allowed, Fully fenced",https://www.domain.com.au/14-cypress-avenue-wendouree-vic-3355-17695349
17699074,WENDOUREE,3355,350,1520,"Friday, 19 September 2025",2025-08-04,36,3,1,1.0,House,4 Carpenter Street,-37.524666,143.83344,2025-09-09 16:22:34,17699074,,11,0,0,False,House,House,Ray White Ballarat,11641,"Bernie Dickson, Brylee Chaffey","Built in wardrobes, Bath, Heating",https://www.domain.com.au/4-carpenter-street-wendouree-vic-3355-17699074
17701507,WENDOUREE,3355,405,1759,"Wednesday, 27 August 2025",2025-08-05,35,3,1,1.0,House,12 Ercil Street,-37.53154,143.83522,2025-09-09 16:22:34,17701507,,11,0,1,False,House,House,Fletchers Ballarat,16913,Carmen Moors,"Bath, Air conditioning, Secure Parking, Shed, Fully fenced, Built in wardrobes, Dishwasher, Gas Heating, Internal Laundry",https://www.domain.com.au/12-ercil-street-wendouree-vic-3355-17701507
17709319,WENDOUREE,3355,425,1846,"Monday, 11 August 2025",2025-08-11,29,3,1,1.0,House,23 Clover Street,-37.52998,143.81578,2025-09-09 16:22:34,17709319,,11,0,0,False,House,House,Ray White Ballarat,11641,"Bernie Dickson, Tianna Vella","Internal Laundry, Secure Parking, Bath",https://www.domain.com.au/23-clover-street-wendouree-vic-3355-17709319
17717391,WENDOUREE,3355,410,1781,"Monday, 15 September 2025",2025-08-15,25,3,1,2.0,House,23 Fisher Street,-37.539104,143.83737,2025-09-09 16:22:34,17717391,,12,1,1,False,House,House,Ballarat Real Estate,13411,"David Carton, Henry Geljon","Internal Laundry, Bath, Dishwasher, Heating, Built in wardrobes",https://www.domain.com.au/23-fisher-street-wendouree-vic-3355-17717391
17720925,WENDOUREE,3355,370,1607,"Wednesday, 20 August 2025",2025-08-18,21,3,1,2.0,House,1116 Norman Street,-37.532784,143.83058,2025-09-09 16:22:34,17720925,,15,0,1,False,House,House,Ballarat Real Estate,13411,"Reynaldo Rilen, Jake Attwell, Bailey Wilson","Secure Parking, Heating, Built in wardrobes, Pets Allowed, Fully fenced",https://www.domain.com.au/1116-norman-street-wendouree-vic-3355-17720925
17722537,WENDOUREE,3355,420,1820,"Friday, 29 August 2025",2025-08-19,21,3,1,4.0,House,28 Harold Street,-37.529907,143.83244,2025-09-09 16:22:34,17722537,,10,0,0,False,House,House,Buxton (Ballarat) Pty Ltd,26896,"Buxton Ballarat Leasing, Charlotte King","Built in wardrobes, Secure Parking, Dishwasher",https://www.domain.com.au/28-harold-street-wendouree-vic-3355-17722537
