listing_id,suburb,postcode,weekly_rent,bond,available_date,date_listed,days_listed,bedrooms,bathrooms,carspaces,property_type,address,lat,lon,scraped_date,domain_page_id,property_id,photo_count,video_count,floorplans_count,virtual_tour,primary_type,secondary_type,agency,agency_id,agent_names,structured_features,url
15990983,WERRIBEE,3030,500.0,2173.0,"Friday, 05 September 2025",2025-08-27,12,3,1,1.0,House,63 Loyola Road,-37.911068,144.67418,2025-09-09 16:28:58,15990983,HH-3088-GC,10,0,0,False,House,House,LongView Real Estate,7797,Sarah Boccari,"Gas, Bath, Built in wardrobes, Split System Air Conditioning",https://www.domain.com.au/63-loyola-road-werribee-vic-3030-15990983
16180362,WERRIBEE,3030,480.0,2086.0,"Monday, 13 October 2025",2025-09-08,1,3,1,5.0,House,27 Wyndham Street,-37.893524,144.66144,2025-09-09 16:28:58,16180362,MD-2164-FN,18,0,0,False,House,House,Ray White Werribee,29214,"Maya Hunak, Marc Tanti",,https://www.domain.com.au/27-wyndham-street-werribee-vic-3030-16180362
17204922,WERRIBEE,3030,450.0,1955.0,"Wednesday, 01 October 2025",2025-09-08,0,3,2,2.0,Townhouse,46 Cressy Street,-37.905697,144.59698,2025-09-09 16:28:58,17204922,AP-7464-VJ,10,0,0,False,Townhouse/Villa,Townhouse,Banksia Property Agency,35065,"Thao Vu, Deepali Bharadwaj","Internal Laundry, Floorboards, Built in wardrobes, Dishwasher, Bathtub, Gas Appliances, Ducted Heating, Split System Air Conditioning, Gas Hot Water, Outdoor Entertainment Area, Remote Garage, Secure Parking, Fully fenced",https://www.domain.com.au/46-cressy-street-werribee-vic-3030-17204922
17458612,WERRIBEE,3030,430.0,1868.0,"Friday, 01 August 2025",2025-07-16,55,3,2,1.0,House,1 Kalamundra Drive,-37.906994,144.59329,2025-09-09 16:28:58,17458612,AB-3180-FG,9,0,0,False,House,House,The Roof Real Estate,36733,Rita Sehgal,"Secure Parking, Heating, Dishwasher",https://www.domain.com.au/1-kalamundra-drive-werribee-vic-3030-17458612
17602265,WERRIBEE,3030,465.0,2015.0,"Friday, 18 July 2025",2025-06-03,98,3,2,2.0,House,42 Taworri Crescent,-37.901794,144.61266,2025-09-09 16:28:58,17602265,,8,0,1,False,House,House,Ray White West Realty,28524,"Enza Rossitto, Chantae Jones","Secure Parking, Heating, Balcony / Deck",https://www.domain.com.au/42-taworri-crescent-werribee-vic-3030-17602265
17643690,WERRIBEE,3030,530.0,2303.0,"Saturday, 06 September 2025",2025-06-29,71,4,2,2.0,House,20 Taggerty Street,-37.91636,144.64345,2025-09-09 16:28:58,17643690,,7,0,0,False,House,House,Ausky Group,20742,"Vivi Liana, Rental Department",,https://www.domain.com.au/20-taggerty-street-werribee-vic-3030-17643690
17697250,WERRIBEE,3030,495.0,,"Friday, 01 August 2025",2025-08-01,38,4,2,2.0,House,10 Levittown Rise,-37.917362,144.60695,2025-09-09 16:28:58,17697250,,11,0,0,False,House,House,Investate International,33705,"Novine Zhang, Investate International","Secure Parking, Air conditioning, Built in wardrobes, Close to transport, Close to shops, Alarm System, Close to schools, Ensuite, Carpeted, Exhaust, Courtyard, Dishwasher, Floorboards",https://www.domain.com.au/10-levittown-rise-werribee-vic-3030-17697250
17704647,WERRIBEE,3030,550.0,2390.0,"Thursday, 21 August 2025",2025-08-07,33,4,2,1.0,House,89A Chirnside Avenue,-37.912434,144.67125,2025-09-09 16:28:58,17704647,,12,0,0,False,House,House,Ray White Werribee,29214,"Maya Hunak, Marc Tanti","Heating, Dishwasher",https://www.domain.com.au/89a-chirnside-avenue-werribee-vic-3030-17704647
17712527,WERRIBEE,3030,450.0,1955.0,"Tuesday, 12 August 2025",2025-08-12,27,3,1,4.0,House,29 Illawong Grove,-37.901638,144.63596,2025-09-09 16:28:58,17712527,,14,0,0,False,House,House,Ray White Truganina,29324,"Akash Sharma, Palak Joshi","Secure Parking, Heating",https://www.domain.com.au/29-illawong-grove-werribee-vic-3030-17712527
17713279,WERRIBEE,3030,430.0,1868.0,"Friday, 05 September 2025",2025-08-13,27,3,2,1.0,House,1/88 Conquest Drive,-37.892887,144.66263,2025-09-09 16:28:58,17713279,,8,1,0,False,House,House,Ray White Werribee,29214,"Maya Hunak, Marc Tanti",Secure Parking,https://www.domain.com.au/1-88-conquest-drive-werribee-vic-3030-17713279
17714420,WERRIBEE,3030,450.0,1955.0,"Wednesday, 13 August 2025",2025-08-13,26,3,1,2.0,House,20 Julian Street,-37.891487,144.6556,2025-09-09 16:28:58,17714420,,8,0,0,False,House,House,Create Real Estate,13833,Create Rentals,"Heating, Garden / Courtyard",https://www.domain.com.au/20-julian-street-werribee-vic-3030-17714420
17739951,WERRIBEE,3030,505.0,2194.0,"Monday, 13 October 2025",2025-09-01,8,4,2,2.0,House,18 Hiskey Crescent,-37.908833,144.60164,2025-09-09 16:28:58,17739951,,9,0,0,False,House,House,YPA Estate Agents Wyndham City,17920,"Amy McMaster, Taylah Ford","Secure Parking, Heating",https://www.domain.com.au/18-hiskey-crescent-werribee-vic-3030-17739951
17749173,WERRIBEE,3030,480.0,2086.0,"Friday, 12 September 2025",2025-09-05,4,3,1,2.0,House,10 Albatross avenue,-37.88993,144.66826,2025-09-09 16:28:58,17749173,,9,0,0,False,House,House,Agents'Agency Network Partners,11919,Pracilla Lal,"Air conditioning, Pets Allowed, Floorboards, Alarm System, Built in wardrobes, Internal Laundry, Bath, Heating, Secure Parking, Fully fenced, Garden / Courtyard, Solar panels",https://www.domain.com.au/10-albatross-avenue-werribee-vic-3030-17749173
17749803,WERRIBEE,3030,395.0,1716.0,"Tuesday, 09 September 2025",2025-09-05,4,2,1,1.0,Townhouse,1/5 Sanderling Street,-37.89062,144.67197,2025-09-09 16:28:58,17749803,,12,0,0,False,Townhouse/Villa,Townhouse,Barry Plant Werribee,4693,"Sharyn Reid, Donald McKillop","Heating, Balcony / Deck, Air conditioning, Built in wardrobes, Close to transport, Close to shops, Close to schools",https://www.domain.com.au/1-5-sanderling-street-werribee-vic-3030-17749803
17750256,WERRIBEE,3030,580.0,2520.0,"Wednesday, 03 September 2025",2025-09-06,3,4,2,2.0,House,19 Forestmill Chase,-37.916473,144.60577,2025-09-09 16:28:58,17750256,,18,0,0,False,House,House,Reliance Werribee,35358,"Isha Monga, Vipul Gaba","Secure Parking, Bath, Built in wardrobes, Close to transport, Close to shops, Close to schools, Evaporative Cooling, Ducted Heating",https://www.domain.com.au/19-forestmill-chase-werribee-vic-3030-17750256
17750897,WERRIBEE,3030,440.0,1912.0,"Tuesday, 30 September 2025",2025-09-08,1,3,1,1.0,House,4 Trent Close,-37.87958,144.66273,2025-09-09 16:28:58,17750897,,19,0,0,False,House,House,hockingstuart Wyndham City,16107,"Brittany McCormack, Jessica Tong","Internal Laundry, Heating",https://www.domain.com.au/4-trent-close-werribee-vic-3030-17750897
17751641,WERRIBEE,3030,430.0,1868.0,"Monday, 22 September 2025",2025-09-08,1,3,1,1.0,House,56 Market Road,-37.895042,144.65765,2025-09-09 16:28:58,17751641,,9,0,0,False,House,House,YPA Estate Agents Wyndham City,17920,Victoria Peart,Heating,https://www.domain.com.au/56-market-road-werribee-vic-3030-17751641
17752355,WERRIBEE,3030,470.0,2043.0,"Friday, 26 September 2025",2025-09-08,0,3,2,2.0,House,66 Wagner Drive,-37.916824,144.63225,2025-09-09 16:28:58,17752355,,1,0,0,False,House,House,Reliance Real Estate Point Cook,26805,"Zelda Van Rensburg, Leena Papakalodoukas, Yash Shaw","Internal Laundry, Secure Parking, Heating, Dishwasher",https://www.domain.com.au/66-wagner-drive-werribee-vic-3030-17752355
17753127,WERRIBEE,3030,400.0,1738.0,"Tuesday, 16 September 2025",2025-09-09,0,3,1,1.0,House,10 Julian Street,-37.89093,144.65512,2025-09-09 16:28:58,17753127,,7,0,1,False,House,House,.established Property,4979,Established Property Leasing,"Internal Laundry, Heating, Shed",https://www.domain.com.au/10-julian-street-werribee-vic-3030-17753127
17753411,WERRIBEE,3030,450.0,1955.0,"Monday, 15 September 2025",2025-09-09,0,3,1,,Apartment / Unit / Flat,1/32 Tamarind Crescent,-37.888092,144.66641,2025-09-09 16:28:58,17753411,,9,0,0,False,Apartment,Apartment / Unit / Flat,Equity Estate Agents,37028,Cathy Boccia,"Dishwasher, Air-Conditioner, Ducted Heating",https://www.domain.com.au/1-32-tamarind-crescent-werribee-vic-3030-17753411
15668607,WERRIBEE,3030,500.0,2173.0,"Thursday, 18 September 2025",2025-08-18,22,4,2,2.0,House,36 Grandvista Boulevard,-37.900745,144.59677,2025-09-09 16:29:03,15668607,WP-8960-VS,9,0,0,False,House,House,Ray White Werribee,29214,"Maya Hunak, Marc Tanti","Air conditioning, Built in wardrobes, Separate Dining Room, Secure Parking",https://www.domain.com.au/36-grandvista-boulevard-werribee-vic-3030-15668607
16314964,WERRIBEE,3030,430.0,1868.0,"Monday, 07 July 2025",2025-06-23,78,3,2,2.0,House,4 Midland Grove,-37.911827,144.60144,2025-09-09 16:29:03,16314964,MY-0368-IL,12,0,0,False,House,House,Harcourts Point Cook,20054,Solene Para,"Secure Parking, Heating, Dishwasher",https://www.domain.com.au/4-midland-grove-werribee-vic-3030-16314964
16513204,WERRIBEE,3030,480.0,2086.0,"Friday, 03 October 2025",2025-09-04,5,4,2,2.0,House,24 Daglish Way,-37.899918,144.60107,2025-09-09 16:29:03,16513204,GW-0220-ZJ,9,0,0,False,House,House,Ray White Werribee,29214,"Maya Hunak, Marc Tanti",,https://www.domain.com.au/24-daglish-way-werribee-vic-3030-16513204
16530510,WERRIBEE,3030,440.0,1912.0,"Friday, 03 October 2025",2025-08-28,12,3,1,2.0,House,32 Karinya Close,-37.874336,144.6625,2025-09-09 16:29:03,16530510,BJ-3653-VO,6,0,0,False,House,House,Ray White Werribee,29214,"Maya Hunak, Marc Tanti",,https://www.domain.com.au/32-karinya-close-werribee-vic-3030-16530510
16955706,WERRIBEE,3030,420.0,1825.0,"Wednesday, 10 September 2025",2025-09-04,5,2,1,1.0,House,161 Shaws Road,-37.88964,144.66055,2025-09-09 16:29:03,16955706,RI-2361-IK,10,0,0,False,House,House,Ray White Werribee,29214,"Maya Hunak, Marc Tanti",,https://www.domain.com.au/161-shaws-road-werribee-vic-3030-16955706
17678069,WERRIBEE,3030,420.0,1825.0,"Wednesday, 13 August 2025",2025-07-21,50,4,1,2.0,House,4 Ganges Court,-37.87694,144.66061,2025-09-09 16:29:03,17678069,,14,0,1,False,House,House,Ray White Point Cook,29063,"Palak Grover, Makayla Hurinui","Pets Allowed, Study, Ensuite",https://www.domain.com.au/4-ganges-court-werribee-vic-3030-17678069
17704888,WERRIBEE,3030,460.0,1993.0,"Tuesday, 12 August 2025",2025-08-07,33,3,2,2.0,House,7 Roscrea Court,-37.89609,144.64687,2025-09-09 16:29:03,17704888,,21,0,0,False,House,House,Compton Green Geelong,21762,Sarah Milner,"Air conditioning, Ensuite, Built in wardrobes, Internal Laundry, Pets Allowed, Bath, Heating, Dishwasher, Secure Parking, Fully fenced, Garden / Courtyard",https://www.domain.com.au/7-roscrea-court-werribee-vic-3030-17704888
17717165,WERRIBEE,3030,460.0,,"Saturday, 30 August 2025",2025-08-15,25,4,2,2.0,House,47 Fisher Court,-37.881744,144.67303,2025-09-09 16:29:03,17717165,,7,0,0,False,House,House,Barry Plant Yarraville,37282,"Alice Mosut, Sorelle Webster","Heating, Pets Allowed",https://www.domain.com.au/47-fisher-court-werribee-vic-3030-17717165
17730137,WERRIBEE,3030,450.0,1955.0,"Friday, 05 September 2025",2025-09-05,4,3,1,4.0,House,56 Tamarind Crescent,-37.886208,144.66687,2025-09-09 16:29:03,17730137,,11,1,1,False,House,House,hockingstuart Wyndham City,16107,"Jessica Tong, Samantha Holt","Air conditioning, Secure Parking, Shed",https://www.domain.com.au/56-tamarind-crescent-werribee-vic-3030-17730137
17735065,WERRIBEE,3030,450.0,1955.0,"Monday, 08 September 2025",2025-08-27,13,3,2,2.0,House,9 Haniper Grove,-37.909397,144.60359,2025-09-09 16:29:03,17735065,,13,0,0,False,House,House,Agents'Agency Network Partners,11919,Pracilla Lal,"Pets Allowed, Ensuite, Floorboards, Built in wardrobes, Internal Laundry, Bath, Heating, Dishwasher, Secure Parking, Fully fenced, Energy efficient appliances, Solar hot water",https://www.domain.com.au/9-haniper-grove-werribee-vic-3030-17735065
17738295,WERRIBEE,3030,500.0,2173.0,"Friday, 19 September 2025",2025-08-29,11,4,2,2.0,House,3 Wedgebill Circuit,-37.909607,144.60547,2025-09-09 16:29:03,17738295,,6,0,0,False,House,House,Ray White Werribee,29214,"Maya Hunak, Marc Tanti","Secure Parking, Heating, Dishwasher, Air conditioning, Alarm System, Built in wardrobes, Balcony / Deck",https://www.domain.com.au/3-wedgebill-circuit-werribee-vic-3030-17738295
17746593,WERRIBEE,3030,450.0,1955.0,"Monday, 08 September 2025",2025-09-04,5,4,1,1.0,House,14 Wimmera Court,-37.88449,144.65596,2025-09-09 16:29:03,17746593,,10,0,0,False,House,House,Ray White Werribee,29214,"Marc Tanti, Maya Hunak","Built in wardrobes, Heating",https://www.domain.com.au/14-wimmera-court-werribee-vic-3030-17746593
17747437,WERRIBEE,3030,470.0,2042.0,"Monday, 22 September 2025",2025-09-04,5,3,2,2.0,House,17 Haniper Grove,-37.90947,144.60419,2025-09-09 16:29:03,17747437,,8,0,0,False,House,House,First National Westwood ,6441,"Sharni carlton, Shenay Caglar","Dishwasher, Built in wardrobes, Floorboards, Fireplace(s), Air-Conditioner, Ducted Heating, Split System Heating, Remote Garage, Secure Parking, Deck",https://www.domain.com.au/17-haniper-grove-werribee-vic-3030-17747437
17747590,WERRIBEE,3030,460.0,1999.0,"Friday, 10 October 2025",2025-09-04,5,3,2,2.0,House,18 Grampians Avenue,-37.912426,144.64693,2025-09-09 16:29:03,17747590,,13,0,0,False,House,House,Reliance Werribee,35358,"Isha Monga, Vipul Gaba","Internal Laundry, Furnished, Dishwasher, Heating, Built in wardrobes, Close to transport, Close to schools, Ensuite, Garage Space, Evaporative Cooling, Ducted Heating",https://www.domain.com.au/18-grampians-avenue-werribee-vic-3030-17747590
17748696,WERRIBEE,3030,520.0,2260.0,"Friday, 05 September 2025",2025-09-05,4,4,2,2.0,House,23 Hatter Street,-37.919914,144.62737,2025-09-09 16:29:03,17748696,,11,0,0,False,House,House,Reliance Werribee,35358,"Isha Monga, Vipul Gaba","Secure Parking, Heating, Study",https://www.domain.com.au/23-hatter-street-werribee-vic-3030-17748696
17748859,WERRIBEE,3030,450.0,1955.0,"Friday, 05 September 2025",2025-09-05,4,3,2,2.0,Apartment / Unit / Flat,2/29 Cassowary Avenue,-37.879612,144.66684,2025-09-09 16:29:03,17748859,,2,0,0,False,Apartment,Apartment / Unit / Flat,RAM International,35131,Hema Ramoo,"Internal Laundry, Fully fenced, Outdoor Entertainment Area, Remote Garage, Secure Parking, Shed, Broadband Internet Available, Built in wardrobes, Dishwasher, Floorboards, Ducted Heating, Evaporative Cooling, Energy Eff. Rating: 5",https://www.domain.com.au/2-29-cassowary-avenue-werribee-vic-3030-17748859
17748887,WERRIBEE,3030,440.0,1912.0,"Friday, 12 September 2025",2025-09-05,4,2,1,2.0,House,4 Moolong Court,-37.89872,144.6365,2025-09-09 16:29:03,17748887,,12,0,0,False,House,House,P Di Natale Real Estate,15264,Blake O'Neil,"Outdoor Entertainment Area, Built in wardrobes, Floorboards, Split-System Air Conditioning",https://www.domain.com.au/4-moolong-court-werribee-vic-3030-17748887
17749464,WERRIBEE,3030,430.0,1868.0,"Thursday, 25 September 2025",2025-09-05,4,3,1,2.0,House,3 Osprey Street,-37.886803,144.66838,2025-09-09 16:29:03,17749464,,11,0,0,False,House,House,YPA Estate Agents Wyndham City,17920,"Ashley Gates, Stefanie Zahra","Air conditioning, Built in wardrobes, Internal Laundry, Heating, Dishwasher",https://www.domain.com.au/3-osprey-street-werribee-vic-3030-17749464
17749531,WERRIBEE,3030,480.0,2085.0,"Friday, 05 September 2025",2025-09-05,4,4,2,2.0,House,36 Inglewood Drive,-37.901043,144.60068,2025-09-09 16:29:03,17749531,,10,0,0,False,House,House,Kathmandu Properties,32463,Kathmandu Properties Rental,"Fully fenced, Outdoor Entertainment Area, Remote Garage, Built in wardrobes, Dishwasher, Floorboards, Ducted Heating, Evaporative Cooling, Ensuite",https://www.domain.com.au/36-inglewood-drive-werribee-vic-3030-17749531
17749542,WERRIBEE,3030,400.0,1738.0,"Friday, 05 September 2025",2025-09-05,4,2,1,2.0,Apartment / Unit / Flat,3/13 Cambridge Crescent,-37.8974,144.63641,2025-09-09 16:29:03,17749542,,7,0,0,False,Apartment,Apartment / Unit / Flat,First National Westwood ,6441,Shenay Caglar,"Built in wardrobes, Air-Conditioner, Split System Heating",https://www.domain.com.au/3-13-cambridge-crescent-werribee-vic-3030-17749542
15641871,WERRIBEE,3030,480.0,2086.0,"Sunday, 07 September 2025",2025-08-21,19,3,2,2.0,Townhouse,1/10 Edwards Road,-37.90846,144.67787,2025-09-09 16:29:07,15641871,HT-5643-EH,13,0,1,False,Townhouse/Villa,Townhouse,Ray White Werribee,29214,"Marc Tanti, Maya Hunak","Air conditioning, Built in wardrobes, Secure Parking, Balcony / Deck",https://www.domain.com.au/1-10-edwards-road-werribee-vic-3030-15641871
15767284,WERRIBEE,3030,405.0,1760.0,"Friday, 04 March 2022",2025-07-31,40,3,1,1.0,House,6 Gannet Street,-37.887333,144.68022,2025-09-09 16:29:07,15767284,WY-2607-DV,8,0,0,False,House,House,Ray White Werribee,29214,"Maya Hunak, Marc Tanti",,https://www.domain.com.au/6-gannet-street-werribee-vic-3030-15767284
16404954,WERRIBEE,3030,420.0,1825.0,"Friday, 27 June 2025",2025-06-27,74,3,1,,House,76 Silvereye Crescent,-37.881138,144.67351,2025-09-09 16:29:07,16404954,KW-3504-BM,13,0,0,False,House,House,Ray White Werribee,29214,"Maya Hunak, Marc Tanti",,https://www.domain.com.au/76-silvereye-crescent-werribee-vic-3030-16404954
16575392,WERRIBEE,3030,400.0,1738.0,"Monday, 22 September 2025",2025-08-22,18,3,1,5.0,House,27 Pigeon Street,-37.887817,144.66705,2025-09-09 16:29:07,16575392,NR-3881-KW,14,0,1,False,House,House,Ray White Werribee,29214,"Maya Hunak, Marc Tanti",,https://www.domain.com.au/27-pigeon-street-werribee-vic-3030-16575392
16874581,WERRIBEE,3030,450.0,1955.0,"Friday, 29 August 2025",2025-08-05,35,2,1,2.0,House,40 Carter Avenue,-37.907566,144.66219,2025-09-09 16:29:07,16874581,JQ-3365-XC,16,0,0,False,House,House,"Sweeney Altona, Altona Meadows & Altona North",81,Sweeney Rentals,"Air conditioning, Gas, Floorboards, Built in wardrobes, Internal Laundry, Heating, Dishwasher, Secure Parking, Shed, Fully fenced, Garden / Courtyard",https://www.domain.com.au/40-carter-avenue-werribee-vic-3030-16874581
17118123,WERRIBEE,3030,430.0,1868.0,"Monday, 29 July 2024",2025-07-31,40,3,1,2.0,House,32 Tarneit Road,-37.894447,144.66307,2025-09-09 16:29:07,17118123,BS-7847-HQ,11,0,0,False,House,House,Ray White Werribee,29214,"Marc Tanti, Maya Hunak",,https://www.domain.com.au/32-tarneit-road-werribee-vic-3030-17118123
17334425,WERRIBEE,3030,425.0,1847.0,"Friday, 03 October 2025",2025-08-07,33,3,1,2.0,House,18 Kookaburra Avenue,-37.88983,144.67456,2025-09-09 16:29:07,17334425,FM-7409-JB,15,0,0,False,House,House,Ray White Werribee,29214,"Maya Hunak, Marc Tanti","Air conditioning, Built in wardrobes, Internal Laundry, Study",https://www.domain.com.au/18-kookaburra-avenue-werribee-vic-3030-17334425
17469655,WERRIBEE,3030,440.0,1912.0,"Monday, 15 September 2025",2025-08-26,13,3,2,2.0,House,15 Cygnet Avenue,-37.908054,144.60844,2025-09-09 16:29:07,17469655,ZQ-5891-XT,6,0,0,False,House,House,Ray White Werribee,29214,"Maya Hunak, Marc Tanti","Dishwasher, Air conditioning, Built in wardrobes, Secure Parking",https://www.domain.com.au/15-cygnet-avenue-werribee-vic-3030-17469655
17673113,WERRIBEE,3030,420.0,1825.0,"Wednesday, 16 July 2025",2025-07-17,54,3,2,,House,6 Sanderling Street,-37.890255,144.67236,2025-09-09 16:29:07,17673113,,10,0,0,False,House,House,Ray White Werribee,29214,"Marc Tanti, Maya Hunak",,https://www.domain.com.au/6-sanderling-street-werribee-vic-3030-17673113
17673828,WERRIBEE,3030,390.0,1695.0,"Friday, 08 August 2025",2025-07-17,54,3,1,2.0,House,12 Hooker Road,-37.895443,144.63895,2025-09-09 16:29:07,17673828,,17,0,1,False,House,House,Stockdale & Leggo Laverton / Altona / Point Cook,27481,SUNNY KUMAR,Heating,https://www.domain.com.au/12-hooker-road-werribee-vic-3030-17673828
17681100,WERRIBEE,3030,525.0,2275.0,"Saturday, 26 July 2025",2025-07-22,48,4,2,1.0,House,19 Xavier Court,-37.89573,144.64297,2025-09-09 16:29:07,17681100,,1,0,0,False,House,House,Raine & Horne Blackburn,29609,Patrick Mane,Built in wardrobes,https://www.domain.com.au/19-xavier-court-werribee-vic-3030-17681100
17694992,WERRIBEE,3030,480.0,2086.0,"Thursday, 11 September 2025",2025-07-31,40,4,2,2.0,House,4 Wirruna Street,-37.90249,144.61314,2025-09-09 16:29:07,17694992,,9,0,0,False,House,House,Ray White Werribee,29214,"Maya Hunak, Marc Tanti","Secure Parking, Air conditioning, Built in wardrobes, Heating, Dishwasher, Fully fenced, Garden / Courtyard",https://www.domain.com.au/4-wirruna-street-werribee-vic-3030-17694992
17700982,WERRIBEE,3030,400.0,1738.0,"Friday, 05 September 2025",2025-08-05,35,3,1,,House,134 Shaws Road,-37.88957,144.65605,2025-09-09 16:29:07,17700982,,5,0,0,False,House,House,Ray White Werribee,29214,"Marc Tanti, Maya Hunak",,https://www.domain.com.au/134-shaws-road-werribee-vic-3030-17700982
17706227,WERRIBEE,3030,470.0,2042.0,"Monday, 01 September 2025",2025-08-07,32,4,2,,House,15 Bankston Road,-37.90333,144.5959,2025-09-09 16:29:07,17706227,,14,0,0,False,House,House,YPA Point Cook,37940,"Milan Gahlyan, Happy Lather",Secure Parking,https://www.domain.com.au/15-bankston-road-werribee-vic-3030-17706227
17719544,WERRIBEE,3030,450.0,1955.0,"Monday, 15 September 2025",2025-08-18,22,3,2,2.0,House,12 Dawley Circuit,-37.912292,144.60303,2025-09-09 16:29:07,17719544,,7,0,0,False,House,House,Ray White Werribee,29214,"Maya Hunak, Marc Tanti","Secure Parking, Heating",https://www.domain.com.au/12-dawley-circuit-werribee-vic-3030-17719544
17719791,WERRIBEE,3030,520.0,2260.0,"Tuesday, 19 August 2025",2025-08-18,22,4,2,2.0,House,45 Prana Way,-37.923836,144.64241,2025-09-09 16:29:07,17719791,,13,0,0,False,House,House,THE ELEET Caroline Springs,35149,"Dee Sengupta, Team Leasing","Gas, Secure Parking, Heating, Dishwasher",https://www.domain.com.au/45-prana-way-werribee-vic-3030-17719791
17725210,WERRIBEE,3030,400.0,1738.0,"Wednesday, 20 August 2025",2025-08-21,19,3,1,1.0,House,39 Hooker Road,-37.89493,144.64107,2025-09-09 16:29:07,17725210,,8,0,0,False,House,House,Ray White Werribee,29214,"Marc Tanti, Maya Hunak","Built in wardrobes, Secure Parking, Dishwasher",https://www.domain.com.au/39-hooker-road-werribee-vic-3030-17725210
17731139,WERRIBEE,3030,550.0,2390.0,"Monday, 25 August 2025",2025-08-26,14,4,2,2.0,House,42 Wavertree Crescent,-37.911736,144.60785,2025-09-09 16:29:07,17731139,,15,0,0,False,House,House,Ray White Werribee,29214,"Marc Tanti, Maya Hunak",,https://www.domain.com.au/42-wavertree-crescent-werribee-vic-3030-17731139
17746995,WERRIBEE,3030,360.0,1564.0,"Saturday, 01 November 2025",2025-09-04,5,3,1,1.0,Apartment / Unit / Flat,7/20 Russell Street,-37.908726,144.66385,2025-09-09 16:29:07,17746995,,7,0,0,False,Apartment,Apartment / Unit / Flat,YPA Estate Agents Wyndham City,17920,"Amy McMaster, Taylah Ford","Built in wardrobes, Heating",https://www.domain.com.au/7-20-russell-street-werribee-vic-3030-17746995
17747098,WERRIBEE,3030,440.0,1912.0,"Thursday, 04 September 2025",2025-09-04,5,3,2,1.0,House,10 Harrier Street,-37.88798,144.67795,2025-09-09 16:29:07,17747098,,7,0,0,False,House,House,First National Westwood ,6441,Shenay Caglar,"Bath, Dishwasher, Built in wardrobes, Ducted Heating",https://www.domain.com.au/10-harrier-street-werribee-vic-3030-17747098
15130254,WERRIBEE,3030,390.0,,"Monday, 14 July 2025",2025-07-23,48,3,1,1.0,House,5/16 Centre Avenue,-37.894638,144.6547,2025-09-09 16:29:12,15130254,IE-8360-TJ,6,0,0,False,House,House,PSP PROPERTY GROUP,17904,"PSP Rentals, Charlotte Rose-Iljin","Built in wardrobes, Fully fenced, Air conditioning",https://www.domain.com.au/5-16-centre-avenue-werribee-vic-3030-15130254
15976277,WERRIBEE,3030,390.0,1695.0,"Thursday, 11 September 2025",2025-08-13,26,3,1,1.0,House,12 Wallara Road,-37.901276,144.63297,2025-09-09 16:29:12,15976277,ME-7099-UQ,11,0,0,False,House,House,ACE Real Estate,19089,"Riya Sharma, Ajitesh Arora",Heating,https://www.domain.com.au/12-wallara-road-werribee-vic-3030-15976277
16611474,WERRIBEE,3030,460.0,1999.0,"Thursday, 28 August 2025",2025-07-31,40,3,2,2.0,House,17 Canterbury Place,-37.892914,144.63464,2025-09-09 16:29:12,16611474,AS-4526-UU,10,0,0,False,House,House,ACE Real Estate,19089,"Alphie Jacob, Chloe Baira","Gas, Heating, Dishwasher",https://www.domain.com.au/17-canterbury-place-werribee-vic-3030-16611474
17666647,WERRIBEE,3030,530.0,2303.0,"Monday, 14 July 2025",2025-07-14,57,3,2,2.0,House,2 Riverside Avenue,-37.91221,144.65831,2025-09-09 16:29:12,17666647,,15,0,0,False,House,House,P Di Natale Real Estate,15264,Bianca Lixon,"Built in wardrobes, Dishwasher, Floorboards, Study, Split-System Air Conditioning, Split-System Heating",https://www.domain.com.au/2-riverside-avenue-werribee-vic-3030-17666647
17719512,WERRIBEE,3030,500.0,2173.0,"Monday, 18 August 2025",2025-08-18,22,4,2,4.0,House,10 Bunton Court,-37.888916,144.6466,2025-09-09 16:29:12,17719512,,16,0,1,False,House,House,Area Specialist Wyndham,34164,"Kayla Kelly, Nikki Suhalka","Gas, Heating, Dishwasher",https://www.domain.com.au/10-bunton-court-werribee-vic-3030-17719512
17726263,WERRIBEE,3030,480.0,2086.0,"Tuesday, 26 August 2025",2025-08-21,19,4,2,2.0,House,27 Flint Street,-37.90929,144.59525,2025-09-09 16:29:12,17726263,,12,0,0,False,House,House,ACE Real Estate,19089,"Riya Sharma, Ajitesh Arora","Secure Parking, Heating, Solar panels",https://www.domain.com.au/27-flint-street-werribee-vic-3030-17726263
17729143,WERRIBEE,3030,550.0,2390.0,"Saturday, 20 September 2025",2025-08-25,15,4,2,2.0,House,22 Macadamia Grove,-37.893845,144.66542,2025-09-09 16:29:12,17729143,,15,0,1,False,House,House,Beyond Property,33270,Waran Naidu,"Air conditioning, Secure Parking, Garden / Courtyard, Fully fenced, Broadband internet access, Built in wardrobes, Dishwasher, Floorboards, Gas Heating, Pay TV Access, Out door entertaining area, Rumpus Room, Internal Laundry, Pets Allowed",https://www.domain.com.au/22-macadamia-grove-werribee-vic-3030-17729143
17740947,WERRIBEE,3030,460.0,1999.0,"Wednesday, 01 October 2025",2025-09-01,8,3,1,2.0,House,2 Curlew Place,-37.87724,144.67134,2025-09-09 16:29:12,17740947,,11,0,1,False,House,House,.established Property,4979,Established Property Leasing,Heating,https://www.domain.com.au/2-curlew-place-werribee-vic-3030-17740947
